Name,Address,EMD Amount in ₹,EMD Exemption Allowed,EMD Fee Type,EMD Percentage,EMD Payable To,EMD Payable At,Cover No,Cover,Document Type,Description,Organisation Chain,Tender Reference Number,Tender ID,Withdrawal Allowed,Tender Type,Form of contract,Tender Category,No. of Covers,General Technical Evaluation Allowed,ItemWise Technical Evaluation Allowed,Payment Mode,Is Multi Currency Allowed For BOQ,Is Multi Currency Allowed For Fee,Allow Two Stage Bidding,Publish Date,Bid Opening Date,Document Download / Sale Start Date,Document Download / Sale End Date,Clarification Start Date,Clarification End Date,Bid Submission Start Date,Bid Submission End Date,Financial Bid Opening Date,Tender Fee in ₹,VAT Charges in ₹,Fee Payable To,Fee Payable At,Tender Fee Exemption Allowed,S.No,Bank Name,Title,Work Description,Pre Qualification Details,Independent External Monitor/Remarks,Tender Value in ₹,Product Category,Sub category,Contract Type,Bid Validity(Days),Period Of Work(Days),Location,Pincode,Pre Bid Meeting Place,Pre Bid Meeting Address,Pre Bid Meeting Date,Bid Opening Place,Should Allow NDA Tender,Allow Preferential Bidder,Tender Stage,Committee Chairperson/Co-ordinator Name :,Committee Chairperson/Co-ordinator Type :,Committee Members :,Updated By :,Updated On :,Financial Bid Opening Date:,Document :,Organisation Chain :,Tender ID :,Tender Ref No :,Tender Title :,S.No,Bid Number,Bidder Name,Awarded Currency,Awarded Value,Type :,Summary :,Updated By :.1,Updated On :.1,Document :.1,S.No.1,Bid Number.1,Bidder Name.1,Submitted Date,Status,Remarks,Status Updated On,Type :.1,Summary :.1,Updated By :.2,Updated On :.2,Document :.2,BOQ Comparative Chart :,Committee Chairperson/Co-ordinator Name :.1,Committee Chairperson/Co-ordinator Type :.1,Committee Members :.1,Updated By :.3,Updated on :,Document :.3,Contract Date :,Total Contract Value :,Work Completion Period in days :,Updated By :.4,Updated on :.1,AOC document :,Tender Stage
Chief Construction Engineer,"O/O THE C.C.E.R.W.CIRCLE, BHAWANIPATNA","6,11,950",Yes,percentage,1.0%,Nil,Nil,1.0,Fee/PreQual/Technical,.pdf,"Paper cost, EMD, GST, PAN, RC, Affidavit correctness certificate and no relation certificate",CE RW I||RWCIRCLE-BHAWANIPATNA,BPT/Online-28/2022-23,2023_CERWI_87061_7,Yes,National Competitive Bid,Percentage,Works,2.0,No,No,Online,No,No,No,18-Mar-2023 06:00 PM,04-Apr-2023 11:00 AM,18-Mar-2023 06:00 PM,03-Apr-2023 05:00 PM,18-Mar-2023 06:00 PM ,31-Mar-2023 05:00 PM ,18-Mar-2023 06:00 PM,03-Apr-2023 05:00 PM,04-May-2023 11:00 AM,"10,000",0.0,Nil,Nil,No,1.0,ICICI BANK,Constriction of bridge over River Sundar at 3/000Km. on Barandapal to to Barandajore Road under BSY,Constriction of bridge over River Sundar at 3/000Km. on Barandapal to to Barandajore Road under BSY,Please refer Tender documents. ,NA ,"6,11,95,000",Civil Works - Bridges,NA ,Tender,90.0,720.0,NUAPADA/NUAPADA,766105.0,NA ,NA ,NA ,"O/O THE C.C.E.R.W.CIRCLE, BHAWANIPATNA",No ,No,AOC,Debendra Kumar Seth,Internal,,Debendra Kumar Seth,29-Apr-2023 07:14 PM,04-May-2023 11:00 AM,techsummary_431514.pdf (159.61 KB),CE RW I||RWCIRCLE-BHAWANIPATNA,2023_CERWI_87061_7,BPT/Online-28/2022-23,Constriction of bridge over River Sundar at 3/000Km. on Barandapal to to Barandajore Road under BSY,1.0,2108859.0,M/S SHREE SHYAM INFRA PROP. SRI LOKESH SHARMA,INR,"52,021,992",Technical,05 NOS. BIDDERS ARE PARTICIPATED,Pradeep Kisan,04-Apr-2023 12:45 PM,,1,2107688,BIJAY KUMAR SAHU,03-Apr-2023 04:10 PM,Rejected-Technical,Disqualified,29-Apr-2023 07:14 PM,Finance,4NOS. BIDDERS PRICE BID OPENED,Pradeep Kisan,04-May-2023 12:02 PM,,BOQ Comparative Chart,DK SETH,Internal,,Pradeep Kisan,15-Aug-2023 01:09 PM,finsummary_431514.pdf (641.12 KB),15-Aug-2023,"INR 61,195,144",720.0,Pradeep Kisan,15-Aug-2023 01:10 PM,798.pdf (641.00 KB),AOC
,,,,,,,,,,.pdf,"Work in hand, ATO, Similar nature of work, Machineries and other documents as per DTCN",,,,,,,,,,,,,,,,,,,,,,,,,,,,,2.0,ICICI NEFT/RTGS,,,,,,,,,,,,,,,,,,,AOC,,,,,,,,,,,,,,,,,,,,,,2,2107693,GOPAL CHANDRA SAHU,03-Apr-2023 10:51 AM,Rejected-Finance,L3,15-Aug-2023 01:09 PM,,,,,,,,,,,,,,,,,,,AOC
,,,,,,,,2.0,Finance,.xls,Bill of Quantities,,,,,,,,,,,,,,,,,,,,,,,,,,,,,,,,,,,,,,,,,,,,,,,,,AOC,,,,,,,,,,,,,,,,,,,,,,3,2108859,M/S SHREE SHYAM INFRA PROP. SRI LOKESH SHARMA,03-Apr-2023 04:27 PM,Accepted-AOC,l1 tender accepted,15-Aug-2023 01:11 PM,,,,,,,,,,,,,,,,,,,AOC
,,,,,,,,,,,,,,,,,,,,,,,,,,,,,,,,,,,,,,,,,,,,,,,,,,,,,,,,,,,,AOC,,,,,,,,,,,,,,,,,,,,,,4,2108976,NAKUL KUMAR AGRAWAL,03-Apr-2023 03:56 PM,Rejected-Finance,L2,15-Aug-2023 01:09 PM,,,,,,,,,,,,,,,,,,,AOC
,,,,,,,,,,,,,,,,,,,,,,,,,,,,,,,,,,,,,,,,,,,,,,,,,,,,,,,,,,,,AOC,,,,,,,,,,,,,,,,,,,,,,5,2107691,Sachin Agarwal,02-Apr-2023 02:13 PM,Rejected-Finance,L4,15-Aug-2023 01:09 PM,,,,,,,,,,,,,,,,,,,AOC
