EMD Amount in ₹,EMD Exemption Allowed,EMD Fee Type,EMD Percentage,EMD Payable To,EMD Payable At,Organisation Chain,Tender Reference Number,Tender ID,Withdrawal Allowed,Tender Type,Form of contract,Tender Category,No. of Covers,General Technical Evaluation Allowed,ItemWise Technical Evaluation Allowed,Payment Mode,Is Multi Currency Allowed For BOQ,Is Multi Currency Allowed For Fee,Allow Two Stage Bidding,Name,Address,Tender Fee in ₹,VAT Charges in ₹,Fee Payable To,Fee Payable At,Tender Fee Exemption Allowed,S.No,Bank Name,Title,Work Description,Pre Qualification Details,Independent External Monitor/Remarks,Tender Value in ₹,Product Category,Sub category,Contract Type,Bid Validity(Days),Period Of Work(Days),Location,Pincode,Pre Bid Meeting Place,Pre Bid Meeting Address,Pre Bid Meeting Date,Bid Opening Place,Should Allow NDA Tender,Allow Preferential Bidder,Publish Date,Bid Opening Date,Document Download / Sale Start Date,Document Download / Sale End Date,Clarification Start Date,Clarification End Date,Bid Submission Start Date,Bid Submission End Date,Cover No,Cover,Document Type,Description,Tender Stage,Committee Chairperson/Co-ordinator Name :,Committee Chairperson/Co-ordinator Type :,Committee Members :,Updated By :,Updated On :,Document :,Organisation Chain :,Tender ID :,Tender Ref No :,Tender Title :,S.No,Bid Number,Bidder Name,Awarded Currency,Awarded Value,S.No.1,Bid Number.1,Bidder Name.1,Submitted Date,Status,Remarks,Status Updated On,Committee Chairperson/Co-ordinator Name :.1,Committee Chairperson/Co-ordinator Type :.1,Committee Members :.1,Updated By :.1,Updated on :,Document :.1,Type :,Summary :,Updated By :.2,Updated On :.1,Document :.2,BOQ Comparative Chart :,Contract Date :,Total Contract Value :,Work Completion Period in days :,Updated By :.3,Updated on :.1,AOC document :,AOC Description :,Tender Stage
"13,700",Yes,fixed,,Nil,Nil,Rural Water Supply and Sanitation||RWSS Circle Cuttack||RWSS Division Kendrapara,RWS/31/2025-26,2025_RWSS_114981_1,Yes,Open Tender,Percentage,Works,1.0,No,No,Online,No,No,No,EE RWSS DIVISION KENDRAPARA,AT ICHHAPUR PO SHREE BALADEVJEW DIST KENDRAPARA,"6,000",0.0,Nil,Nil,No,1.0,ICICI BANK,External electrification for RPWS Scheme to Palasingha under Kendrapara Block in Kendrapara District,External electrification for RPWS Scheme to Palasingha under Kendrapara Block in Kendrapara District,Please refer Tender documents. ,NA ,"13,62,883",Civil Works - Water Works,NA ,Tender,90.0,30.0,PALASINGHA,754222.0,OFFICE OF THE EE RWSS DIVISION KENDRAPARA ,AT ICHHAPUR PO SHREE BALADEVJEW DIST KENDRAPARA ,02-Jul-2025 10:00 AM ,OFFICE OF THE EE RWSS DIVISION KENDRAPARA,No ,No,02-Jul-2025 10:00 AM,15-Jul-2025 11:00 AM,02-Jul-2025 10:00 AM,14-Jul-2025 05:30 PM,02-Jul-2025 10:00 AM ,04-Jul-2025 05:30 PM ,02-Jul-2025 10:00 AM,14-Jul-2025 05:30 PM,1.0,Fee/PreQual/Technical/Finance,.pdf,DTCN,AOC,Executive Engineer,Internal,"DAO , AEE ESTIMATOR , AE ESTIMATOR",Basanta Kumar Nayak,01-Dec-2025 06:09 PM,techsummary_544694.pdf (1136.22 KB),Rural Water Supply and Sanitation||RWSS Circle Cuttack||RWSS Division Kendrapara,2025_RWSS_114981_1,RWS/31/2025-26,External electrification for RPWS Scheme to Palasingha under Kendrapara Block in Kendrapara District,1.0,2999196.0,M/S. MAA LAXMI ELECTRICALS,INR,"1,367,133",1,2995440,ABHISHEKA SARANGI,10-Jul-2025 06:17 PM,Rejected-Finance,Loser in lottery drawl,01-Dec-2025 06:12 PM,Executive Engineer,Internal,"DAO, AEE Estimator, AE Estimator",Basanta Kumar Nayak,01-Dec-2025 06:12 PM,finsummary_544694.pdf (1136.22 KB),Finance,Only seven bidders have participated in the tender and their documents downloaded for taking further course of action,Basanta Kumar Nayak,15-Jul-2025 12:11 PM,,BOQ Comparative Chart,01-Dec-2025,"INR 1,367,133",30.0,Basanta Kumar Nayak,01-Dec-2025 06:14 PM,wopalasimghaelec.pdf (1618.00 KB),L1 bidder won the lottery and got awarded the work with 14.99 percentage less,AOC
,,,,,,,,,,,,,,,,,,,,,,,,,,,2.0,ICICI NEFT/RTGS,,,,,,,,,,,,,,,,,,,,,,,,,,,,,.xls,BOQ,AOC,,,,,,,,,,,,,,,,2,2995506,BABA BAKRESWAR ELECTRICALS AND CONSTRUCTION,10-Jul-2025 07:03 PM,Rejected-Finance,Loser in lottery drawl,01-Dec-2025 06:12 PM,,,,,,,,,,,,,,,,,,,,AOC
,,,,,,,,,,,,,,,,,,,,,,,,,,,,,,,,,,,,,,,,,,,,,,,,,,,,,,,,,,,AOC,,,,,,,,,,,,,,,,3,2992951,KAMALAKANTA MOHARANA,11-Jul-2025 03:03 PM,Rejected-Finance,Loser in lottery drawl,01-Dec-2025 06:12 PM,,,,,,,,,,,,,,,,,,,,AOC
,,,,,,,,,,,,,,,,,,,,,,,,,,,,,,,,,,,,,,,,,,,,,,,,,,,,,,,,,,,AOC,,,,,,,,,,,,,,,,4,2999196,M/S. MAA LAXMI ELECTRICALS,14-Jul-2025 03:51 PM,Accepted-AOC,L1 bidder won the lottery and got awarded the work with 14.99 percentage less,01-Dec-2025 06:14 PM,,,,,,,,,,,,,,,,,,,,AOC
,,,,,,,,,,,,,,,,,,,,,,,,,,,,,,,,,,,,,,,,,,,,,,,,,,,,,,,,,,,AOC,,,,,,,,,,,,,,,,5,2987451,Sri Bishnu Electrical Construction,14-Jul-2025 04:49 PM,Rejected-Finance,Loser in lottery drawl,01-Dec-2025 06:12 PM,,,,,,,,,,,,,,,,,,,,AOC
,,,,,,,,,,,,,,,,,,,,,,,,,,,,,,,,,,,,,,,,,,,,,,,,,,,,,,,,,,,AOC,,,,,,,,,,,,,,,,6,2999297,SRIKANT MALLIK,14-Jul-2025 04:53 PM,Rejected-Finance,Loser in lottery drawl,01-Dec-2025 06:12 PM,,,,,,,,,,,,,,,,,,,,AOC
,,,,,,,,,,,,,,,,,,,,,,,,,,,,,,,,,,,,,,,,,,,,,,,,,,,,,,,,,,,AOC,,,,,,,,,,,,,,,,7,2995411,Trupti Electrical,10-Jul-2025 05:40 PM,Rejected-Finance,Loser in lottery drawl,01-Dec-2025 06:12 PM,,,,,,,,,,,,,,,,,,,,AOC
