Name,Address,Publish Date,Bid Opening Date,Document Download / Sale Start Date,Document Download / Sale End Date,Clarification Start Date,Clarification End Date,Bid Submission Start Date,Bid Submission End Date,Cover No,Cover,Document Type,Description,Title,Work Description,Pre Qualification Details,Independent External Monitor/Remarks,Tender Value in ₹,Product Category,Sub category,Contract Type,Bid Validity(Days),Period Of Work(Days),Location,Pincode,Pre Bid Meeting Place,Pre Bid Meeting Address,Pre Bid Meeting Date,Bid Opening Place,Should Allow NDA Tender,Allow Preferential Bidder,Organisation Chain,Tender Reference Number,Tender ID,Withdrawal Allowed,Tender Type,Form of contract,Tender Category,No. of Covers,General Technical Evaluation Allowed,ItemWise Technical Evaluation Allowed,Payment Mode,Is Multi Currency Allowed For BOQ,Is Multi Currency Allowed For Fee,Allow Two Stage Bidding,EMD Amount in ₹,EMD Exemption Allowed,EMD Fee Type,EMD Percentage,EMD Payable To,EMD Payable At,Tender Fee in ₹,VAT Charges in ₹,Fee Payable To,Fee Payable At,Tender Fee Exemption Allowed,S.No,Bank Name,Tender Stage,S.No,Bid Number,Bidder Name,Submitted Date,Status,Remarks,Status Updated On,Committee Chairperson/Co-ordinator Name :,Committee Chairperson/Co-ordinator Type :,Committee Members :,Updated By :,Updated on :,Document :,Type :,Summary :,Updated By :.1,Updated On :,Document :.1,BOQ Comparative Chart :,Contract Date :,Total Contract Value :,Work Completion Period in days :,Updated By :.2,Updated on :.1,AOC document :,AOC Description :,Committee Chairperson/Co-ordinator Name :.1,Committee Chairperson/Co-ordinator Type :.1,Committee Members :.1,Updated By :.3,Updated On :.1,Document :.2,Organisation Chain :,Tender ID :,Tender Ref No :,Tender Title :,S.No.1,Bid Number.1,Bidder Name.1,Awarded Currency,Awarded Value,Tender Stage
"Executive Engineer, L.I Division, Phulbani","Executive Engineer, L.I Division, Phulbani",14-Oct-2025 11:00 AM,24-Oct-2025 11:00 AM,14-Oct-2025 11:00 AM,23-Oct-2025 05:30 PM,14-Oct-2025 11:00 AM ,20-Oct-2025 05:30 PM ,14-Oct-2025 11:00 AM,23-Oct-2025 05:30 PM,1.0,Fee/PreQual/Technical/Finance,.pdf,"Cost of TP GSTIN Registration Certificate, PAN, Affidavit, Schedules and other documents as per DTCN",Installation of Titrapanga RL Lift Irrigation Project under Khajuripada Block in Kandhamal District,Installation of Titrapanga RL Lift Irrigation Project under Khajuripada Block in Kandhamal District,Please refer Tender documents. ,NA ,"22,76,862",Civil Works - Lift Irrigation Schemes,NA ,Tender,90.0,90.0,Khajuripada,762012.0,NA ,NA ,NA ,"L.I Division, Phulbani",No ,No,Orissa Lift Irrigation Corporation||LI Southern Circle Berhampur||LI Division Phulbani,02/2025-26 OLIC (PLB),2025_OLIC_119181_3,Yes,Open Tender,Percentage,Works,1.0,No,No,Online,No,No,No,"22,769",Yes,percentage,1.0%,Nil,Nil,"7,080",0.0,Nil,Nil,No,1.0,ICICI BANK,AOC,1,3146047,ALOK KUMAR SETHY,23-Oct-2025 04:02 PM,Rejected-Technical,Not Qualified for AOC,23-Dec-2025 02:00 PM,Jagabandhu Puhan EE,Internal,"J Puhan EE LI PLB, S Sahu AEE Estr LI PLB, S Panda AEE LI PLB, L Sur DA LI PLB",JAGABANDHU PUHAN,31-Dec-2025 11:29 AM,finsummary_555218.pdf (28.47 KB),Finance,Tender Opened,JAGABANDHU PUHAN,24-Oct-2025 04:39 PM,finance_555218.pdf,BOQ Comparative Chart,31-Dec-2025,"INR 2,525,764",90.0,JAGABANDHU PUHAN,31-Dec-2025 11:39 AM,03.pdf (520.00 KB),WO NO. 1535 Dt. 20.11.2025,Jagabandhu Puhan EE,Internal,"J Puhan EE LI PLB, S Sahu AEE Estr LI PLB, S Panda AEE LI PLB, L Sur DA LI PLB",JAGABANDHU PUHAN,23-Dec-2025 02:00 PM,techsummary_555218.pdf (28.48 KB),Orissa Lift Irrigation Corporation||LI Southern Circle Berhampur||LI Division Phulbani,2025_OLIC_119181_3,02/2025-26 OLIC (PLB),Installation of Titrapanga RL Lift Irrigation Project under Khajuripada Block in Kandhamal District,1.0,3141948.0,PRAKASH BEHERA,INR,"2,525,764",AOC
,,,,,,,,,,,,.xls,Bill of Quantity,,,,,,,,,,,,,,,,,,,,,,,,,,,,,,,,,,,,,,,,,,,,2.0,ICICI NEFT/RTGS,AOC,2,3145613,BISHAL AGRAWALLA,23-Oct-2025 02:04 PM,Rejected-Technical,Not Qualified for AOC,23-Dec-2025 02:00 PM,,,,,,,,,,,,,,,,,,,,,,,,,,,,,,,,,,,AOC
,,,,,,,,,,,,,,,,,,,,,,,,,,,,,,,,,,,,,,,,,,,,,,,,,,,,,,,,,,,AOC,3,3144303,GITANJALI SARANGI PROPRIETOR- GITANJALI ENTERPRISES,22-Oct-2025 10:21 PM,Rejected-Technical,Not Qualified for AOC,23-Dec-2025 02:00 PM,,,,,,,,,,,,,,,,,,,,,,,,,,,,,,,,,,,AOC
,,,,,,,,,,,,,,,,,,,,,,,,,,,,,,,,,,,,,,,,,,,,,,,,,,,,,,,,,,,AOC,4,3144345,JITENDRA SARANGI,22-Oct-2025 10:49 PM,Rejected-Technical,Not Qualified for AOC,23-Dec-2025 02:00 PM,,,,,,,,,,,,,,,,,,,,,,,,,,,,,,,,,,,AOC
,,,,,,,,,,,,,,,,,,,,,,,,,,,,,,,,,,,,,,,,,,,,,,,,,,,,,,,,,,,AOC,5,3141948,PRAKASH BEHERA,23-Oct-2025 07:51 AM,Accepted-AOC,Work Order Issued,31-Dec-2025 11:40 AM,,,,,,,,,,,,,,,,,,,,,,,,,,,,,,,,,,,AOC
,,,,,,,,,,,,,,,,,,,,,,,,,,,,,,,,,,,,,,,,,,,,,,,,,,,,,,,,,,,AOC,6,3144190,Sri Ganesh Chandra Behera,22-Oct-2025 10:41 PM,Rejected-Technical,Not Qualified for AOC,23-Dec-2025 02:00 PM,,,,,,,,,,,,,,,,,,,,,,,,,,,,,,,,,,,AOC
