Title,Work Description,Pre Qualification Details,Independent External Monitor/Remarks,Tender Value in ₹,Product Category,Sub category,Contract Type,Bid Validity(Days),Period Of Work(Days),Location,Pincode,Pre Bid Meeting Place,Pre Bid Meeting Address,Pre Bid Meeting Date,Bid Opening Place,Should Allow NDA Tender,Allow Preferential Bidder,Cover No,Cover,Document Type,Description,S.No,Bank Name,EMD Amount in ₹,EMD Exemption Allowed,EMD Fee Type,EMD Percentage,EMD Payable To,EMD Payable At,Organisation Chain,Tender Reference Number,Tender ID,Withdrawal Allowed,Tender Type,Form of contract,Tender Category,No. of Covers,General Technical Evaluation Allowed,ItemWise Technical Evaluation Allowed,Payment Mode,Is Multi Currency Allowed For BOQ,Is Multi Currency Allowed For Fee,Allow Two Stage Bidding,Publish Date,Bid Opening Date,Document Download / Sale Start Date,Document Download / Sale End Date,Clarification Start Date,Clarification End Date,Bid Submission Start Date,Bid Submission End Date,Financial Bid Opening Date,Tender Fee in ₹,Fee Payable To,Fee Payable At,Tender Fee Exemption Allowed,Name,Address,Tender Stage,S.No,Bid Number,Bidder Name,Submitted Date,Status,Remarks,Status Updated On,Contract Date :,Total Contract Value :,Work Completion Period in days :,Updated By :,Updated on :,AOC document :,AOC Description :,Committee Chairperson/Co-ordinator Name :,Committee Chairperson/Co-ordinator Type :,Committee Members :,Updated By :.1,Updated On :,Financial Bid Opening Date:,Document :,Type :,Summary :,Updated By :.2,Updated On :.1,Document :.1,Type :.1,Summary :.1,Updated By :.3,Updated On :.2,Document :.2,Organisation Chain :,Tender ID :,Tender Ref No :,Tender Title :,Committee Chairperson/Co-ordinator Name :.1,Committee Chairperson/Co-ordinator Type :.1,Committee Members :.1,Updated By :.4,Updated on :.1,Document :.3,S.No.1,Bid Number.1,Bidder Name.1,Awarded Currency,Awarded Value,Tender Stage
Selection of Agency for providing Manpower to ORMAS for 10K FPO Scheme,Selection of Agency for providing Manpower to ORMAS for 10K FPO Scheme,Please refer Tender documents. ,NA ,,Human Resources Supply,NA ,Tender,120.0,NA ,ORMAS SIRD and PR Campus Unit 8 Bhubaneswar,751012.0,ORMAS CONFERENCE HALL BHUBANESWAR ,ORMAS SIRD and PR Campus Unit 8 Bhubaneswar ,28-May-2025 11:30 AM ,ORMAS SIRD and PR Campus Unit 8 Bhubaneswar,No ,No,1.0,Fee/PreQual/Technical,.pdf,Document as per DTCN,1.0,ICICI BANK,"6,00,000",No,fixed,,Nil,Nil,Panchayati Raj and Drinking Water Department Odisha||ORMAS,1654/19.05.2025,2025_ORMAS_113613_1,Yes,Open Tender,EOI,Services,2.0,No,No,Online,No,No,No,20-May-2025 10:00 AM,11-Jun-2025 03:00 PM,20-May-2025 10:00 AM,10-Jun-2025 02:00 PM,20-May-2025 10:00 AM ,26-May-2025 05:30 PM ,20-May-2025 10:00 AM,10-Jun-2025 02:00 PM,16-Jun-2025 12:40 PM,"11,800",Nil,Nil,No,CHIEF EXECUTIVE OFFICER ORMAS,ORMAS SIRD and PR Campus Unit 8 Bhubaneswar,AOC,1,2954779,Bhumisree Consultancy and Marketing Pvt. Ltd.,10-Jun-2025 12:06 PM,Accepted-AOC,H1,04-Dec-2025 08:00 PM,21-Jul-2025,"INR 18,499,800",365.0,Banita Das,04-Dec-2025 08:00 PM,LetterofIntenttoBhumisreeConsultancyforCBBOProject.pdf (2563.00 KB),Letter of Intent to Bhumisree Consultancy for CBBO Project,CEO ORMAS,Mixed,"Addl CEO Finance ORMAS, Joint Secretary PR and DW Deptt, Auditor ORMAS, Dy CEO ORMAS",Chitta Ranjan Pattnaik,16-Jun-2025 12:07 PM,16-Jun-2025 12:40 PM,techsummary_540188.pdf (1106.00 KB),Finance,"2 Bidders are Qualified in the Technical Bid Evaluation. In the financial bid out of the 2 Qualified Bidders, Bhumisree Consultancy and Marketing Pvt. Ltd. is the L1 Bidder as per the RFP and qualified for the AOC.",Chitta Ranjan Pattnaik,17-Jun-2025 01:08 PM,finance_540188.pdf,Technical,Out of the 5 bidders only 2 namely T and M Services Consulting Pvt Ltd and Bhumisree Consultancy and Mktg Pvt Ltd are technically qualified,Chitta Ranjan Pattnaik,16-Jun-2025 12:01 PM,technical_540188.pdf,Panchayati Raj and Drinking Water Department Odisha||ORMAS,2025_ORMAS_113613_1,1654/19.05.2025,Selection of Agency for providing Manpower to ORMAS for 10K FPO Scheme,CEO ORMAS,Mixed,"Addl CEO Finance ORMAS, Auditor ORMAS, Dy CEO ORMAS",Chitta Ranjan Pattnaik,17-Jun-2025 01:16 PM,finsummary_540188.pdf (831.12 KB),1.0,2954779.0,Bhumisree Consultancy and Marketing Pvt. Ltd.,INR,"18,499,800",AOC
,,,,,,,,,,,,,,,,,,2.0,Finance,.pdf,Financial Bid,2.0,ICICI NEFT/RTGS,,,,,,,,,,,,,,,,,,,,,,,,,,,,,,,,,,,,AOC,2,2953986,Kaapro Management Solutions Pvt. Ltd.,09-Jun-2025 02:35 PM,Not Admitted-Fee/PreQual/Technical,Not Complied with technical specification,16-Jun-2025 12:01 PM,,,,,,,,,,,,,,,,,,,,,,,,,,,,,,,,,,,,,,,,AOC
,,,,,,,,,,,,,,,,,,,,,,,,,,,,,,,,,,,,,,,,,,,,,,,,,,,,,,,,,,,AOC,3,2958869,L&K Services Private Limited,10-Jun-2025 11:04 AM,Not Admitted-Fee/PreQual/Technical,Not Complied with technical specification,16-Jun-2025 12:01 PM,,,,,,,,,,,,,,,,,,,,,,,,,,,,,,,,,,,,,,,,AOC
,,,,,,,,,,,,,,,,,,,,,,,,,,,,,,,,,,,,,,,,,,,,,,,,,,,,,,,,,,,AOC,4,2948721,Red Tech Solutions India Private Limited,09-Jun-2025 04:16 PM,Not Admitted-Fee/PreQual/Technical,Not Complied with technical specification,16-Jun-2025 12:01 PM,,,,,,,,,,,,,,,,,,,,,,,,,,,,,,,,,,,,,,,,AOC
,,,,,,,,,,,,,,,,,,,,,,,,,,,,,,,,,,,,,,,,,,,,,,,,,,,,,,,,,,,AOC,5,2959166,T AND M SERVICES CONSULTING PVT LTD,10-Jun-2025 01:10 PM,Not Admitted-Finance,Not qualified for AOC,17-Jun-2025 01:08 PM,,,,,,,,,,,,,,,,,,,,,,,,,,,,,,,,,,,,,,,,AOC
