Committee Chairperson/Co-ordinator Name :,Committee Chairperson/Co-ordinator Type :,Committee Members :,Updated By :,Updated On :,Document :,Contract Date :,Total Contract Value :,Work Completion Period in days :,Updated By :.1,Updated on :,AOC document :,AOC Description :,S.No,Bid Number,Bidder Name,Submitted Date,Status,Remarks,Status Updated On,S.No.1,Bid Number.1,Bidder Name.1,Awarded Currency,Awarded Value,Type :,Summary :,Updated By :.2,Updated On :.1,Document :.1,BOQ Comparative Chart :,Committee Chairperson/Co-ordinator Name :.1,Committee Chairperson/Co-ordinator Type :.1,Committee Members :.1,Updated By :.3,Updated on :.1,Document :.2,Organisation Chain :,Tender ID :,Tender Ref No :,Tender Title :,Tender Stage,Organisation Chain,Tender Reference Number,Tender ID,Withdrawal Allowed,Tender Type,Form of contract,Tender Category,No. of Covers,General Technical Evaluation Allowed,ItemWise Technical Evaluation Allowed,Payment Mode,Is Multi Currency Allowed For BOQ,Is Multi Currency Allowed For Fee,Allow Two Stage Bidding,Name,Address,Publish Date,Bid Opening Date,Document Download / Sale Start Date,Document Download / Sale End Date,Clarification Start Date,Clarification End Date,Bid Submission Start Date,Bid Submission End Date,Cover No,Cover,Document Type,Description,Tender Fee in ₹,VAT Charges in ₹,Fee Payable To,Fee Payable At,Tender Fee Exemption Allowed,S.No,Bank Name,EMD Amount in ₹,EMD Exemption Allowed,EMD Fee Type,EMD Percentage,EMD Payable To,EMD Payable At,Title,Work Description,Pre Qualification Details,Independent External Monitor/Remarks,Tender Value in ₹,Product Category,Sub category,Contract Type,Bid Validity(Days),Period Of Work(Days),Location,Pincode,Pre Bid Meeting Place,Pre Bid Meeting Address,Pre Bid Meeting Date,Bid Opening Place,Should Allow NDA Tender,Allow Preferential Bidder,Tender Stage
EE/DAO,Internal,EE/DAO,Mahendra Kalet,23-Oct-2025 03:34 PM,techsummary_528544.pdf (550.21 KB),23-Oct-2025,"INR 3,334,064",270.0,Mahendra Kalet,23-Oct-2025 03:46 PM,SCB_Marlanga.pdf (550.00 KB),"Successful bidder Sri Siba Nayak ,C Class Contractor declared as winner in lottery.",1.0,2816577.0,BILARSEN PARASETH,15-Feb-2025 01:28 PM,Rejected-Finance,Unsuccessful bidder,23-Oct-2025 03:44 PM,1.0,2817161.0,SIBA NAYAK,INR,"3,334,064",Finance,"Successful bidder Sri Siba Nayak ,C Class Contractor declared as winner in lottery",Abhilas Paramguru Mishra,22-Oct-2025 04:08 PM,finance_528544.pdf,BOQ Comparative Chart,EE/DAO,Internal,EE/DAO,Mahendra Kalet,23-Oct-2025 03:44 PM,finsummary_528544.pdf (550.21 KB),CE RW I||RWCIRCLE-BERHAMPUR||EE RW Divn. Baliguda,2024_CERWI_108766_1,Online Tender/02/EERWD/BLG-2024-25,Construction of Sub-Centre Building at Marlanga of Kotagarh Block in the District of Kandhamal for the year 2023-24,AOC,CE RW I||RWCIRCLE-BERHAMPUR||EE RW Divn. Baliguda,Online Tender/02/EERWD/BLG-2024-25,2024_CERWI_108766_1,Yes,National Competitive Bid,Percentage,Works,1.0,No,No,Online,No,No,No,Executive Engineer RWD Balliguda,Executive Engineer RWD Balliguda,06-Feb-2025 10:00 AM,17-Feb-2025 11:30 AM,06-Feb-2025 10:00 AM,15-Feb-2025 05:00 PM,06-Feb-2025 10:00 AM ,14-Feb-2025 04:00 PM ,06-Feb-2025 10:00 AM,15-Feb-2025 05:00 PM,1.0,Fee/PreQual/Technical/Finance,.pdf,"Valid Contract RC, GSTIN, PAN CARD, Affidavit, Cost of Tender Paper and cost of EMD through online","6,000",0.0,Nil,Nil,No,1.0,ICICI BANK,"39,220",Yes,fixed,,Nil,Nil,Construction of Sub-Centre Building at Marlanga of Kotagarh Block in the District of Kandhamal for the year 2023-24,Construction of Sub-Centre Building at Marlanga of Kotagarh Block in the District of Kandhamal for the year 2023-24,Please refer Tender documents. ,NA ,"39,21,967",Civil Works - Buildings,NA ,Tender,90.0,270.0,Balliguda/Kandhamal,762103.0,NA ,NA ,NA ,Executive Engineer RWD Balliguda,No ,No,AOC
,,,,,,,,,,,,,2.0,2817644.0,PRIYABRATA PARIDA,14-Feb-2025 01:06 PM,Rejected-Finance,Unsuccessful bidder,23-Oct-2025 03:44 PM,,,,,,,,,,,,,,,,,,,,,,AOC,,,,,,,,,,,,,,,,,,,,,,,,,,,.pdf,"Valid Mail lD, Mobile No, Whatsapp No.",,,,,,2.0,ICICI NEFT/RTGS,,,,,,,,,,,,,,,,,,,,,,,,,AOC
,,,,,,,,,,,,,3.0,2817161.0,SIBA NAYAK,15-Feb-2025 03:46 AM,Accepted-AOC,"Successful bidder Sri Siba Nayak ,C Class Contractor declared as winner in lottery.",23-Oct-2025 03:46 PM,,,,,,,,,,,,,,,,,,,,,,AOC,,,,,,,,,,,,,,,,,,,,,,,,,,,.pdf,Affidavit for Claiming Price Preface in Respect of SC/ST Contactor,,,,,,,,,,,,,,,,,,,,,,,,,,,,,,,,AOC
,,,,,,,,,,,,,,,,,,,,,,,,,,,,,,,,,,,,,,,,,AOC,,,,,,,,,,,,,,,,,,,,,,,,,,,.pdf,Affidavit regarding no relation certificate with department officers,,,,,,,,,,,,,,,,,,,,,,,,,,,,,,,,AOC
,,,,,,,,,,,,,,,,,,,,,,,,,,,,,,,,,,,,,,,,,AOC,,,,,,,,,,,,,,,,,,,,,,,,,,,.xls,BoQ,,,,,,,,,,,,,,,,,,,,,,,,,,,,,,,,AOC
,,,,,,,,,,,,,,,,,,,,,,,,,,,,,,,,,,,,,,,,,AOC,,,,,,,,,,,,,,,,,,,,,,,,,,,.pdf,NIT,,,,,,,,,,,,,,,,,,,,,,,,,,,,,,,,AOC
