Organisation Chain,Tender Reference Number,Tender ID,Withdrawal Allowed,Tender Type,Form of contract,Tender Category,No. of Covers,General Technical Evaluation Allowed,ItemWise Technical Evaluation Allowed,Payment Mode,Is Multi Currency Allowed For BOQ,Is Multi Currency Allowed For Fee,Allow Two Stage Bidding,Cover No,Cover,Document Type,Description,Publish Date,Bid Opening Date,Document Download / Sale Start Date,Document Download / Sale End Date,Clarification Start Date,Clarification End Date,Bid Submission Start Date,Bid Submission End Date,Tender Fee in ₹,Fee Payable To,Fee Payable At,Tender Fee Exemption Allowed,Name,Address,Title,Work Description,Pre Qualification Details,Independent External Monitor/Remarks,Tender Value in ₹,Product Category,Sub category,Contract Type,Bid Validity(Days),Period Of Work(Days),Location,Pincode,Pre Bid Meeting Place,Pre Bid Meeting Address,Pre Bid Meeting Date,Bid Opening Place,Should Allow NDA Tender,Allow Preferential Bidder,EMD Amount in ₹,EMD Exemption Allowed,EMD Fee Type,EMD Percentage,EMD Payable To,EMD Payable At,S.No,Bank Name,Tender Stage,Committee Chairperson/Co-ordinator Name :,Committee Chairperson/Co-ordinator Type :,Committee Members :,Updated By :,Updated on :,Document :,Organisation Chain :,Tender ID :,Tender Ref No :,Tender Title :,S.No,Bid Number,Bidder Name,Awarded Currency,Awarded Value,Type :,Summary :,Updated By :.1,Updated On :,Document :.1,BOQ Comparative Chart :,Contract Date :,Total Contract Value :,Work Completion Period in days :,Updated By :.2,Updated on :.1,AOC document :,S.No.1,Bid Number.1,Bidder Name.1,Submitted Date,Status,Remarks,Status Updated On,Committee Chairperson/Co-ordinator Name :.1,Committee Chairperson/Co-ordinator Type :.1,Committee Members :.1,Updated By :.3,Updated On :.1,Document :.2,Tender Stage
Panchayati Raj and Drinking Water Department Odisha||Zilla Parisad Jagatsinghpur||KUJANG Block,NOTICE NO.BDO-KPS-01 OF 2025-26,2025_PRBKJ_113148_2,Yes,Open Tender,Percentage,Works,1.0,No,No,Online,No,No,No,1.0,Fee/PreQual/Technical/Finance,.pdf,"Contractor R.C, Affidavit, NRC, undertakings, GSTIN, PAN and any other documents as per SBD/DTCN",06-May-2025 10:10 AM,20-May-2025 11:00 AM,06-May-2025 10:10 AM,19-May-2025 05:30 PM,NA ,NA ,06-May-2025 10:10 AM,19-May-2025 05:30 PM,"6,000",Nil,Nil,No,Block Development Officer,"Panchayat Samiti, Kujanga",Construction of Additional Class Room at Raghunathjew High School at Gandakipur G.P. of Kujanga Block,Civil Building Work,Please refer Tender documents. ,NA ,"15,32,172",Civil Works - Buildings,NA ,Tender,90.0,180.0,Kujanga,754141.0,NA ,NA ,NA ,"O/o the Panchayat Samiti, Kujanga",No ,No,"15,400",Yes,fixed,,Nil,Nil,1.0,ICICI BANK,AOC,Block Development Officer,Internal,,DEEPAK PRASAD SWAIN,09-Jul-2025 06:52 PM,finsummary_538597.pdf (326.77 KB),Panchayati Raj and Drinking Water Department Odisha||Zilla Parisad Jagatsinghpur||KUJANG Block,2025_PRBKJ_113148_2,NOTICE NO.BDO-KPS-01 OF 2025-26,Construction of Additional Class Room at Raghunathjew High School at Gandakipur G.P. of Kujanga Block,1.0,2922462.0,SURESH CHANDRA BHATTA,INR,"1,302,500",Finance,"On opening of the Technical and Financial Bid, it is found that all the 6 bidders have been participated in the tender",DEEPAK PRASAD SWAIN,22-May-2025 11:36 AM,,BOQ Comparative Chart,01-Nov-2025,"INR 1,302,500",180.0,DEEPAK PRASAD SWAIN,01-Nov-2025 01:30 PM,Bhatta.pdf (90.00 KB),1,2917121,ANASUYA MUDULI,13-May-2025 10:16 PM,Rejected-Finance,Due to unsuccessful tender on lottery system,09-Jul-2025 06:52 PM,Block Development Officer,Internal,,DEEPAK PRASAD SWAIN,09-Jul-2025 06:43 PM,techsummary_538597.pdf (326.77 KB),AOC
,,,,,,,,,,,,,,,,.xls,Bill of Quantity,,,,,,,,,,,,,,,,,,,,,,,,,,,,,,,,,,,,,,,2.0,ICICI NEFT/RTGS,AOC,,,,,,,,,,,,,,,,,,,,,,,,,,,,2,2923181,ARU PRASAD MOHANTY,19-May-2025 09:58 AM,Rejected-Finance,Due to unsuccessful tender on lottery system,09-Jul-2025 06:52 PM,,,,,,,AOC
,,,,,,,,,,,,,,,,,,,,,,,,,,,,,,,,,,,,,,,,,,,,,,,,,,,,,,,,,,AOC,,,,,,,,,,,,,,,,,,,,,,,,,,,,3,2912879,BISWARANJAN SAHOO,14-May-2025 11:59 AM,Rejected-Technical,Dis-Qualified,09-Jul-2025 06:43 PM,,,,,,,AOC
,,,,,,,,,,,,,,,,,,,,,,,,,,,,,,,,,,,,,,,,,,,,,,,,,,,,,,,,,,AOC,,,,,,,,,,,,,,,,,,,,,,,,,,,,4,2917696,KUMUDINI KUNDA,19-May-2025 11:29 AM,Rejected-Finance,Due to unsuccessful tender on lottery system,09-Jul-2025 06:52 PM,,,,,,,AOC
,,,,,,,,,,,,,,,,,,,,,,,,,,,,,,,,,,,,,,,,,,,,,,,,,,,,,,,,,,AOC,,,,,,,,,,,,,,,,,,,,,,,,,,,,5,2922462,SURESH CHANDRA BHATTA,18-May-2025 12:15 PM,Accepted-AOC,Work order issued in his favour,01-Nov-2025 01:30 PM,,,,,,,AOC
,,,,,,,,,,,,,,,,,,,,,,,,,,,,,,,,,,,,,,,,,,,,,,,,,,,,,,,,,,AOC,,,,,,,,,,,,,,,,,,,,,,,,,,,,6,2922440,TUSAR MALIK,17-May-2025 01:15 PM,Rejected-Finance,Due to unsuccessful tender on lottery system,09-Jul-2025 06:52 PM,,,,,,,AOC
