Organisation Chain,Tender Reference Number,Tender ID,Withdrawal Allowed,Tender Type,Form of contract,Tender Category,No. of Covers,General Technical Evaluation Allowed,ItemWise Technical Evaluation Allowed,Payment Mode,Is Multi Currency Allowed For BOQ,Is Multi Currency Allowed For Fee,Allow Two Stage Bidding,Title,Work Description,Pre Qualification Details,Independent External Monitor/Remarks,Tender Value in ₹,Product Category,Sub category,Contract Type,Bid Validity(Days),Period Of Work(Days),Location,Pincode,Pre Bid Meeting Place,Pre Bid Meeting Address,Pre Bid Meeting Date,Bid Opening Place,Should Allow NDA Tender,Allow Preferential Bidder,Name,Address,S.No,Bank Name,Cover No,Cover,Document Type,Description,EMD Amount in ₹,EMD Exemption Allowed,EMD Fee Type,EMD Percentage,EMD Payable To,EMD Payable At,Tender Fee in ₹,Fee Payable To,Fee Payable At,Tender Fee Exemption Allowed,Publish Date,Bid Opening Date,Document Download / Sale Start Date,Document Download / Sale End Date,Clarification Start Date,Clarification End Date,Bid Submission Start Date,Bid Submission End Date,Tender Stage,Organisation Chain :,Tender ID :,Tender Ref No :,Tender Title :,Committee Chairperson/Co-ordinator Name :,Committee Chairperson/Co-ordinator Type :,Committee Members :,Updated By :,Updated on :,Document :,Type :,Summary :,Updated By :.1,Updated On :,Document :.1,BOQ Comparative Chart :,S.No,Bid Number,Bidder Name,Awarded Currency,Awarded Value,Contract Date :,Total Contract Value :,Work Completion Period in days :,Updated By :.2,Updated on :.1,AOC document :,AOC Description :,S.No.1,Bid Number.1,Bidder Name.1,Submitted Date,Status,Remarks,Status Updated On,Committee Chairperson/Co-ordinator Name :.1,Committee Chairperson/Co-ordinator Type :.1,Committee Members :.1,Updated By :.3,Updated On :.1,Document :.2,Tender Stage
Panchayati Raj and Drinking Water Department Odisha||Zilla Parisad Rayagada||RAMANAGUDA Block,"PS-RAM,01/2025-26",2025_PZPRM_116163_3,Yes,Open Tender,Percentage,Works,1.0,No,No,Online,No,No,No,"Construction of ACR building at Ramanaguda UGHS, Ramanaguda","Construction of ACR building at Ramanaguda UGHS, Ramanaguda",As per DTCN ,NA ,"15,52,147",Civil Works - Buildings,NA ,Tender,120.0,90.0,Ramanaguda UGHS,765029.0,NA ,NA ,NA ,"Office of BDO, Ramanaguda",No ,No,"BDO, Ramanaguda","Office of Panchayat Samiti, Ramanaguda",1.0,ICICI BANK,1.0,Fee/PreQual/Technical/Finance,.pdf,"RC, GST, PAN, EMD, AFFIDAVITS, EXEMPTION CERTIFICATE IF ANY ETC. FOR THE CONSTRUCTION OF ACR","15,530",Yes,fixed,,Nil,Nil,"6,000",Nil,Nil,No,28-Jul-2025 11:00 AM,13-Aug-2025 11:30 AM,28-Jul-2025 11:00 AM,11-Aug-2025 05:00 PM,NA ,NA ,28-Jul-2025 11:00 AM,11-Aug-2025 05:00 PM,AOC,Panchayati Raj and Drinking Water Department Odisha||Zilla Parisad Rayagada||RAMANAGUDA Block,2025_PZPRM_116163_3,"PS-RAM,01/2025-26","Construction of ACR building at Ramanaguda UGHS, Ramanaguda","Block Developmnt Officer, Ramanaguda",Internal,"BEO, Ramanaguda, Sr. TC, SS, Ramanaguda, TC, SS, Ramanaguda",Pradyumna Mandal,24-Nov-2025 03:13 PM,finsummary_547579.pdf (1201.53 KB),Finance,"08 Bids has been opened for the work construction of ACR Building at Ramanaguda UGHS, Ramanaguda block",Pradyumna Mandal,14-Aug-2025 04:13 PM,,BOQ Comparative Chart,1.0,3025484.0,GOPAL KRUSHNA PANDA,INR,"1,319,480.02",24-Nov-2025,"INR 1,319,480.02",90.0,Pradyumna Mandal,24-Nov-2025 03:59 PM,AOCRAMANAGUDAUGHS.pdf (382.00 KB),AOC AWARDED TO L1 BIDDER,1,3031955,BODEPU RAVI,11-Aug-2025 04:54 PM,Rejected-Finance,Being selected as L3 through transparent lottery system as per OPWD norms,24-Nov-2025 03:13 PM,"Block Development Officer, Ramanaguda",Internal,"BDO, Ramanaguda, STC, SS, Rayagada, AEE, Ramanaguda PS, TC, SS, Ramanaguda",Pradyumna Mandal,15-Nov-2025 04:37 PM,techsummary_547579.pdf (1099.83 KB),AOC
,,,,,,,,,,,,,,,,,,,,,,,,,,,,,,,,,,2.0,ICICI NEFT/RTGS,,,.xls,Bill of Quantity for the Construction of ACR,,,,,,,,,,,,,,,,,,,AOC,,,,,,,,,,,,,,,,,,,,,,,,,,,,,2,3025484,GOPAL KRUSHNA PANDA,07-Aug-2025 11:00 AM,Accepted-AOC,SELECTED L1 BIDDER AND DEPOSITED THE REQUIRED AMOUNT OF ISD AND APSD AS PER NORMS,24-Nov-2025 04:00 PM,,,,,,,AOC
,,,,,,,,,,,,,,,,,,,,,,,,,,,,,,,,,,,,,,,,,,,,,,,,,,,,,,,,,,AOC,,,,,,,,,,,,,,,,,,,,,,,,,,,,,3,3031049,JANAKI KHARA,11-Aug-2025 02:10 PM,Rejected-Finance,Being selected as L3 through transparent lottery system as per OPWD norms,24-Nov-2025 03:13 PM,,,,,,,AOC
,,,,,,,,,,,,,,,,,,,,,,,,,,,,,,,,,,,,,,,,,,,,,,,,,,,,,,,,,,AOC,,,,,,,,,,,,,,,,,,,,,,,,,,,,,4,3031151,NANDA KISHOR PRASAD CHOURASIA,11-Aug-2025 02:22 PM,Rejected-Finance,Being selected as L3 through transparent lottery system as per OPWD norms,24-Nov-2025 03:13 PM,,,,,,,AOC
,,,,,,,,,,,,,,,,,,,,,,,,,,,,,,,,,,,,,,,,,,,,,,,,,,,,,,,,,,AOC,,,,,,,,,,,,,,,,,,,,,,,,,,,,,5,3030116,PRASAD BAURI (SC),10-Aug-2025 04:49 PM,Rejected-Finance,Being selected as L3 through transparent lottery system as per OPWD norms,24-Nov-2025 03:13 PM,,,,,,,AOC
,,,,,,,,,,,,,,,,,,,,,,,,,,,,,,,,,,,,,,,,,,,,,,,,,,,,,,,,,,AOC,,,,,,,,,,,,,,,,,,,,,,,,,,,,,6,3031204,SASMITA KUMARI DAS,11-Aug-2025 02:30 PM,Rejected-Finance,Being selected as L3 through transparent lottery system as per OPWD norms,24-Nov-2025 03:13 PM,,,,,,,AOC
,,,,,,,,,,,,,,,,,,,,,,,,,,,,,,,,,,,,,,,,,,,,,,,,,,,,,,,,,,AOC,,,,,,,,,,,,,,,,,,,,,,,,,,,,,7,3031422,SURESH LABALA,11-Aug-2025 03:14 PM,Rejected-AOC,BEING L2 BIDDER NOT ACCEPTED AS PER NORMS,24-Nov-2025 04:00 PM,,,,,,,AOC
,,,,,,,,,,,,,,,,,,,,,,,,,,,,,,,,,,,,,,,,,,,,,,,,,,,,,,,,,,AOC,,,,,,,,,,,,,,,,,,,,,,,,,,,,,8,3030854,SWAPNA MANDANGI,11-Aug-2025 11:21 AM,Rejected-Finance,Being selected as L3 through transparent lottery system as per OPWD norms,24-Nov-2025 03:13 PM,,,,,,,AOC
