Organisation Chain :,Tender ID :,Tender Ref No :,Tender Title :,S.No,Bid Number,Bidder Name,Awarded Currency,Awarded Value,S.No.1,Bid Number.1,Bidder Name.1,Submitted Date,Status,Remarks,Status Updated On,Contract Date :,Total Contract Value :,Work Completion Period in days :,Updated By :,Updated on :,AOC document :,AOC Description :,Type :,Summary :,Updated By :.1,Updated On :,Document :,BOQ Comparative Chart :,Committee Chairperson/Co-ordinator Name :,Committee Chairperson/Co-ordinator Type :,Committee Members :,Updated By :.2,Updated on :.1,Document :.1,Committee Chairperson/Co-ordinator Name :.1,Committee Chairperson/Co-ordinator Type :.1,Committee Members :.1,Updated By :.3,Updated On :.1,Document :.2,Tender Stage,S.No,Corrigendum Title,Corrigendum Type,View,Name,Address,Title,Work Description,Pre Qualification Details,Independent External Monitor/Remarks,Tender Value in ₹,Product Category,Sub category,Contract Type,Bid Validity(Days),Period Of Work(Days),Location,Pincode,Pre Bid Meeting Place,Pre Bid Meeting Address,Pre Bid Meeting Date,Bid Opening Place,Should Allow NDA Tender,Allow Preferential Bidder,S.No.1,Bank Name,Tender Fee in ₹,VAT Charges in ₹,Fee Payable To,Fee Payable At,Tender Fee Exemption Allowed,Publish Date,Bid Opening Date,Document Download / Sale Start Date,Document Download / Sale End Date,Clarification Start Date,Clarification End Date,Bid Submission Start Date,Bid Submission End Date,Organisation Chain,Tender Reference Number,Tender ID,Withdrawal Allowed,Tender Type,Form of contract,Tender Category,No. of Covers,General Technical Evaluation Allowed,ItemWise Technical Evaluation Allowed,Payment Mode,Is Multi Currency Allowed For BOQ,Is Multi Currency Allowed For Fee,Allow Two Stage Bidding,Cover No,Cover,Document Type,Description,EMD Amount in ₹,EMD Exemption Allowed,EMD Fee Type,EMD Percentage,EMD Payable To,EMD Payable At,Tender Stage
"CE,Minor Irrigation,BBSR||Balangir Minor Irrigation Circle Balangir||MI Division Padampur",2025_CEMIB_117465_17,SEMIDPDP-01/2025-26,Improvement of Distribution System Of Budhadhara MIP D/W In Sohela Block Of Bargarh District under Critical Scheme for The Year 2025-26,1.0,3073927.0,PRIYABRATA DEBTA,INR,"1,413,392",1,3077653,HARI DAS,12-Sep-2025 02:43 PM,Rejected-AOC,Not Winner in the Transparent Lottery,16-Nov-2025 01:47 PM,15-Oct-2025,"INR 1,413,392",90.0,ARUN KUMAR JYOTRIMAYA,16-Nov-2025 01:46 PM,28.pdf (780.00 KB),"The Work is awarded to Sri Priyabrata Debta ""C"" Class Contractor vide Agtt. No.28P1/25-26.The D.O.C and Completion as dt.15/10/2025 and 14/01/2026 for contract amount Rs.1413392.00 With GST 18%",Finance,Opening Tender,HEMANTA MARANDI,23-Sep-2025 02:07 PM,finance_550796.pdf,BOQ Comparative Chart,Sri Arun Kumar Jyotrimaya,Internal,"Sri Ashwani Mishra,D.A.O.,Sri Hemant Kumar Marandi,A.E.E. Estimator I/C,Sri Samir Kumar Behera,J.E.Estr.",HEMANTA MARANDI,11-Oct-2025 12:31 PM,finsummary_550796.pdf (214.18 KB),Arun Kumar Jyotrimaya,Internal,"Arun Kumar Jyotrimaya, Aswani Mishra, DAO Hemanta Kumar Marandi, AEE Estimator Samir Kumar Behera, JE Estimator",Samir Kumar Behera,23-Sep-2025 07:25 PM,techsummary_550796.pdf (151.68 KB),AOC,1.0,"1.Correction of name of Bid ID in DTCN,2.Corrigendum for Amendment in addresses",Other,,"SE M.I. Division, Padampur","O/o The SE M.I. Division, Padampur",Improvement of Distribution System Of Budhadhara MIP D/W In Sohela Block Of Bargarh District under Critical Scheme for The Year 2025-26,Improvement of Distribution System Of Budhadhara MIP D/W In Sohela Block Of Bargarh District under Critical Scheme for The Year 2025-26,As per DTCN ,NA ,"16,62,618",Civil Works - Others,NA ,Tender,90.0,90.0,Sohela,768033.0,NA ,NA ,NA ,"O/o The SE M.I. Division, Padampur",No ,No,1.0,ICICI BANK,"6,000",0.0,Nil,Nil,No,02-Sep-2025 11:00 AM,17-Sep-2025 11:00 AM,02-Sep-2025 11:00 AM,16-Sep-2025 05:00 PM,NA ,NA ,02-Sep-2025 11:00 AM,16-Sep-2025 05:00 PM,"CE,Minor Irrigation,BBSR||Balangir Minor Irrigation Circle Balangir||MI Division Padampur",SEMIDPDP-01/2025-26,2025_CEMIB_117465_17,Yes,Open Tender,Percentage,Works,1.0,No,No,Online,No,No,No,1.0,Fee/PreQual/Technical/Finance,.pdf,"Contractor RC, Original affidavit, GSTIN, NRC, EMD, PAN and any other documents as per DTCN","16,700",Yes,fixed,,Nil,Nil,AOC
,,,,,,,,,2,3066616,KUNALA DEBATA,06-Sep-2025 09:20 PM,Rejected-AOC,Not Winner in the Transparent Lottery,16-Nov-2025 01:47 PM,,,,,,,,,,,,,,,,,,,,,,,,,,AOC,,,,,,,,,,,,,,,,,,,,,,,,,2.0,ICICI NEFT/RTGS,,,,,,,,,,,,,,,,,,,,,,,,,,,,,,.xls,BOQ,,,,,,,AOC
,,,,,,,,,3,3064091,PRADEEP KUMAR CHHANDA,05-Sep-2025 11:49 AM,Rejected-Technical,Not Qualified,23-Sep-2025 07:25 PM,,,,,,,,,,,,,,,,,,,,,,,,,,AOC,,,,,,,,,,,,,,,,,,,,,,,,,,,,,,,,,,,,,,,,,,,,,,,,,,,,,,,,,,,,,,,,AOC
,,,,,,,,,4,3073927,PRIYABRATA DEBTA,10-Sep-2025 01:30 PM,Accepted-AOC,Winner of the Transparent Lottery,16-Nov-2025 01:47 PM,,,,,,,,,,,,,,,,,,,,,,,,,,AOC,,,,,,,,,,,,,,,,,,,,,,,,,,,,,,,,,,,,,,,,,,,,,,,,,,,,,,,,,,,,,,,,AOC
,,,,,,,,,5,3066566,RUKMANA PADHAN,06-Sep-2025 09:02 PM,Rejected-AOC,Not Winner in the Transparent Lottery,16-Nov-2025 01:47 PM,,,,,,,,,,,,,,,,,,,,,,,,,,AOC,,,,,,,,,,,,,,,,,,,,,,,,,,,,,,,,,,,,,,,,,,,,,,,,,,,,,,,,,,,,,,,,AOC
