Type :,Summary :,Updated By :,Updated On :,Document :,BOQ Comparative Chart :,S.No,Bid Number,Bidder Name,Awarded Currency,Awarded Value,Organisation Chain :,Tender ID :,Tender Ref No :,Tender Title :,Committee Chairperson/Co-ordinator Name :,Committee Chairperson/Co-ordinator Type :,Committee Members :,Updated By :.1,Updated on :,Document :.1,Committee Chairperson/Co-ordinator Name :.1,Committee Chairperson/Co-ordinator Type :.1,Committee Members :.1,Updated By :.2,Updated On :.1,Document :.2,S.No.1,Bid Number.1,Bidder Name.1,Submitted Date,Status,Remarks,Status Updated On,Contract Date :,Total Contract Value :,Work Completion Period in days :,Updated By :.3,Updated on :.1,AOC document :,AOC Description :,Tender Stage,Tender Fee in ₹,VAT Charges in ₹,Fee Payable To,Fee Payable At,Tender Fee Exemption Allowed,S.No,Bank Name,Organisation Chain,Tender Reference Number,Tender ID,Withdrawal Allowed,Tender Type,Form of contract,Tender Category,No. of Covers,General Technical Evaluation Allowed,ItemWise Technical Evaluation Allowed,Payment Mode,Is Multi Currency Allowed For BOQ,Is Multi Currency Allowed For Fee,Allow Two Stage Bidding,EMD Amount in ₹,EMD Exemption Allowed,EMD Fee Type,EMD Percentage,EMD Payable To,EMD Payable At,Name,Address,Publish Date,Bid Opening Date,Document Download / Sale Start Date,Document Download / Sale End Date,Clarification Start Date,Clarification End Date,Bid Submission Start Date,Bid Submission End Date,Cover No,Cover,Document Type,Description,Title,Work Description,Pre Qualification Details,Independent External Monitor/Remarks,Tender Value in ₹,Product Category,Sub category,Contract Type,Bid Validity(Days),Period Of Work(Days),Location,Pincode,Pre Bid Meeting Place,Pre Bid Meeting Address,Pre Bid Meeting Date,Bid Opening Place,Should Allow NDA Tender,Allow Preferential Bidder,Tender Stage
Finance,BID OPENING SUMMARY,Gobinda Chandra Majhi,13-Aug-2025 12:07 PM,finance_545692.pdf,BOQ Comparative Chart,1.0,3009352.0,BANAMALI BHITRIA,INR,"1,008,570","CE-BM,UM Basin,Burla||SE,Hirakud Dam Circle,Burla||EE,Sundargarh Irr.Divn,Sundargarh",2025_CEBBU_115404_2,SID-01/2025-26,Providing service bank connection on left bank near canal syphon at RD 8765m of Sankara Distributary of Talsara Irrigation Project,SEDAOAEEAE,Internal,SEDAOAEEAE,Gobinda Chandra Majhi,12-Nov-2025 03:20 PM,finsummary_545692.pdf (1488.99 KB),SEDAOAEEAE,Internal,SEDAOAEEAE,Gobinda Chandra Majhi,12-Nov-2025 03:17 PM,techsummary_545692.pdf (1488.99 KB),1.0,3009352.0,BANAMALI BHITRIA,23-Jul-2025 09:47 PM,Accepted-AOC,1st Lowest Through Lottery,12-Nov-2025 03:27 PM,12-Nov-2025,"INR 1,008,570",150.0,Gobinda Chandra Majhi,12-Nov-2025 03:27 PM,06P1202526.pdf (5800.00 KB),WORK ORDER AND AGREEMENT COPY,AOC,"6,000",0.0,Nil,Nil,No,1.0,ICICI BANK,"CE-BM,UM Basin,Burla||SE,Hirakud Dam Circle,Burla||EE,Sundargarh Irr.Divn,Sundargarh",SID-01/2025-26,2025_CEBBU_115404_2,Yes,Open Tender,Percentage,Works,1.0,No,No,Online,No,No,No,"11,864",Yes,fixed,,Nil,Nil,"O/O THE SE, SID, SUNDARGARH","O/O THE SE, SID, SUNDARGARH AT/PO-SANKARA DIST-SUNDARGARH PIN-770020",11-Jul-2025 10:00 AM,28-Jul-2025 11:00 AM,11-Jul-2025 10:00 AM,24-Jul-2025 05:30 PM,11-Jul-2025 10:00 AM ,24-Jul-2025 05:30 PM ,11-Jul-2025 10:00 AM,24-Jul-2025 05:30 PM,1.0,Fee/PreQual/Technical/Finance,.pdf,Receipt of Tender Paper Cost and EMD,Providing service bank connection on left bank near canal syphon at RD 8765m of Sankara Distributary of Talsara Irrigation Project,Providing service bank connection on left bank near canal syphon at RD 8765m of Sankara Distributary of Talsara Irrigation Project,Please refer Tender documents. ,NA ,"11,86,413",Civil Works - Canal,NA ,Tender,90.0,150.0,SUNDARGARH,770020.0,NA ,NA ,NA ,"O/O THE SE, SID, SUNDARGARH",No ,No,AOC
,,,,,,,,,,,,,,,,,,,,,,,,,,,2.0,3004638.0,DEBENDRA KISAN,22-Jul-2025 08:49 PM,Rejected-AOC,2nd Lowest,12-Nov-2025 03:27 PM,,,,,,,,AOC,,,,,,2.0,ICICI NEFT/RTGS,,,,,,,,,,,,,,,,,,,,,,,,,,,,,,,,,.pdf,"GSTIN, PAN Card, Contractor Registration Certificate, Affidavits towards authenticity.",,,,,,,,,,,,,,,,,,,AOC
,,,,,,,,,,,,,,,,,,,,,,,,,,,3.0,3010692.0,RASHMITA ROUT,24-Jul-2025 04:58 PM,Rejected-AOC,2nd Lowest,12-Nov-2025 03:27 PM,,,,,,,,AOC,,,,,,,,,,,,,,,,,,,,,,,,,,,,,,,,,,,,,,,,.pdf,"No Relation Certificate, Other document as per DTCN.",,,,,,,,,,,,,,,,,,,AOC
,,,,,,,,,,,,,,,,,,,,,,,,,,,4.0,3008987.0,SUNIL TOPPO,24-Jul-2025 12:56 PM,Rejected-AOC,2nd Lowest,12-Nov-2025 03:27 PM,,,,,,,,AOC,,,,,,,,,,,,,,,,,,,,,,,,,,,,,,,,,,,,,,,,.pdf,"SIGNING OF BID The Online bidder shall digitally sign on all statements, documents by the bidder",,,,,,,,,,,,,,,,,,,AOC
,,,,,,,,,,,,,,,,,,,,,,,,,,,,,,,,,,,,,,,,,AOC,,,,,,,,,,,,,,,,,,,,,,,,,,,,,,,,,,,,,,,,.xls,BILL OF QUANTITY,,,,,,,,,,,,,,,,,,,AOC
