Committee Chairperson/Co-ordinator Name :,Committee Chairperson/Co-ordinator Type :,Committee Members :,Updated By :,Updated On :,Document :,S.No,Bid Number,Bidder Name,Submitted Date,Status,Remarks,Status Updated On,Contract Date :,Total Contract Value :,Work Completion Period in days :,Updated By :.1,Updated on :,AOC document :,AOC Description :,Type :,Summary :,Updated By :.2,Updated On :.1,Document :.1,BOQ Comparative Chart :,S.No.1,Bid Number.1,Bidder Name.1,Awarded Currency,Awarded Value,Organisation Chain :,Tender ID :,Tender Ref No :,Tender Title :,Committee Chairperson/Co-ordinator Name :.1,Committee Chairperson/Co-ordinator Type :.1,Committee Members :.1,Updated By :.3,Updated on :.1,Document :.2,Tender Stage,EMD Amount in ₹,EMD Exemption Allowed,EMD Fee Type,EMD Percentage,EMD Payable To,EMD Payable At,Tender Fee in ₹,VAT Charges in ₹,Fee Payable To,Fee Payable At,Tender Fee Exemption Allowed,S.No,Bank Name,Cover No,Cover,Document Type,Description,Publish Date,Bid Opening Date,Document Download / Sale Start Date,Document Download / Sale End Date,Clarification Start Date,Clarification End Date,Bid Submission Start Date,Bid Submission End Date,Title,Work Description,Pre Qualification Details,Independent External Monitor/Remarks,Tender Value in ₹,Product Category,Sub category,Contract Type,Bid Validity(Days),Period Of Work(Days),Location,Pincode,Pre Bid Meeting Place,Pre Bid Meeting Address,Pre Bid Meeting Date,Bid Opening Place,Should Allow NDA Tender,Allow Preferential Bidder,Name,Address,Organisation Chain,Tender Reference Number,Tender ID,Withdrawal Allowed,Tender Type,Form of contract,Tender Category,No. of Covers,General Technical Evaluation Allowed,ItemWise Technical Evaluation Allowed,Payment Mode,Is Multi Currency Allowed For BOQ,Is Multi Currency Allowed For Fee,Allow Two Stage Bidding,Tender Stage
"Executive Engineer, R.W EL.DIVN.BBSR",Internal,"Executive Engineer, D.A.O-II, and Estimator of R.W EL.DIVN.BBSR",Chudamani Sethi,01-Sep-2025 04:22 PM,techsummary_546690.pdf (405.06 KB),1,3016098,ABHILASH PRADHAN,29-Jul-2025 11:12 AM,Rejected-Finance,Looser in Lottery,20-Sep-2025 04:48 PM,20-Sep-2025,"INR 1,377,318",180.0,Chudamani Sethi,20-Sep-2025 04:56 PM,3308.pdf (420.00 KB),SK Enterprises has deposited requisite amount of APS and ISD,Finance,8 nos of bidders participated in the tender,Chudamani Sethi,04-Aug-2025 02:11 PM,finance_546690.pdf,BOQ Comparative Chart,1.0,3016128.0,Sk Mohammed Wajuddin,INR,"1,377,318",CE RW I||RW Electrical Circle Bhubaneswar||RW Electrical Division Bhubaneswar,2025_CERWI_115800_6,EERWELBBSR 06/ 2025-26,"Provn. of 31 KW Roof top Solar System at Kendrapara-Jajpur ( Kendrapara-I Division 15 KW ,Kendrapara-II Division 16 KW)","Executive Engineer, R.W EL.DIVN.BBSR",Internal,"Executive Engineer, D.A.O-II, and Estimator of R.W EL.DIVN.BBSR",Chudamani Sethi,20-Sep-2025 04:48 PM,finsummary_546690.pdf (544.70 KB),AOC,"16,202",Yes,percentage,1.0%,Nil,Nil,"6,000",0.0,Nil,Nil,No,1.0,ICICI BANK,1.0,Fee/PreQual/Technical/Finance,.pdf,"Valid license copy ,GST certificate ,PAN card , EMD, Tender paper cost",22-Jul-2025 12:00 PM,30-Jul-2025 01:00 PM,22-Jul-2025 12:00 PM,29-Jul-2025 05:00 PM,NA ,NA ,22-Jul-2025 12:00 PM,29-Jul-2025 05:00 PM,"Provn. of 31 KW Roof top Solar System at Kendrapara-Jajpur ( Kendrapara-I Division 15 KW ,Kendrapara-II Division 16 KW)","Provn. of 31 KW Roof top Solar System at Kendrapara-Jajpur ( Kendrapara-I Division 15 KW ,Kendrapara-II Division 16 KW)",Please refer Tender documents. ,NA ,"16,20,184",Electrical Works,NA ,Tender,90.0,180.0,Kendrapara,754211.0,NA ,NA ,NA ,E. E. R.W EL.DIVN.BBSR At- Divn. Complex Rasulgarh,No ,No,E. E. R.W EL.DIVN.BBSR At- Divn. Complex Rasulgarh,E. E. R.W EL.DIVN.BBSR At- Divn. Complex Rasulgarh,CE RW I||RW Electrical Circle Bhubaneswar||RW Electrical Division Bhubaneswar,EERWELBBSR 06/ 2025-26,2025_CERWI_115800_6,Yes,Open Tender,Percentage,Works,1.0,No,No,Online,No,No,No,AOC
,,,,,,2,3015589,AJANTA ENTERPRISES,28-Jul-2025 05:35 PM,Rejected-Finance,Looser in Lottery,20-Sep-2025 04:48 PM,,,,,,,,,,,,,,,,,,,,,,,,,,,,,AOC,,,,,,,,,,,,2.0,ICICI NEFT/RTGS,,,.pdf,"Affidavit for correctness, no relation certificate",,,,,,,,,,,,,,,,,,,,,,,,,,,,,,,,,,,,,,,,,,,AOC
,,,,,,3,3016400,Ampere india associates,29-Jul-2025 01:05 PM,Rejected-Finance,Looser in Lottery,20-Sep-2025 04:48 PM,,,,,,,,,,,,,,,,,,,,,,,,,,,,,AOC,,,,,,,,,,,,,,,,.xls,BOQ,,,,,,,,,,,,,,,,,,,,,,,,,,,,,,,,,,,,,,,,,,,AOC
,,,,,,4,3015815,CHAKADOLA ELECTRICAL,28-Jul-2025 08:11 PM,Rejected-Finance,Looser in Lottery,20-Sep-2025 04:48 PM,,,,,,,,,,,,,,,,,,,,,,,,,,,,,AOC,,,,,,,,,,,,,,,,,,,,,,,,,,,,,,,,,,,,,,,,,,,,,,,,,,,,,,,,,,,,AOC
,,,,,,5,3015854,ICON BUILDERS,28-Jul-2025 08:03 PM,Rejected-Technical,"Not qualified, due to other than L1",01-Sep-2025 04:22 PM,,,,,,,,,,,,,,,,,,,,,,,,,,,,,AOC,,,,,,,,,,,,,,,,,,,,,,,,,,,,,,,,,,,,,,,,,,,,,,,,,,,,,,,,,,,,AOC
,,,,,,6,3016734,ONE STEP SOLUTIONS,29-Jul-2025 03:12 PM,Rejected-Finance,Looser in Lottery,20-Sep-2025 04:48 PM,,,,,,,,,,,,,,,,,,,,,,,,,,,,,AOC,,,,,,,,,,,,,,,,,,,,,,,,,,,,,,,,,,,,,,,,,,,,,,,,,,,,,,,,,,,,AOC
,,,,,,7,3015977,PHASE AND CONTROL,28-Jul-2025 10:58 PM,Rejected-Technical,"Not qualified, due to other than L1",01-Sep-2025 04:22 PM,,,,,,,,,,,,,,,,,,,,,,,,,,,,,AOC,,,,,,,,,,,,,,,,,,,,,,,,,,,,,,,,,,,,,,,,,,,,,,,,,,,,,,,,,,,,AOC
,,,,,,8,3016128,Sk Mohammed Wajuddin,29-Jul-2025 10:22 AM,Accepted-AOC,SK Enterprises has deposited reqsisite amount of APS and ISD,20-Sep-2025 04:56 PM,,,,,,,,,,,,,,,,,,,,,,,,,,,,,AOC,,,,,,,,,,,,,,,,,,,,,,,,,,,,,,,,,,,,,,,,,,,,,,,,,,,,,,,,,,,,AOC
