EMD Amount in ₹,EMD Exemption Allowed,EMD Fee Type,EMD Percentage,EMD Payable To,EMD Payable At,Publish Date,Bid Opening Date,Document Download / Sale Start Date,Document Download / Sale End Date,Clarification Start Date,Clarification End Date,Bid Submission Start Date,Bid Submission End Date,Financial Bid Opening Date,S.No,Bank Name,Name,Address,Tender Fee in ₹,VAT Charges in ₹,Fee Payable To,Fee Payable At,Tender Fee Exemption Allowed,Organisation Chain,Tender Reference Number,Tender ID,Withdrawal Allowed,Tender Type,Form of contract,Tender Category,No. of Covers,General Technical Evaluation Allowed,ItemWise Technical Evaluation Allowed,Payment Mode,Is Multi Currency Allowed For BOQ,Is Multi Currency Allowed For Fee,Allow Two Stage Bidding,Cover No,Cover,Document Type,Description,Title,Work Description,Pre Qualification Details,Independent External Monitor/Remarks,Tender Value in ₹,Product Category,Sub category,Contract Type,Bid Validity(Days),Period Of Work(Days),Location,Pincode,Pre Bid Meeting Place,Pre Bid Meeting Address,Pre Bid Meeting Date,Bid Opening Place,Should Allow NDA Tender,Allow Preferential Bidder,Tender Stage,S.No,Bid Number,Bidder Name,Submitted Date,Status,Remarks,Status Updated On,Committee Chairperson/Co-ordinator Name :,Committee Chairperson/Co-ordinator Type :,Committee Members :,Updated By :,Updated On :,Financial Bid Opening Date:,Document :,S.No.1,Bid Number.1,Bidder Name.1,Awarded Currency,Awarded Value,Type :,Summary :,Updated By :.1,Updated On :.1,Document :.1,BOQ Comparative Chart :,Contract Date :,Total Contract Value :,Work Completion Period in days :,Updated By :.2,Updated on :,AOC document :,Type :.1,Summary :.1,Updated By :.3,Updated On :.2,Document :.2,Committee Chairperson/Co-ordinator Name :.1,Committee Chairperson/Co-ordinator Type :.1,Committee Members :.1,Updated By :.4,Updated on :.1,Document :.3,Organisation Chain :,Tender ID :,Tender Ref No :,Tender Title :,Tender Stage
"72,250",Yes,percentage,1.0%,Nil,Nil,06-May-2023 11:10 AM,22-May-2023 12:30 PM,06-May-2023 11:10 AM,20-May-2023 05:00 PM,06-May-2023 11:10 AM ,11-May-2023 05:00 PM ,06-May-2023 11:10 AM,20-May-2023 05:00 PM,07-Jun-2023 12:30 PM,1.0,ICICI BANK,Superintending Engineer,"Superintending Engineer, P.H. Division, Saheed Nagar , Bhubaneswar-751007, Odisha, Phone (0674) 2540578","10,000",0.0,Nil,Nil,No,PHEO||SEPH-CIRCLE-BBSR||EE P.H. Division Bhubaneswar,EEPHBBSR-03(2)/2023-24 DTD.25.04.2023,2023_PHEO_88437_1,Yes,National Competitive Bid,Percentage,Works,2.0,No,No,Online,No,No,No,1.0,Fee/PreQual/Technical,.pdf,"Copy of PAN, GST, Affidavits as per DTCN","Improvement of W/S, S/I and S/D to CHC at Balipatana in the District of Khordha (under AMA Hospital Programme)","Improvement of W/S, S/I and S/D to CHC at Balipatana in the District of Khordha (under AMA Hospital Programme)",Please refer Tender documents. ,NA ,"72,25,000",Civil Works - Water Works,NA ,Tender,120.0,120.0,Balipatana,752102.0,NA ,NA ,NA ,Bhubaneswar,No ,No,AOC,1,2142823,AJAYA KUMAR LENKA,20-May-2023 01:52 PM,Rejected-AOC,Not a lowest bidder,07-Jul-2023 10:30 AM,Superintending Engineer,Internal,,BIRANCHI NARAYAN PRADHAN,06-Jun-2023 06:23 PM,07-Jun-2023 12:30 PM,techsummary_435866.pdf (169.90 KB),1.0,2141883.0,SUDIPTA DAS,INR,"6,140,694",Finance,Three no financial bids are received online and the bid is admitted subject to detail scrutiny after downloading the bid documents and after which the bid will be finally determined as valid or invalid,Kanchan Kumar Barik,07-Jun-2023 12:34 PM,,BOQ Comparative Chart,07-Jul-2023,"INR 6,140,694",120.0,BIRANCHI NARAYAN PRADHAN,07-Jul-2023 10:29 AM,AOC.pdf (184.00 KB),Technical,Five no technical bids are received online and the bid is admitted subject to detail scrutiny after downloading the bid documents and after which the bid will be finally determined as valid or invalid,Kanchan Kumar Barik,22-May-2023 12:41 PM,,Superintending Engineer,Internal,,BIRANCHI NARAYAN PRADHAN,07-Jul-2023 10:28 AM,finsummary_435866.pdf (194.48 KB),PHEO||SEPH-CIRCLE-BBSR||EE P.H. Division Bhubaneswar,2023_PHEO_88437_1,EEPHBBSR-03(2)/2023-24 DTD.25.04.2023,"Improvement of W/S, S/I and S/D to CHC at Balipatana in the District of Khordha (under AMA Hospital Programme)",AOC
,,,,,,,,,,,,,,,2.0,ICICI NEFT/RTGS,,,,,,,,,,,,,,,,,,,,,,,,.pdf,"Certificates, Formats, Schedules and other documents if any as per DTCN",,,,,,,,,,,,,,,,,,,AOC,2,2142760,MADHUSMITA DAS,20-May-2023 01:38 PM,Rejected-Technical,Technically disqualified,06-Jun-2023 06:23 PM,,,,,,,,,,,,,,,,,,,,,,,,,,,,,,,,,,,,,,,,AOC
,,,,,,,,,,,,,,,,,,,,,,,,,,,,,,,,,,,,,,2.0,Finance,.xls,Bill of Quantity,,,,,,,,,,,,,,,,,,,AOC,3,2142189,SAROJINI MOHANTY,20-May-2023 04:16 PM,Rejected-AOC,Not a lowest bidder,07-Jul-2023 10:30 AM,,,,,,,,,,,,,,,,,,,,,,,,,,,,,,,,,,,,,,,,AOC
,,,,,,,,,,,,,,,,,,,,,,,,,,,,,,,,,,,,,,,,,,,,,,,,,,,,,,,,,,,,AOC,4,2142835,SRI ASHWINEE KUMAR MOHANTY,20-May-2023 02:03 PM,Rejected-Technical,Technically disqualified,06-Jun-2023 06:23 PM,,,,,,,,,,,,,,,,,,,,,,,,,,,,,,,,,,,,,,,,AOC
,,,,,,,,,,,,,,,,,,,,,,,,,,,,,,,,,,,,,,,,,,,,,,,,,,,,,,,,,,,,AOC,5,2141883,SUDIPTA DAS,19-May-2023 04:31 PM,Accepted-AOC,Lowest bidder,07-Jul-2023 10:30 AM,,,,,,,,,,,,,,,,,,,,,,,,,,,,,,,,,,,,,,,,AOC
