Cover No,Cover,Document Type,Description,Name,Address,Organisation Chain,Tender Reference Number,Tender ID,Withdrawal Allowed,Tender Type,Form of contract,Tender Category,No. of Covers,General Technical Evaluation Allowed,ItemWise Technical Evaluation Allowed,Payment Mode,Is Multi Currency Allowed For BOQ,Is Multi Currency Allowed For Fee,Allow Two Stage Bidding,EMD Amount in ₹,EMD Exemption Allowed,EMD Fee Type,EMD Percentage,EMD Payable To,EMD Payable At,Title,Work Description,Pre Qualification Details,Independent External Monitor/Remarks,Tender Value in ₹,Product Category,Sub category,Contract Type,Bid Validity(Days),Period Of Work(Days),Location,Pincode,Pre Bid Meeting Place,Pre Bid Meeting Address,Pre Bid Meeting Date,Bid Opening Place,Should Allow NDA Tender,Allow Preferential Bidder,Tender Fee in ₹,Fee Payable To,Fee Payable At,Tender Fee Exemption Allowed,S.No,Bank Name,Publish Date,Bid Opening Date,Document Download / Sale Start Date,Document Download / Sale End Date,Clarification Start Date,Clarification End Date,Bid Submission Start Date,Bid Submission End Date,Tender Stage,Organisation Chain :,Tender ID :,Tender Ref No :,Tender Title :,Committee Chairperson/Co-ordinator Name :,Committee Chairperson/Co-ordinator Type :,Committee Members :,Updated By :,Updated on :,Document :,Type :,Summary :,Updated By :.1,Updated On :,Document :.1,BOQ Comparative Chart :,S.No,Bid Number,Bidder Name,Awarded Currency,Awarded Value,Contract Date :,Total Contract Value :,Work Completion Period in days :,Updated By :.2,Updated on :.1,AOC document :,AOC Description :,S.No.1,Bid Number.1,Bidder Name.1,Submitted Date,Status,Remarks,Status Updated On,Committee Chairperson/Co-ordinator Name :.1,Committee Chairperson/Co-ordinator Type :.1,Committee Members :.1,Updated By :.3,Updated On :.1,Document :.2,Tender Stage
1.0,Fee/PreQual/Technical/Finance,.pdf,"RC,GST,PAN,Affidavit,Cost of tender paper,EMD etc towards construction of GPLF buildings in Kolnara",BDO Kolnara,"Block Development Officer,PS Kolnara 765017",Panchayati Raj and Drinking Water Department Odisha||Zilla Parisad Rayagada||KOLNARA Block,PSKOLno.04/2025-26,2025_PZPKL_124037_1,Yes,Open Tender,Percentage,Works,1.0,No,No,Online,No,No,No,"25,100",Yes,fixed,,Nil,Nil,GPLF Building at Badakhilapadar,GPLF Building at Badakhilapada,As per DTCN ,NA ,"25,04,006",Civil Works - Buildings,NA ,Tender,90.0,120.0,BADAKHILAPADAR,765017.0,NA ,NA ,NA ,Block Office Kolnara,No ,No,"6,000",Nil,Nil,No,1.0,ICICI BANK,01-Jan-2026 11:00 AM,16-Jan-2026 11:30 AM,01-Jan-2026 11:00 AM,15-Jan-2026 05:00 PM,NA ,NA ,01-Jan-2026 11:00 AM,15-Jan-2026 05:00 PM,AOC,Panchayati Raj and Drinking Water Department Odisha||Zilla Parisad Rayagada||KOLNARA Block,2025_PZPKL_124037_1,PSKOLno.04/2025-26,GPLF Building at Badakhilapadar,"Block Developmnt Officer, Kolnara",Internal,"SRA, DEV. SEC, KOLNARA, JE, KOLNARA PS, T.C., DPO, SS, KOLNARA, SEC. OFF., KOLNARA, BFO, KOLNARA, SR. TC., DPO, SS, AEE, KOLNARA PS.",REENA PRADHAN,04-Apr-2026 11:35 AM,finsummary_573917.pdf (1977.86 KB),Finance,ALL BIDS OPENED ON 16.01.2026,Ganeswar Bhatta,16-Jan-2026 03:56 PM,,BOQ Comparative Chart,1.0,3353931.0,JANAKI KHARA,INR,"2,128,655.917",04-Apr-2026,"INR 2,128,655.917",120.0,REENA PRADHAN,04-Apr-2026 04:15 PM,AOCBadakhilapadarGPLF.pdf (522.00 KB),The work Construction of GPLF building at Bada Khilapadar of Kolnora block awarded to Smt. Janaki Khora being the L1 among the bidders.,1,3353152,G DEEPAK KUMAR,13-Jan-2026 04:54 PM,Rejected-AOC,Could not be selected in lottery process,04-Apr-2026 04:15 PM,"Block Developmnt Officer, Kolnara",Internal,"SRA, DEV. SEC, KOLNARA, JE, KOLNARA PS, T.C., DPO, SS, KOLNARA, SEC. OFF., KOLNARA, BFO, KOLNARA, SR. TC., DPO, SS, AEE, KOLNARA PS.",REENA PRADHAN,04-Apr-2026 10:34 AM,techsummary_573917.pdf (2390.30 KB),AOC
,,.xls,Bill of Quantities for the work,,,,,,,,,,,,,,,,,,,,,,,,,,,,,,,,,,,,,,,,,,,,,2.0,ICICI NEFT/RTGS,,,,,,,,,AOC,,,,,,,,,,,,,,,,,,,,,,,,,,,,,2,3353264,GUNTAMUKALA GOWRI SANKAR RAO,13-Jan-2026 07:12 PM,Rejected-AOC,Could not be selected in lottery process,04-Apr-2026 04:15 PM,,,,,,,AOC
,,,,,,,,,,,,,,,,,,,,,,,,,,,,,,,,,,,,,,,,,,,,,,,,,,,,,,,,,,AOC,,,,,,,,,,,,,,,,,,,,,,,,,,,,,3,3353931,JANAKI KHARA,14-Jan-2026 03:51 PM,Accepted-AOC,Quoted lowest rate and selected through lottery system,04-Apr-2026 04:15 PM,,,,,,,AOC
,,,,,,,,,,,,,,,,,,,,,,,,,,,,,,,,,,,,,,,,,,,,,,,,,,,,,,,,,,AOC,,,,,,,,,,,,,,,,,,,,,,,,,,,,,4,3352636,NANDA KISHOR PRASAD CHOURASIA,13-Jan-2026 01:36 PM,Rejected-AOC,Could not be selected in lottery process,04-Apr-2026 04:15 PM,,,,,,,AOC
,,,,,,,,,,,,,,,,,,,,,,,,,,,,,,,,,,,,,,,,,,,,,,,,,,,,,,,,,,AOC,,,,,,,,,,,,,,,,,,,,,,,,,,,,,5,3352656,RAINA KADRAKA,13-Jan-2026 02:01 PM,Rejected-AOC,Could not be selected in lottery process,04-Apr-2026 04:15 PM,,,,,,,AOC
,,,,,,,,,,,,,,,,,,,,,,,,,,,,,,,,,,,,,,,,,,,,,,,,,,,,,,,,,,AOC,,,,,,,,,,,,,,,,,,,,,,,,,,,,,6,3353138,SANGEETA PULAKA,13-Jan-2026 06:28 PM,Rejected-AOC,Could not be selected in lottery process,04-Apr-2026 04:15 PM,,,,,,,AOC
,,,,,,,,,,,,,,,,,,,,,,,,,,,,,,,,,,,,,,,,,,,,,,,,,,,,,,,,,,AOC,,,,,,,,,,,,,,,,,,,,,,,,,,,,,7,3354567,SUBASH CHANDRA PATRA,15-Jan-2026 01:20 PM,Rejected-AOC,Could not be selected in lottery process,04-Apr-2026 04:15 PM,,,,,,,AOC
