Organisation Chain :,Tender ID :,Tender Ref No :,Tender Title :,S.No,Bid Number,Bidder Name,Awarded Currency,Awarded Value,Committee Chairperson/Co-ordinator Name :,Committee Chairperson/Co-ordinator Type :,Committee Members :,Updated By :,Updated On :,Document :,Type :,Summary :,Updated By :.1,Updated On :.1,Document :.1,BOQ Comparative Chart :,Committee Chairperson/Co-ordinator Name :.1,Committee Chairperson/Co-ordinator Type :.1,Committee Members :.1,Updated By :.2,Updated on :,Document :.2,Contract Date :,Total Contract Value :,Work Completion Period in days :,Updated By :.3,Updated on :.1,AOC document :,AOC Description :,S.No.1,Bid Number.1,Bidder Name.1,Submitted Date,Status,Remarks,Status Updated On,Tender Stage,Title,Work Description,Pre Qualification Details,Independent External Monitor/Remarks,Tender Value in ₹,Product Category,Sub category,Contract Type,Bid Validity(Days),Period Of Work(Days),Location,Pincode,Pre Bid Meeting Place,Pre Bid Meeting Address,Pre Bid Meeting Date,Bid Opening Place,Should Allow NDA Tender,Allow Preferential Bidder,Cover No,Cover,Document Type,Description,Name,Address,Organisation Chain,Tender Reference Number,Tender ID,Withdrawal Allowed,Tender Type,Form of contract,Tender Category,No. of Covers,General Technical Evaluation Allowed,ItemWise Technical Evaluation Allowed,Payment Mode,Is Multi Currency Allowed For BOQ,Is Multi Currency Allowed For Fee,Allow Two Stage Bidding,Tender Fee in ₹,VAT Charges in ₹,Fee Payable To,Fee Payable At,Tender Fee Exemption Allowed,Publish Date,Bid Opening Date,Document Download / Sale Start Date,Document Download / Sale End Date,Clarification Start Date,Clarification End Date,Bid Submission Start Date,Bid Submission End Date,S.No,Bank Name,EMD Amount in ₹,EMD Exemption Allowed,EMD Fee Type,EMD Percentage,EMD Payable To,EMD Payable At,Tender Stage
EIC-CIVIL||SERNB-CIRCLE-BERHAMPUR||EERNB-DIVN-PHULBANI,2023_EICCL_86867_1,S E R AND B PLB 44 2022 23,Construction of Boundary wall for District Fisheries Office at Phulbani,1.0,2100971.0,M/s BIBHU PRASAD DEBATA,INR,"2,980,337","S.E,Phulbani R and B Division",Internal,"DAO, AEE Estimator of Phulbani (R and B) division",Priyabrata Samantara,04-May-2023 01:00 PM,techsummary_430977.pdf (307.11 KB),Finance,All the tender documents of 7 bidders are opened and downloaded,Priyabrata Samantara,04-May-2023 12:56 PM,finance_430977.pdf,BOQ Comparative Chart,"S.E,Phulbani R and B Division",Internal,"DAO, AEE estimator of Phulbani (RandB) Division",Priyabrata Samantara,04-May-2023 01:09 PM,finsummary_430977.pdf (225.92 KB),26-Jun-2023,"INR 3,505,867",120.0,Priyabrata Samantara,26-Jun-2023 05:18 PM,AOCBWFisheries.pdf (133.00 KB),"The work awarded to Sri Bibhu Prasad Debata, C Class Contractor on dtd. 05.06.2023",1,2101706,BHAGIRATHI DEBATA,21-Mar-2023 10:52 AM,Rejected-Finance,Unsuccessful in lottery,04-May-2023 01:09 PM,AOC,Construction of Boundary wall for District Fisheries Office at Phulbani,Construction of Boundary wall for District Fisheries Office at Phulbani,Please refer Tender documents. ,NA ,,Civil Works - Buildings,NA ,Tender,90.0,120.0,Phulbani,762001.0,NA ,NA ,NA ,"Office of the S.E, Phulbani R and B Division",No ,No,1.0,Fee/PreQual/Technical/Finance,.pdf,"RC,PAN,GSTIN,Affidavits,Schedule A,E,F and other legal documents as per DTCN","S.E , Phulbani R and B Division","Office of the S.E, Phulbani R and B Division,Contractorpada,Phulbani,Kandhamal",EIC-CIVIL||SERNB-CIRCLE-BERHAMPUR||EERNB-DIVN-PHULBANI,S E R AND B PLB 44 2022 23,2023_EICCL_86867_1,Yes,Open Tender,Percentage,Works,1.0,No,No,Online,No,No,No,"6,000",0.0,Nil,Nil,No,13-Mar-2023 10:00 AM,23-Mar-2023 11:30 AM,13-Mar-2023 10:10 AM,22-Mar-2023 05:00 PM,NA ,NA ,13-Mar-2023 10:15 AM,22-Mar-2023 05:00 PM,1.0,ICICI BANK,"35,059",Yes,fixed,,Nil,Nil,AOC
,,,,,,,,,,,,,,,,,,,,,,,,,,,,,,,,,,2,2102305,Manoj Kumar Behera,22-Mar-2023 03:27 PM,Rejected-Finance,Allowing price preference L1 but Unsuccessful in lottery,04-May-2023 01:09 PM,AOC,,,,,,,,,,,,,,,,,,,,,.xls,Bill of Quantities,,,,,,,,,,,,,,,,,,,,,,,,,,,,,,2.0,ICICI NEFT/RTGS,,,,,,,AOC
,,,,,,,,,,,,,,,,,,,,,,,,,,,,,,,,,,3,2100971,M/s BIBHU PRASAD DEBATA,20-Mar-2023 09:55 AM,Accepted-AOC,Successful winner in lottery and agreement drawn in favour of Bibhu Prasad Debata,26-Jun-2023 05:20 PM,AOC,,,,,,,,,,,,,,,,,,,,,,,,,,,,,,,,,,,,,,,,,,,,,,,,,,,,,,,,,,,,AOC
,,,,,,,,,,,,,,,,,,,,,,,,,,,,,,,,,,4,2102191,PRABHASINI PATTNAYAK,22-Mar-2023 03:39 PM,Rejected-Finance,Unsuccessful in lottery,04-May-2023 01:09 PM,AOC,,,,,,,,,,,,,,,,,,,,,,,,,,,,,,,,,,,,,,,,,,,,,,,,,,,,,,,,,,,,AOC
,,,,,,,,,,,,,,,,,,,,,,,,,,,,,,,,,,5,2102164,Saroj Kumar Nayak,22-Mar-2023 12:35 PM,Rejected-Finance,Unsuccessful in lottery,04-May-2023 01:09 PM,AOC,,,,,,,,,,,,,,,,,,,,,,,,,,,,,,,,,,,,,,,,,,,,,,,,,,,,,,,,,,,,AOC
,,,,,,,,,,,,,,,,,,,,,,,,,,,,,,,,,,6,2102283,SRABANA KUMAR PRADHAN,22-Mar-2023 02:12 PM,Rejected-Finance,Allowing price preference L1 but Unsuccessful in lottery,04-May-2023 01:09 PM,AOC,,,,,,,,,,,,,,,,,,,,,,,,,,,,,,,,,,,,,,,,,,,,,,,,,,,,,,,,,,,,AOC
,,,,,,,,,,,,,,,,,,,,,,,,,,,,,,,,,,7,2102181,Sri Bijaya Kumar Bhatta,22-Mar-2023 03:30 PM,Rejected-Finance,Unsuccessful in lottery,04-May-2023 01:09 PM,AOC,,,,,,,,,,,,,,,,,,,,,,,,,,,,,,,,,,,,,,,,,,,,,,,,,,,,,,,,,,,,AOC
