Title,Work Description,Pre Qualification Details,Independent External Monitor/Remarks,Tender Value in ₹,Product Category,Sub category,Contract Type,Bid Validity(Days),Period Of Work(Days),Location,Pincode,Pre Bid Meeting Place,Pre Bid Meeting Address,Pre Bid Meeting Date,Bid Opening Place,Should Allow NDA Tender,Allow Preferential Bidder,Organisation Chain,Tender Reference Number,Tender ID,Withdrawal Allowed,Tender Type,Form of contract,Tender Category,No. of Covers,General Technical Evaluation Allowed,ItemWise Technical Evaluation Allowed,Payment Mode,Is Multi Currency Allowed For BOQ,Is Multi Currency Allowed For Fee,Allow Two Stage Bidding,Cover No,Cover,Document Type,Description,S.No,Bank Name,Name,Address,EMD Amount in ₹,EMD Exemption Allowed,EMD Fee Type,EMD Percentage,EMD Payable To,EMD Payable At,Tender Fee in ₹,VAT Charges in ₹,Fee Payable To,Fee Payable At,Tender Fee Exemption Allowed,Publish Date,Bid Opening Date,Document Download / Sale Start Date,Document Download / Sale End Date,Clarification Start Date,Clarification End Date,Bid Submission Start Date,Bid Submission End Date,Tender Stage,S.No,Bid Number,Bidder Name,Awarded Currency,Awarded Value,Contract Date :,Total Contract Value :,Work Completion Period in days :,Updated By :,Updated on :,AOC document :,AOC Description :,Committee Chairperson/Co-ordinator Name :,Committee Chairperson/Co-ordinator Type :,Committee Members :,Updated By :.1,Updated on :.1,Document :,Organisation Chain :,Tender ID :,Tender Ref No :,Tender Title :,S.No.1,Bid Number.1,Bidder Name.1,Submitted Date,Status,Remarks,Status Updated On,Committee Chairperson/Co-ordinator Name :.1,Committee Chairperson/Co-ordinator Type :.1,Committee Members :.1,Updated By :.2,Updated On :,Document :.1,Type :,Summary :,Updated By :.3,Updated On :.1,Document :.2,BOQ Comparative Chart :,Tender Stage
Extension of Distribution System of Badakuleibira-III LIP Under Jamda Block in Mayurbhanj District,Extension of Distribution System of Badakuleibira-III LIP Under Jamda Block in Mayurbhanj District,Please refer Tender documents ,NA ,"5,18,402",Civil Works - Lift Irrigation Schemes,NA ,Tender,60.0,60.0,Karanjia,757037.0,NA ,NA ,NA ,Karanjia,No ,No,Orissa Lift Irrigation Corporation||LI BALASORE||LI Division Karanjia,e-Procurement Notice Bid ID 18 EELID (KJA/2022-23),2023_OLIC_86624_5,Yes,National Competitive Bid,Percentage,Works,1.0,No,No,Online,No,No,No,1.0,Fee/PreQual/Technical/Finance,.pdf,"Tender paper Cost,EMD,GST Challan,GSTIN,PAN,Affidavit,Civil and HT License,Joint Venture Agreement",1.0,ICICI BANK,Executive Engineer,"At-Ankura,Po-Karanjia,Dist-Mayurbhanj","5,184",Yes,fixed,,Nil,Nil,"4,000",0.0,Nil,Nil,No,01-Mar-2023 06:00 PM,13-Mar-2023 11:00 AM,01-Mar-2023 06:00 PM,10-Mar-2023 05:00 PM,01-Mar-2023 06:00 PM ,06-Mar-2023 05:00 PM ,01-Mar-2023 06:00 PM,10-Mar-2023 05:00 PM,AOC,1.0,2097035.0,SASMITA RAM,INR,"440,694",03-Apr-2023,"INR 440,694",60.0,BIKRAMADITYA PANIGRAHY,02-Jun-2023 02:11 PM,Badakuleibira-III.pdf (321.00 KB),Award of Contract,Bikramaditya,Internal,"Bikramaditya, Kamala, Sarbeswar, Gangadhar",BIKRAMADITYA PANIGRAHY,20-Mar-2023 05:57 PM,finsummary_430273.pdf (263.88 KB),Orissa Lift Irrigation Corporation||LI BALASORE||LI Division Karanjia,2023_OLIC_86624_5,e-Procurement Notice Bid ID 18 EELID (KJA/2022-23),Extension of Distribution System of Badakuleibira-III LIP Under Jamda Block in Mayurbhanj District,1,2097463,GIRIDHARI JENA,10-Mar-2023 03:39 PM,Rejected-Finance,Not Selected in Lottery,20-Mar-2023 05:57 PM,Bikramaditya,Internal,"Bikramaditya, Kamala, Sarbeswar, Gangadhar",BIKRAMADITYA PANIGRAHY,17-Mar-2023 12:18 PM,techsummary_430273.pdf (375.96 KB),Finance,Bid opening Summary,BIKRAMADITYA PANIGRAHY,13-Mar-2023 04:50 PM,finance_430273.pdf,BOQ Comparative Chart,AOC
,,,,,,,,,,,,,,,,,,,,,,,,,,,,,,,,,,.xls,Bill of Quantities,2.0,ICICI NEFT/RTGS,,,,,,,,,,,,,,,,,,,,,,AOC,,,,,,,,,,,,,,,,,,,,,,,2,2097152,RANJAN KUMAR PANDA,10-Mar-2023 12:40 AM,Rejected-Finance,Not Selected in Lottery,20-Mar-2023 05:57 PM,,,,,,,,,,,,,AOC
,,,,,,,,,,,,,,,,,,,,,,,,,,,,,,,,,,,,,,,,,,,,,,,,,,,,,,,,,,,AOC,,,,,,,,,,,,,,,,,,,,,,,3,2096718,SAGARIKA GIRI,09-Mar-2023 01:55 PM,Rejected-AOC,Rejected,02-Jun-2023 02:11 PM,,,,,,,,,,,,,AOC
,,,,,,,,,,,,,,,,,,,,,,,,,,,,,,,,,,,,,,,,,,,,,,,,,,,,,,,,,,,AOC,,,,,,,,,,,,,,,,,,,,,,,4,2097035,SASMITA RAM,09-Mar-2023 06:24 PM,Accepted-AOC,Awarded,02-Jun-2023 02:11 PM,,,,,,,,,,,,,AOC
,,,,,,,,,,,,,,,,,,,,,,,,,,,,,,,,,,,,,,,,,,,,,,,,,,,,,,,,,,,AOC,,,,,,,,,,,,,,,,,,,,,,,5,2097419,Sujata Das,10-Mar-2023 02:55 PM,Rejected-Finance,Not Selected in Lottery,20-Mar-2023 05:57 PM,,,,,,,,,,,,,AOC
