Name,Address,Organisation Chain,Tender Reference Number,Tender ID,Withdrawal Allowed,Tender Type,Form of contract,Tender Category,No. of Covers,General Technical Evaluation Allowed,ItemWise Technical Evaluation Allowed,Payment Mode,Is Multi Currency Allowed For BOQ,Is Multi Currency Allowed For Fee,Allow Two Stage Bidding,EMD Amount in ₹,EMD Exemption Allowed,EMD Fee Type,EMD Percentage,EMD Payable To,EMD Payable At,Tender Fee in ₹,VAT Charges in ₹,Fee Payable To,Fee Payable At,Tender Fee Exemption Allowed,S.No,Bank Name,Cover No,Cover,Document Type,Description,Publish Date,Bid Opening Date,Document Download / Sale Start Date,Document Download / Sale End Date,Clarification Start Date,Clarification End Date,Bid Submission Start Date,Bid Submission End Date,Title,Work Description,Pre Qualification Details,Independent External Monitor/Remarks,Tender Value in ₹,Product Category,Sub category,Contract Type,Bid Validity(Days),Period Of Work(Days),Location,Pincode,Pre Bid Meeting Place,Pre Bid Meeting Address,Pre Bid Meeting Date,Bid Opening Place,Should Allow NDA Tender,Allow Preferential Bidder,Tender Stage,S.No,Bid Number,Bidder Name,Awarded Currency,Awarded Value,Contract Date :,Total Contract Value :,Work Completion Period in days :,Updated By :,Updated on :,AOC document :,AOC Description :,Organisation Chain :,Tender ID :,Tender Ref No :,Tender Title :,Committee Chairperson/Co-ordinator Name :,Committee Chairperson/Co-ordinator Type :,Committee Members :,Updated By :.1,Updated on :.1,Document :,Committee Chairperson/Co-ordinator Name :.1,Committee Chairperson/Co-ordinator Type :.1,Committee Members :.1,Updated By :.2,Updated On :,Document :.1,S.No.1,Bid Number.1,Bidder Name.1,Submitted Date,Status,Remarks,Status Updated On,Type :,Summary :,Updated By :.3,Updated On :.1,Document :.2,BOQ Comparative Chart :,Tender Stage
Executive Engineer,"At-Ankura,Po-Karanjia,Dist-Mayurbhanj",Orissa Lift Irrigation Corporation||LI BALASORE||LI Division Karanjia,e-Procurement Notice Bid ID 18 EELID (KJA/2022-23),2023_OLIC_86624_4,Yes,National Competitive Bid,Percentage,Works,1.0,No,No,Online,No,No,No,"5,298",Yes,fixed,,Nil,Nil,"4,000",0.0,Nil,Nil,No,1.0,ICICI BANK,1.0,Fee/PreQual/Technical/Finance,.pdf,"Tender paper Cost,EMD,GST Challan,GSTIN,PAN,Affidavit,Civil and HT License,Joint Venture Agreement",01-Mar-2023 05:00 PM,13-Mar-2023 11:00 AM,01-Mar-2023 05:00 PM,10-Mar-2023 05:00 PM,01-Mar-2023 05:00 PM ,06-Mar-2023 05:00 PM ,01-Mar-2023 05:00 PM,10-Mar-2023 05:00 PM,Extension of Distribution System of Basingi LIP Under Bahalda Block in Mayurbhanj District,Extension of Distribution System of Basingi LIP Under Bahalda Block in Mayurbhanj District,Please refer Tender documents ,NA ,"5,29,794",Civil Works - Lift Irrigation Schemes,NA ,Tender,60.0,60.0,Karanjia,757037.0,NA ,NA ,NA ,Karanjia,No ,No,AOC,1.0,2097409.0,Sujata Das,INR,"450,378",03-Apr-2023,"INR 450,378",60.0,BIKRAMADITYA PANIGRAHY,02-Jun-2023 02:09 PM,Basingi.pdf (321.00 KB),Award of Contract,Orissa Lift Irrigation Corporation||LI BALASORE||LI Division Karanjia,2023_OLIC_86624_4,e-Procurement Notice Bid ID 18 EELID (KJA/2022-23),Extension of Distribution System of Basingi LIP Under Bahalda Block in Mayurbhanj District,Bikramaditya,Internal,"Bikramaditya, Kamala, Sarbeswar, Gangadhar",BIKRAMADITYA PANIGRAHY,20-Mar-2023 05:54 PM,finsummary_430272.pdf (244.64 KB),Bikramaditya,Internal,"Bikramaditya, Kamala, Sarbeswar, Gangadhar",BIKRAMADITYA PANIGRAHY,17-Mar-2023 12:17 PM,techsummary_430272.pdf (375.97 KB),1,2097459,GIRIDHARI JENA,10-Mar-2023 03:37 PM,Rejected-Finance,Not Selected in Lottery,20-Mar-2023 05:54 PM,Finance,Bid opening Summary,BIKRAMADITYA PANIGRAHY,13-Mar-2023 04:39 PM,finance_430272.pdf,BOQ Comparative Chart,AOC
,,,,,,,,,,,,,,,,,,,,,,,,,,,2.0,ICICI NEFT/RTGS,,,.xls,Bill of Quantities,,,,,,,,,,,,,,,,,,,,,,,,,,,AOC,,,,,,,,,,,,,,,,,,,,,,,,,,,,,2,2097151,RANJAN KUMAR PANDA,10-Mar-2023 12:39 AM,Rejected-AOC,Rejected,02-Jun-2023 02:10 PM,,,,,,,AOC
,,,,,,,,,,,,,,,,,,,,,,,,,,,,,,,,,,,,,,,,,,,,,,,,,,,,,,,,,,,AOC,,,,,,,,,,,,,,,,,,,,,,,,,,,,,3,2096708,SAGARIKA GIRI,09-Mar-2023 01:50 PM,Rejected-Finance,Not Selected in Lottery,20-Mar-2023 05:54 PM,,,,,,,AOC
,,,,,,,,,,,,,,,,,,,,,,,,,,,,,,,,,,,,,,,,,,,,,,,,,,,,,,,,,,,AOC,,,,,,,,,,,,,,,,,,,,,,,,,,,,,4,2097032,SASMITA RAM,09-Mar-2023 06:16 PM,Rejected-Finance,Not Selected in Lottery,20-Mar-2023 05:54 PM,,,,,,,AOC
,,,,,,,,,,,,,,,,,,,,,,,,,,,,,,,,,,,,,,,,,,,,,,,,,,,,,,,,,,,AOC,,,,,,,,,,,,,,,,,,,,,,,,,,,,,5,2097409,Sujata Das,10-Mar-2023 02:26 PM,Accepted-AOC,Awarded,02-Jun-2023 02:10 PM,,,,,,,AOC
