Committee Chairperson/Co-ordinator Name :,Committee Chairperson/Co-ordinator Type :,Committee Members :,Updated By :,Updated On :,Financial Bid Opening Date:,Document :,Type :,Summary :,Updated By :.1,Updated On :.1,Document :.1,BOQ Comparative Chart :,Contract Date :,Total Contract Value :,Work Completion Period in days :,Updated By :.2,Updated on :,AOC document :,AOC Description :,S.No,Bid Number,Bidder Name,Submitted Date,Status,Remarks,Status Updated On,S.No.1,Bid Number.1,Bidder Name.1,Awarded Currency,Awarded Value,Organisation Chain :,Tender ID :,Tender Ref No :,Tender Title :,Type :.1,Summary :.1,Updated By :.3,Updated On :.2,Document :.2,Committee Chairperson/Co-ordinator Name :.1,Committee Chairperson/Co-ordinator Type :.1,Committee Members :.1,Updated By :.4,Updated on :.1,Document :.3,Tender Stage,S.No,Bank Name,EMD Amount in ₹,EMD Exemption Allowed,EMD Fee Type,EMD Percentage,EMD Payable To,EMD Payable At,Organisation Chain,Tender Reference Number,Tender ID,Withdrawal Allowed,Tender Type,Form of contract,Tender Category,No. of Covers,General Technical Evaluation Allowed,ItemWise Technical Evaluation Allowed,Payment Mode,Is Multi Currency Allowed For BOQ,Is Multi Currency Allowed For Fee,Allow Two Stage Bidding,Tender Fee in ₹,VAT Charges in ₹,Fee Payable To,Fee Payable At,Tender Fee Exemption Allowed,Name,Address,Title,Work Description,Pre Qualification Details,Independent External Monitor/Remarks,Tender Value in ₹,Product Category,Sub category,Contract Type,Bid Validity(Days),Period Of Work(Days),Location,Pincode,Pre Bid Meeting Place,Pre Bid Meeting Address,Pre Bid Meeting Date,Bid Opening Place,Should Allow NDA Tender,Allow Preferential Bidder,Cover No,Cover,Document Type,Description,Publish Date,Bid Opening Date,Document Download / Sale Start Date,Document Download / Sale End Date,Clarification Start Date,Clarification End Date,Bid Submission Start Date,Bid Submission End Date,Financial Bid Opening Date,Tender Stage
BISWANATH MARNDI,Internal,"Sri Kshiradhara Kandhapani S.E Nabarangpur, DAO Nabarangpur R and B Division and Er Sangeeta Gomango E.E. I.C. of Jeypore R and B Circle.",Biswanath Marndi,17-Sep-2025 01:09 PM,19-Sep-2025 11:15 AM,techsummary_547692.pdf (440.08 KB),Finance,Price bid of the above bidders Downloaded.,Ashok Kumar Behera,06-Oct-2025 10:59 AM,finance_547692.pdf,BOQ Comparative Chart,31-Jan-2026,"INR 20,788,466",330.0,Biswanath Marndi,31-Jan-2026 12:14 PM,ETypeAOC.pdf (1077.00 KB),FIRST LOWEST BID OF SRI BISHNU CHARAN NAYAK SELECTED THROUGH TRANSPARENT LOTTERY SYSTEM.,1,3030317,BISHNU CHARAN NAYAK,10-Aug-2025 08:23 PM,Accepted-AOC,FIRST LOWEST BIDDER,31-Jan-2026 12:14 PM,1.0,3030317.0,BISHNU CHARAN NAYAK,INR,"20,788,466",EIC-CIVIL||SERNB-CIRCLE-JEYPORE,2025_EICCL_116201_1,CCEJC R AND B 06/2025-26,CONSTRUCTION OF 8 NOS OF E TYPE QTRS S PLUS 2 FOR STAFF AT UMERKOTE,Technical,ABOVE BIDDERS ARE PROVISIONALLY QUALIFIED FOR TECHNICAL EVALUATION.,Ashok Kumar Behera,14-Aug-2025 11:36 AM,technical_547692.pdf,BISWANATH MARNDI,Internal,,Biswanath Marndi,31-Jan-2026 12:11 PM,finsummary_547692.pdf (3233.50 KB),AOC,1.0,ICICI BANK,"2,45,000",Yes,fixed,,Nil,Nil,EIC-CIVIL||SERNB-CIRCLE-JEYPORE,CCEJC R AND B 06/2025-26,2025_EICCL_116201_1,Yes,National Competitive Bid,Percentage,Works,2.0,No,No,Online,No,No,No,"10,000",0.0,Nil,Nil,No,CHIEF CONSTRUCTION ENGINEER,Chief Construction Engineer Jeypore R and B circle Jeypore,CONSTRUCTION OF 8 NOS OF E TYPE QTRS S PLUS 2 FOR STAFF AT UMERKOTE,CIVIL WORKS,Please refer Tender documents. ,NA ,"2,44,54,141",Civil Works - Buildings,BUILDING ,Tender,90.0,330.0,NABARANGPUR,764059.0,NA ,NA ,NA ,O/O C.C.E R and B Circle Jeypore,No ,No,1.0,Fee/PreQual/Technical,.pdf,"Tender Cost, EMD, GST Registration Certificate and GSTIN, PAN, Contractor RC",28-Jul-2025 06:00 PM,12-Aug-2025 10:00 AM,28-Jul-2025 06:00 PM,11-Aug-2025 05:00 PM,NA ,NA ,28-Jul-2025 06:00 PM,11-Aug-2025 05:00 PM,19-Sep-2025 11:15 AM,AOC
,,,,,,,,,,,,,,,,,,,,2,3029474,CHANDRA SEKHAR JENA,09-Aug-2025 08:07 PM,Rejected-Finance,SECOND LOWEST BIDDER,31-Jan-2026 12:11 PM,,,,,,,,,,,,,,,,,,,,,AOC,2.0,ICICI NEFT/RTGS,,,,,,,,,,,,,,,,,,,,,,,,,,,,,,,,,,,,,,,,,,,,,,,,.pdf,Affidavit Undertakings and Other Documents as per SBD/DTCN,,,,,,,,,,AOC
,,,,,,,,,,,,,,,,,,,,3,3027353,PANDABA KUMAR PADHI,10-Aug-2025 03:48 PM,Rejected-Technical,CLAUSE NO.10(I) OF DTCN,17-Sep-2025 01:09 PM,,,,,,,,,,,,,,,,,,,,,AOC,,,,,,,,,,,,,,,,,,,,,,,,,,,,,,,,,,,,,,,,,,,,,,,,2.0,Finance,.xls,BOQ,,,,,,,,,,AOC
,,,,,,,,,,,,,,,,,,,,4,3031183,SAUMYA RANJAN MISHRA,11-Aug-2025 01:29 PM,Rejected-Finance,THIRD LOWEST BIDDER,31-Jan-2026 12:11 PM,,,,,,,,,,,,,,,,,,,,,AOC,,,,,,,,,,,,,,,,,,,,,,,,,,,,,,,,,,,,,,,,,,,,,,,,,,,,,,,,,,,,,AOC
,,,,,,,,,,,,,,,,,,,,5,3031931,SRI SANJAY SARKAR,11-Aug-2025 04:55 PM,Rejected-Finance,FIRST LOWEST BIDDER PARTICIPATED IN LOTTERY.,31-Jan-2026 12:11 PM,,,,,,,,,,,,,,,,,,,,,AOC,,,,,,,,,,,,,,,,,,,,,,,,,,,,,,,,,,,,,,,,,,,,,,,,,,,,,,,,,,,,,AOC
