Cover No,Cover,Document Type,Description,Organisation Chain,Tender Reference Number,Tender ID,Withdrawal Allowed,Tender Type,Form of contract,Tender Category,No. of Covers,General Technical Evaluation Allowed,ItemWise Technical Evaluation Allowed,Payment Mode,Is Multi Currency Allowed For BOQ,Is Multi Currency Allowed For Fee,Allow Two Stage Bidding,S.No,Bank Name,Name,Address,Tender Fee in ₹,Fee Payable To,Fee Payable At,Tender Fee Exemption Allowed,EMD Amount in ₹,EMD Exemption Allowed,EMD Fee Type,EMD Percentage,EMD Payable To,EMD Payable At,Title,Work Description,Pre Qualification Details,Independent External Monitor/Remarks,Tender Value in ₹,Product Category,Sub category,Contract Type,Bid Validity(Days),Period Of Work(Days),Location,Pincode,Pre Bid Meeting Place,Pre Bid Meeting Address,Pre Bid Meeting Date,Bid Opening Place,Should Allow NDA Tender,Allow Preferential Bidder,Publish Date,Bid Opening Date,Document Download / Sale Start Date,Document Download / Sale End Date,Clarification Start Date,Clarification End Date,Bid Submission Start Date,Bid Submission End Date,Financial Bid Opening Date,Tender Stage,S.No,Bid Number,Bidder Name,Submitted Date,Status,Remarks,Status Updated On,Contract Date :,Total Contract Value :,Work Completion Period in days :,Updated By :,Updated on :,AOC document :,Type :,Summary :,Updated By :.1,Updated On :,Document :,BOQ Comparative Chart :,Committee Chairperson/Co-ordinator Name :,Committee Chairperson/Co-ordinator Type :,Committee Members :,Updated By :.2,Updated On :.1,Financial Bid Opening Date:,Document :.1,Committee Chairperson/Co-ordinator Name :.1,Committee Chairperson/Co-ordinator Type :.1,Committee Members :.1,Updated By :.3,Updated on :.1,Document :.2,Type :.1,Summary :.1,Updated By :.4,Updated On :.2,Document :.3,Organisation Chain :,Tender ID :,Tender Ref No :,Tender Title :,S.No.1,Bid Number.1,Bidder Name.1,Awarded Currency,Awarded Value,Tender Stage
1.0,Fee/PreQual/Technical,.pdf,"Copy of PAN, GST, Affidavits as per DTCN",WATCO Bhubaneswar||Director (Operation) Watco||GM WATCO DIVISION-II BBSR,GMWATCO-II/ 35/2025-26 Dt.10.11.2025,2025_GWCDI_121083_1,Yes,National Competitive Bid,Percentage,Works,2.0,No,No,Online,No,No,No,1.0,ICICI BANK,General Manager,"General Manager, WATCO Division-II, Unit-V, Bhubaneswar-751001, Odisha, Phone (0674) 2390322","11,800",Nil,Nil,No,"68,560",Yes,fixed,,Nil,Nil,"Const. of Positive suction pump house alongwith Supply, Installation and Commissioning of Centrifugal Pump set for w/s from Sub-Division pump house (Reservoir) to Power house, Sastri Nagar, MLA Colony, HLT Tank Unit-VIII Ward No.47, BMC, BBSR","Const. of Positive suction pump house alongwith Supply, Installation and Commissioning of Centrifugal Pump set for w/s from Sub-Division pump house (Reservoir) to Power house, Sastri Nagar, MLA Colony, HLT Tank Unit-VIII Ward No.47, BMC, BBSR",Please refer Tender documents. ,NA ,"68,56,000",Civil Works - Water Works,NA ,Tender,120.0,90.0,"Unit-VIII, Bhubaneswar",751012.0,NA ,NA ,NA ,Bhubaneswar,No ,No,14-Nov-2025 11:00 AM,29-Nov-2025 12:30 PM,14-Nov-2025 11:00 AM,28-Nov-2025 05:00 PM,14-Nov-2025 11:00 AM ,19-Nov-2025 05:00 PM ,14-Nov-2025 11:00 AM,28-Nov-2025 05:00 PM,10-Dec-2025 11:00 AM,AOC,1,3246354,Rakesh Kumar Jena,22-Nov-2025 02:13 PM,Accepted-AOC,Lowest bidder in Lottery,20-Jan-2026 12:38 PM,20-Jan-2026,"INR 5,828,448",90.0,Rajendra Nath Nayak,20-Jan-2026 12:38 PM,AOC.pdf (585.00 KB),Finance,Five no financial bids are received online and the bid is admitted subject to detail scrutiny after downloading the bid documents and after which the bid will be finally determined as valid or invalid,Rajendra Nath Nayak,10-Dec-2025 11:13 AM,,BOQ Comparative Chart,General Manager,Internal,,Rajendra Nath Nayak,09-Dec-2025 03:52 PM,10-Dec-2025 11:00 AM,techsummary_563329.pdf (507.90 KB),General Manager,Internal,,Rajendra Nath Nayak,20-Jan-2026 12:35 PM,finsummary_563329.pdf (715.12 KB),Technical,Five no technical bids are received online and the bid is admitted subject to detail scrutiny after downloading the bid documents and after which the bid will be finally determined as valid or invalid,Rajendra Nath Nayak,29-Nov-2025 12:40 PM,,WATCO Bhubaneswar||Director (Operation) Watco||GM WATCO DIVISION-II BBSR,2025_GWCDI_121083_1,GMWATCO-II/ 35/2025-26 Dt.10.11.2025,"Const. of Positive suction pump house alongwith Supply, Installation and Commissioning of Centrifugal Pump set for w/s from Sub-Division pump house (Reservoir) to Power house, Sastri Nagar, MLA Colony, HLT Tank Unit-VIII Ward No.47, BMC, BBSR",1.0,3246354.0,Rakesh Kumar Jena,INR,"5,828,448",AOC
,,.pdf,"Certificates, Formats, Schedules and other documents if any as per DTCN",,,,,,,,,,,,,,,2.0,ICICI NEFT/RTGS,,,,,,,,,,,,,,,,,,,,,,,,,,,,,,,,,,,,,,,,AOC,2,3263209,SHREE MAA CONSTRUCTIONS,28-Nov-2025 01:20 PM,Rejected-AOC,Not a lowest bidder,20-Jan-2026 12:38 PM,,,,,,,,,,,,,,,,,,,,,,,,,,,,,,,,,,,,,,,,AOC
2.0,Finance,.xls,Bill of Quantity,,,,,,,,,,,,,,,,,,,,,,,,,,,,,,,,,,,,,,,,,,,,,,,,,,,,,,,,AOC,3,3262680,SOUBHAGYA KUMAR JENA,28-Nov-2025 11:32 AM,Rejected-AOC,Not a lowest bidder,20-Jan-2026 12:38 PM,,,,,,,,,,,,,,,,,,,,,,,,,,,,,,,,,,,,,,,,AOC
,,,,,,,,,,,,,,,,,,,,,,,,,,,,,,,,,,,,,,,,,,,,,,,,,,,,,,,,,,,AOC,4,3246043,SUBHAKANTA JENA,22-Nov-2025 12:29 PM,Rejected-AOC,Not a lowest bidder,20-Jan-2026 12:38 PM,,,,,,,,,,,,,,,,,,,,,,,,,,,,,,,,,,,,,,,,AOC
,,,,,,,,,,,,,,,,,,,,,,,,,,,,,,,,,,,,,,,,,,,,,,,,,,,,,,,,,,,AOC,5,3254811,SUNIL KUMAR PAIKARAY,25-Nov-2025 04:40 PM,Rejected-AOC,Not a lowest bidder,20-Jan-2026 12:38 PM,,,,,,,,,,,,,,,,,,,,,,,,,,,,,,,,,,,,,,,,AOC
