Name,Address,Title,Work Description,Pre Qualification Details,Independent External Monitor/Remarks,Tender Value in ₹,Product Category,Sub category,Contract Type,Bid Validity(Days),Period Of Work(Days),Location,Pincode,Pre Bid Meeting Place,Pre Bid Meeting Address,Pre Bid Meeting Date,Bid Opening Place,Should Allow NDA Tender,Allow Preferential Bidder,S.No,Instrument Type,Publish Date,Bid Opening Date,Document Download / Sale Start Date,Document Download / Sale End Date,Clarification Start Date,Clarification End Date,Bid Submission Start Date,Bid Submission End Date,Cover No,Cover,Document Type,Description,EMD Amount in ₹,EMD Exemption Allowed,EMD Fee Type,EMD Percentage,EMD Payable To,EMD Payable At,Tender Fee in ₹,Fee Payable To,Fee Payable At,Tender Fee Exemption Allowed,Organisation Chain,Tender Reference Number,Tender ID,Withdrawal Allowed,Tender Type,Form of contract,Tender Category,No. of Covers,General Technical Evaluation Allowed,ItemWise Technical Evaluation Allowed,Payment Mode,Is Multi Currency Allowed For BOQ,Is Multi Currency Allowed For Fee,Allow Two Stage Bidding,Tender Stage,Committee Chairperson/Co-ordinator Name :,Committee Chairperson/Co-ordinator Type :,Committee Members :,Updated By :,Updated on :,Document :,Organisation Chain :,Tender ID :,Tender Ref No :,Tender Title :,S.No,Bid Number,Bidder Name,Awarded Currency,Awarded Value,Type :,Summary :,Updated By :.1,Updated On :,Document :.1,BOQ Comparative Chart :,Contract Date :,Total Contract Value :,Work Completion Period in days :,Updated By :.2,Updated on :.1,AOC document :,AOC Description :,S.No.1,Bid Number.1,Bidder Name.1,Submitted Date,Status,Remarks,Status Updated On,Committee Chairperson/Co-ordinator Name :.1,Committee Chairperson/Co-ordinator Type :.1,Committee Members :.1,Updated By :.3,Updated On :.1,Document :.2,Tender Stage
"BLOCK DEVELOPMENT OFFICER, KHALLIKOTE","OFFICE OF THE PANCHAYAT SAMITI, KHALLIKOTE",CONSTRUCTION OF INCOMPLETE KALYAN MANDAP AT KANCHANA,CONSTRUCTION OF INCOMPLETE KALYAN MANDAP AT KANCHANA,Please refer Tender documents. ,NA ,"19,20,543",Civil Works - Others,NA ,Tender,90.0,180.0,KHALLIKOTE,761030.0,NA ,NA ,NA ,"BLOCK OFFICE, KHALLIKOTE",No ,No,1,DD - Demand Draft,20-Dec-2025 10:00 AM,12-Jan-2026 11:00 AM,20-Dec-2025 10:00 AM,08-Jan-2026 05:00 PM,NA ,NA ,20-Dec-2025 10:00 AM,08-Jan-2026 05:00 PM,1.0,Fee/PreQual/Technical/Finance,.pdf,DTCN,"19,205",Yes,percentage,1.0%,"BDO, KHALLIKOTE","BDO, KHALLIKOTE","6,000","BDO, KHALLIKOTE","BDO, KHALLIKOTE",No,Panchayati Raj and Drinking Water Department Odisha||Zilla Parisad Ganjam||KHALLIKOTE Block,KHA/DTCN/03/2025-26,2025_PRBKI_123518_7,Yes,Open Tender,Percentage,Works,1.0,No,No,Offline,No,No,No,AOC,"Block Development Officer, Khallikote",Internal,"Asst. Engineer, Section Officer, Asst. Executive Engineer, Block Finance Officer",DEBASHIS SAMAL,11-Mar-2026 03:54 PM,finsummary_572465.pdf (839.36 KB),Panchayati Raj and Drinking Water Department Odisha||Zilla Parisad Ganjam||KHALLIKOTE Block,2025_PRBKI_123518_7,KHA/DTCN/03/2025-26,CONSTRUCTION OF INCOMPLETE KALYAN MANDAP AT KANCHANA,1.0,3347960.0,GIRISH CHANDRA PATNAIK,INR,"1,920,543",Finance,As per final comperative Statement.,DEBASHIS SAMAL,09-Mar-2026 05:30 PM,finance_572465.pdf,BOQ Comparative Chart,13-Mar-2026,"INR 1,920,543",180.0,DEBASHIS SAMAL,11-Mar-2026 04:49 PM,FinalstatementofDTCN03.pdf (839.00 KB),"As both the bidder quoted in schedule rate, a open lottery has been held and the Girish Pattnaik won the lotery.",1.0,3348025.0,GANESWAR MISHRA,07-Jan-2026 05:59 PM,Not Admitted-Fee/PreQual/Technical/Finance,Others-DD & Amount not submitted in Offline mode.,09-Mar-2026 05:30 PM,"Block Development Officer, Khallikote",Internal,"Asst. Engineer, Section Officer, Asst. Executive Engineer, Block Finance Officer",DEBASHIS SAMAL,09-Mar-2026 05:33 PM,techsummary_572465.pdf (839.36 KB),AOC
,,,,,,,,,,,,,,,,,,,,2,BC - Bankers Cheque,,,,,,,,,,,.xls,BOQ,,,,,,,,,,,,,,,,,,,,,,,,,AOC,,,,,,,,,,,,,,,,,,,,,,,,,,,,,2.0,3347960.0,GIRISH CHANDRA PATNAIK,07-Jan-2026 04:43 PM,Accepted-AOC,"As both the bidder qouted in schedule rate, a open lotery has been held and Sri Girish Pattnaik won the lottery.",11-Mar-2026 04:50 PM,,,,,,,AOC
,,,,,,,,,,,,,,,,,,,,3,SS - Small Savings Instrument,,,,,,,,,,,,,,,,,,,,,,,,,,,,,,,,,,,,,AOC,,,,,,,,,,,,,,,,,,,,,,,,,,,,,3.0,3348979.0,LAXMI BEHERA,08-Jan-2026 03:37 PM,Not Admitted-Fee/PreQual/Technical/Finance,Others-DD & Amount not submitted in Offline mode.,09-Mar-2026 05:30 PM,,,,,,,AOC
,,,,,,,,,,,,,,,,,,,,4,BG - Bank Guarantee,,,,,,,,,,,,,,,,,,,,,,,,,,,,,,,,,,,,,AOC,,,,,,,,,,,,,,,,,,,,,,,,,,,,,4.0,3348101.0,NAYAN KUMAR SWAIN,07-Jan-2026 06:36 PM,Rejected-Technical,Lost in the Lotery.,09-Mar-2026 05:33 PM,,,,,,,AOC
,,,,,,,,,,,,,,,,,,,,5,TD- Term Deposit,,,,,,,,,,,,,,,,,,,,,,,,,,,,,,,,,,,,,AOC,,,,,,,,,,,,,,,,,,,,,,,,,,,,,,,,,,,,,,,,,,AOC
