Organisation Chain :,Tender ID :,Tender Ref No :,Tender Title :,S.No,Bid Number,Bidder Name,Awarded Currency,Awarded Value,S.No.1,Bid Number.1,Bidder Name.1,Submitted Date,Status,Remarks,Status Updated On,Contract Date :,Total Contract Value :,Work Completion Period in days :,Updated By :,Updated on :,AOC document :,AOC Description :,Type :,Summary :,Updated By :.1,Updated On :,Document :,BOQ Comparative Chart :,Committee Chairperson/Co-ordinator Name :,Committee Chairperson/Co-ordinator Type :,Committee Members :,Updated By :.2,Updated on :.1,Document :.1,Committee Chairperson/Co-ordinator Name :.1,Committee Chairperson/Co-ordinator Type :.1,Committee Members :.1,Updated By :.3,Updated On :.1,Document :.2,Tender Stage,S.No,Bank Name,Publish Date,Bid Opening Date,Document Download / Sale Start Date,Document Download / Sale End Date,Clarification Start Date,Clarification End Date,Bid Submission Start Date,Bid Submission End Date,S.No.1,Corrigendum Title,Corrigendum Type,View,Cover No,Cover,Document Type,Description,Name,Address,Organisation Chain,Tender Reference Number,Tender ID,Withdrawal Allowed,Tender Type,Form of contract,Tender Category,No. of Covers,General Technical Evaluation Allowed,ItemWise Technical Evaluation Allowed,Payment Mode,Is Multi Currency Allowed For BOQ,Is Multi Currency Allowed For Fee,Allow Two Stage Bidding,EMD Amount in ₹,EMD Exemption Allowed,EMD Fee Type,EMD Percentage,EMD Payable To,EMD Payable At,Tender Fee in ₹,VAT Charges in ₹,Fee Payable To,Fee Payable At,Tender Fee Exemption Allowed,Title,Work Description,Pre Qualification Details,Independent External Monitor/Remarks,Tender Value in ₹,Product Category,Sub category,Contract Type,Bid Validity(Days),Period Of Work(Days),Location,Pincode,Pre Bid Meeting Place,Pre Bid Meeting Address,Pre Bid Meeting Date,Bid Opening Place,Should Allow NDA Tender,Allow Preferential Bidder,Tender Stage
EIC-CIVIL||SERNB-CIRCLE-BERHAMPUR||EERNB-DIVN-GANJAM I,2025_EICCL_117661_17,SE RandB Divn No.I-BAM-04/2025-26,Provision of annual comprehensive maintenance contract of fire-fighting alarm system and estimate for fire-fighting system and fire extinguisher at CHC Patrapur.,1.0,3076844.0,KK SERVICE,INR,"1,709,240",1,3076844,KK SERVICE,11-Sep-2025 07:14 PM,Accepted-AOC,Win in lottery,25-Mar-2026 11:04 AM,25-Mar-2026,"INR 1,709,240",365.0,Somanath Tripathy,25-Mar-2026 11:04 AM,1320.pdf (846.00 KB),Contract Awarded to Smt / Sri KK Service,Finance,"6Nos Bidder are participate, Tender Under Scrutiny.",Somanath Tripathy,15-Sep-2025 10:45 AM,finance_551432.pdf,BOQ Comparative Chart,"Superintending Engineer Ganjam (R and B) Division No.I, Berhampur",Internal,Sr. DAO and A.E.E Estimator,Somanath Tripathy,25-Mar-2026 11:00 AM,finsummary_551432.pdf (845.83 KB),"Superintending Engineer Ganjam (R and B) Division No.I, Berhampur",Internal,Sr. DAO and A.E.E Estimator,Somanath Tripathy,25-Mar-2026 10:56 AM,techsummary_551432.pdf (845.83 KB),AOC,1.0,ICICI BANK,04-Sep-2025 06:55 PM,13-Sep-2025 11:30 AM,04-Sep-2025 06:55 PM,12-Sep-2025 04:00 PM,04-Sep-2025 06:55 PM ,12-Sep-2025 04:00 PM ,04-Sep-2025 06:55 PM,12-Sep-2025 04:00 PM,1.0,"DTCN, Modification",Other,,1.0,Fee/PreQual/Technical/Finance,.pdf,"Tender Cost EMD(Online) RC,PAN, GSTIN, Affidavit Other Documents and Forms as per DTCN.",SE R and B Division No I Berhampur,SE R and B Division No I Berhampur,EIC-CIVIL||SERNB-CIRCLE-BERHAMPUR||EERNB-DIVN-GANJAM I,SE RandB Divn No.I-BAM-04/2025-26,2025_EICCL_117661_17,Yes,Open Tender,Percentage,Works,1.0,No,No,Online,No,No,No,"20,200",Yes,fixed,,Nil,Nil,"6,000",0.0,Nil,Nil,No,Provision of annual comprehensive maintenance contract of fire-fighting alarm system and estimate for fire-fighting system and fire extinguisher at CHC Patrapur.,Provision of annual comprehensive maintenance contract of fire-fighting alarm system and estimate for fire-fighting system and fire extinguisher at CHC Patrapur.,Please refer Tender documents. ,NA ,"20,10,634",Electrical Works,NA ,Tender,90.0,365.0,Berhampur,760005.0,NA ,NA ,NA ,SE R and B Division No I Berhampur,No ,No,AOC
,,,,,,,,,2,3076794,M/S FIRESTOP SALES AND SERVICES,12-Sep-2025 12:36 PM,Rejected-Technical,Rejected due to not submit proper authorization,25-Mar-2026 10:56 AM,,,,,,,,,,,,,,,,,,,,,,,,,,AOC,2.0,ICICI NEFT/RTGS,,,,,,,,,,,,,,,.xls,Bill of Quantity,,,,,,,,,,,,,,,,,,,,,,,,,,,,,,,,,,,,,,,,,,,,,,AOC
,,,,,,,,,3,3072808,M/S OM CONSTRUCTION,10-Sep-2025 07:16 PM,Rejected-Technical,Rejected due to not submit proper authorization,25-Mar-2026 10:56 AM,,,,,,,,,,,,,,,,,,,,,,,,,,AOC,,,,,,,,,,,,,,,,,,,,,,,,,,,,,,,,,,,,,,,,,,,,,,,,,,,,,,,,,,,,,,,,AOC
,,,,,,,,,4,3077417,S R INDUSTRIES,12-Sep-2025 12:57 PM,Rejected-AOC,reject in lottery,25-Mar-2026 11:04 AM,,,,,,,,,,,,,,,,,,,,,,,,,,AOC,,,,,,,,,,,,,,,,,,,,,,,,,,,,,,,,,,,,,,,,,,,,,,,,,,,,,,,,,,,,,,,,AOC
,,,,,,,,,5,3077445,TOSHALI INDUSTRIES PRIVATE LIMITED,12-Sep-2025 01:08 PM,Rejected-Technical,Rejected due to not submit proper authorization,25-Mar-2026 10:56 AM,,,,,,,,,,,,,,,,,,,,,,,,,,AOC,,,,,,,,,,,,,,,,,,,,,,,,,,,,,,,,,,,,,,,,,,,,,,,,,,,,,,,,,,,,,,,,AOC
,,,,,,,,,6,3077101,TRANSTECH SOLUTION,12-Sep-2025 12:23 PM,Rejected-Technical,Rejected due to not submit proper authorization,25-Mar-2026 10:56 AM,,,,,,,,,,,,,,,,,,,,,,,,,,AOC,,,,,,,,,,,,,,,,,,,,,,,,,,,,,,,,,,,,,,,,,,,,,,,,,,,,,,,,,,,,,,,,AOC
