Organisation Chain,Tender Reference Number,Tender ID,Withdrawal Allowed,Tender Type,Form of contract,Tender Category,No. of Covers,General Technical Evaluation Allowed,ItemWise Technical Evaluation Allowed,Payment Mode,Is Multi Currency Allowed For BOQ,Is Multi Currency Allowed For Fee,Allow Two Stage Bidding,Cover No,Cover,Document Type,Description,Name,Address,Tender Fee in ₹,VAT Charges in ₹,Fee Payable To,Fee Payable At,Tender Fee Exemption Allowed,Title,Work Description,Pre Qualification Details,Independent External Monitor/Remarks,Tender Value in ₹,Product Category,Sub category,Contract Type,Bid Validity(Days),Period Of Work(Days),Location,Pincode,Pre Bid Meeting Place,Pre Bid Meeting Address,Pre Bid Meeting Date,Bid Opening Place,Should Allow NDA Tender,Allow Preferential Bidder,S.No,Bank Name,EMD Amount in ₹,EMD Exemption Allowed,EMD Fee Type,EMD Percentage,EMD Payable To,EMD Payable At,Publish Date,Bid Opening Date,Document Download / Sale Start Date,Document Download / Sale End Date,Clarification Start Date,Clarification End Date,Bid Submission Start Date,Bid Submission End Date,Financial Bid Opening Date,Tender Stage,S.No,Bid Number,Bidder Name,Submitted Date,Status,Remarks,Status Updated On,Contract Date :,Total Contract Value :,Work Completion Period in days :,Updated By :,Updated on :,AOC document :,AOC Description :,Committee Chairperson/Co-ordinator Name :,Committee Chairperson/Co-ordinator Type :,Committee Members :,Updated By :.1,Updated On :,Financial Bid Opening Date:,Document :,Type :,Summary :,Updated By :.2,Updated On :.1,Document :.1,BOQ Comparative Chart :,Organisation Chain :,Tender ID :,Tender Ref No :,Tender Title :,Type :.1,Summary :.1,Updated By :.3,Updated On :.2,Document :.2,Committee Chairperson/Co-ordinator Name :.1,Committee Chairperson/Co-ordinator Type :.1,Committee Members :.1,Updated By :.4,Updated on :.1,Document :.3,S.No.1,Bid Number.1,Bidder Name.1,Awarded Currency,Awarded Value,Tender Stage
CE RW I||RWCIRCLE-KENDRAPARA,Tender Online RCK-08/24,2024_CERWI_101806_5,Yes,National Competitive Bid,Percentage,Works,2.0,No,No,Online,No,No,No,1.0,Fee/PreQual/Technical,.pdf,"Tender Paper Cost, EMD, GSTIN, PAN, Registration Certificate, Labor License","Chief Construction Engineer,R.W Circle KPD-JJP","O/o CCE,R.W Circle,Kendrapara-Jajpur","10,000",0.0,Nil,Nil,No,Construction of New PHC Building at Sankhachila under Korei Block in the Dist of Jajpur for the year 2023-24.,Construction of Building work,Please refer tender documents ,NA ,"1,04,34,881",Civil Works - Buildings,NA ,Tender,90.0,365.0,Jajpur,755001.0,NA ,NA ,NA ,"O/o CCE,R.W Circle,Kendrapara-Jajpur",No ,No,1.0,ICICI BANK,"1,04,349",Yes,percentage,1.0%,Nil,Nil,26-Feb-2024 05:30 PM,13-Mar-2024 11:00 AM,26-Feb-2024 05:30 PM,12-Mar-2024 05:00 PM,26-Feb-2024 05:30 PM ,12-Mar-2024 02:00 PM ,26-Feb-2024 05:30 PM,12-Mar-2024 05:00 PM,18-Jun-2024 01:30 PM,AOC,1,2475465,JANGYADATTA TRIPATHY,12-Mar-2024 03:52 PM,Rejected-Finance,Rejected Bidder,20-Mar-2026 02:49 PM,20-Mar-2026,"INR 9,360,088.41",365.0,Satyajit Dalai,20-Mar-2026 02:52 PM,phcsankhachila.pdf (650.00 KB),The work has been awarded to Yashobanta Nayak,CCE,Internal,,Puspanjali Behera,12-Jun-2024 02:45 PM,18-Jun-2024 01:30 PM,techsummary_496637.pdf (3022.18 KB),Finance,05 no of bidders have participated,Puspanjali Behera,18-Jun-2024 03:20 PM,,BOQ Comparative Chart,CE RW I||RWCIRCLE-KENDRAPARA,2024_CERWI_101806_5,Tender Online RCK-08/24,Construction of New PHC Building at Sankhachila under Korei Block in the Dist of Jajpur for the year 2023-24.,Technical,05 no of bidders have been participated,Puspanjali Behera,13-Mar-2024 03:59 PM,,CCE,Internal,,Satyajit Dalai,20-Mar-2026 02:49 PM,finsummary_496637.pdf (126.81 KB),1.0,2474514.0,YASHOBANTA NAYAK,INR,"9,360,088.41",AOC
,,,,,,,,,,,,,,,,.pdf,"No Relationship , Affidavit of Correctness Certificate undertaking duly filled, all affidavits",,,,,,,,,,,,,,,,,,,,,,,,,,2.0,ICICI NEFT/RTGS,,,,,,,,,,,,,,,,AOC,2,2475368,PRAKASH KUMAR PANDA,12-Mar-2024 03:03 PM,Rejected-Finance,Rejected Bidder,20-Mar-2026 02:49 PM,,,,,,,,,,,,,,,,,,,,,,,,,,,,,,,,,,,,,,,,,AOC
,,,,,,,,,,,,,,,,.pdf,"ATO , Work Experience Work in Hand, Machineries and required document as per DTCN",,,,,,,,,,,,,,,,,,,,,,,,,,,,,,,,,,,,,,,,,,,AOC,3,2474768,Shikshasarathi Beuria,12-Mar-2024 11:00 AM,Rejected-Finance,Rejected Bidder,20-Mar-2026 02:49 PM,,,,,,,,,,,,,,,,,,,,,,,,,,,,,,,,,,,,,,,,,AOC
,,,,,,,,,,,,,,2.0,Finance,.xls,BOQ,,,,,,,,,,,,,,,,,,,,,,,,,,,,,,,,,,,,,,,,,,,AOC,4,2474450,SIDHANT NAYAK,11-Mar-2024 07:46 PM,Rejected-Finance,Rejected Bidder,20-Mar-2026 02:49 PM,,,,,,,,,,,,,,,,,,,,,,,,,,,,,,,,,,,,,,,,,AOC
,,,,,,,,,,,,,,,,,,,,,,,,,,,,,,,,,,,,,,,,,,,,,,,,,,,,,,,,,,,,AOC,5,2474514,YASHOBANTA NAYAK,11-Mar-2024 09:48 PM,Accepted-AOC,The work has been awarded to Yashobanta Nayak,20-Mar-2026 02:52 PM,,,,,,,,,,,,,,,,,,,,,,,,,,,,,,,,,,,,,,,,,AOC
