Tender Fee in ₹,VAT Charges in ₹,Fee Payable To,Fee Payable At,Tender Fee Exemption Allowed,Name,Address,Organisation Chain,Tender Reference Number,Tender ID,Withdrawal Allowed,Tender Type,Form of contract,Tender Category,No. of Covers,General Technical Evaluation Allowed,ItemWise Technical Evaluation Allowed,Payment Mode,Is Multi Currency Allowed For BOQ,Is Multi Currency Allowed For Fee,Allow Two Stage Bidding,Title,Work Description,Pre Qualification Details,Independent External Monitor/Remarks,Tender Value in ₹,Product Category,Sub category,Contract Type,Bid Validity(Days),Period Of Work(Days),Location,Pincode,Pre Bid Meeting Place,Pre Bid Meeting Address,Pre Bid Meeting Date,Bid Opening Place,Should Allow NDA Tender,Allow Preferential Bidder,Publish Date,Bid Opening Date,Document Download / Sale Start Date,Document Download / Sale End Date,Clarification Start Date,Clarification End Date,Bid Submission Start Date,Bid Submission End Date,Cover No,Cover,Document Type,Description,EMD Amount in ₹,EMD Exemption Allowed,EMD Fee Type,EMD Percentage,EMD Payable To,EMD Payable At,S.No,Bank Name,Tender Stage,S.No,Bid Number,Bidder Name,Awarded Currency,Awarded Value,Organisation Chain :,Tender ID :,Tender Ref No :,Tender Title :,Committee Chairperson/Co-ordinator Name :,Committee Chairperson/Co-ordinator Type :,Committee Members :,Updated By :,Updated On :,Document :,Committee Chairperson/Co-ordinator Name :.1,Committee Chairperson/Co-ordinator Type :.1,Committee Members :.1,Updated By :.1,Updated on :,Document :.1,Type :,Summary :,Updated By :.2,Updated On :.1,Document :.2,BOQ Comparative Chart :,Contract Date :,Total Contract Value :,Work Completion Period in days :,Updated By :.3,Updated on :.1,AOC document :,S.No.1,Bid Number.1,Bidder Name.1,Submitted Date,Status,Remarks,Status Updated On,Tender Stage
"6,000",0.0,Nil,Nil,No,Superintending Engineer,"Superintending Engineer, P.H. Division, Saheed Nagar , Bhubaneswar-751007, Odisha, Phone (0674) 2540578",PHEO||SEPH-CIRCLE-BBSR||EE P.H. Division Bhubaneswar,SEPHBBSR-45(01)/2025-26 DTD.10.11.2025,2025_PHEO_121154_1,Yes,National Competitive Bid,Percentage,Works,1.0,No,No,Online,No,No,No,Drinking water supply 24x7 to Internal Zone of Odagaon NAC,Drinking water supply 24x7 to Internal Zone of Odagaon NAC,Please refer Tender documents. ,NA ,"26,68,000",Civil Works - Water Works,NA ,Tender,120.0,90.0,Odagaon NAC,752081.0,NA ,NA ,NA ,Bhubaneswar,No ,No,14-Nov-2025 06:00 PM,25-Nov-2025 12:30 PM,14-Nov-2025 06:00 PM,24-Nov-2025 05:00 PM,14-Nov-2025 06:00 PM ,18-Nov-2025 05:00 PM ,14-Nov-2025 06:00 PM,24-Nov-2025 05:00 PM,1.0,Fee/PreQual/Technical/Finance,.pdf,"Copy of PAN, GST, Affidavits as per DTCN","26,680",Yes,percentage,1.0%,Nil,Nil,1.0,ICICI BANK,AOC,1.0,3250400.0,TRUPTIMAYEE PARIDA,INR,"2,267,977",PHEO||SEPH-CIRCLE-BBSR||EE P.H. Division Bhubaneswar,2025_PHEO_121154_1,SEPHBBSR-45(01)/2025-26 DTD.10.11.2025,Drinking water supply 24x7 to Internal Zone of Odagaon NAC,Superintending Engineer,Internal,,Sukant Kumar Sethi,29-May-2026 05:46 PM,techsummary_563643.pdf (916.76 KB),Superintending Engineer,Internal,,Sukant Kumar Sethi,29-May-2026 05:49 PM,finsummary_563643.pdf (916.76 KB),Finance,Six no bids are received online and the bid is admitted subject to detail scrutiny after downloading the bid documents and after which the bid will be finally determined as valid or invalid,Sukant Kumar Sethi,25-Nov-2025 12:41 PM,,BOQ Comparative Chart,29-May-2026,"INR 2,267,977",90.0,Sukant Kumar Sethi,29-May-2026 05:51 PM,AOC.pdf (2447.00 KB),1,3242605,J.B.S. Construction,20-Nov-2025 06:49 PM,Rejected-AOC,Not a lowest bidder,29-May-2026 05:51 PM,AOC
,,,,,,,,,,,,,,,,,,,,,,,,,,,,,,,,,,,,,,,,,,,,,,,,,.pdf,"Certificates, Formats, Schedules and other documents if any as per DTCN",,,,,,,2.0,ICICI NEFT/RTGS,AOC,,,,,,,,,,,,,,,,,,,,,,,,,,,,,,,,,,2,3234605,M/s A. GANAPATI,21-Nov-2025 02:37 PM,Rejected-AOC,Not a lowest bidder,29-May-2026 05:51 PM,AOC
,,,,,,,,,,,,,,,,,,,,,,,,,,,,,,,,,,,,,,,,,,,,,,,,,.xls,Bill of Quantity,,,,,,,,,AOC,,,,,,,,,,,,,,,,,,,,,,,,,,,,,,,,,,3,3250799,PRAMOD KUMAR BEHERA,24-Nov-2025 03:19 PM,Rejected-AOC,Not a lowest bidder,29-May-2026 05:51 PM,AOC
,,,,,,,,,,,,,,,,,,,,,,,,,,,,,,,,,,,,,,,,,,,,,,,,,,,,,,,,,,,AOC,,,,,,,,,,,,,,,,,,,,,,,,,,,,,,,,,,4,3246302,SANTOSH TRADERS,22-Nov-2025 01:38 PM,Rejected-AOC,Not a lowest bidder,29-May-2026 05:51 PM,AOC
,,,,,,,,,,,,,,,,,,,,,,,,,,,,,,,,,,,,,,,,,,,,,,,,,,,,,,,,,,,AOC,,,,,,,,,,,,,,,,,,,,,,,,,,,,,,,,,,5,3246427,SANUJA KUMAR LENKA,22-Nov-2025 03:22 PM,Rejected-AOC,Not a lowest bidder,29-May-2026 05:51 PM,AOC
,,,,,,,,,,,,,,,,,,,,,,,,,,,,,,,,,,,,,,,,,,,,,,,,,,,,,,,,,,,AOC,,,,,,,,,,,,,,,,,,,,,,,,,,,,,,,,,,6,3250400,TRUPTIMAYEE PARIDA,24-Nov-2025 12:57 PM,Accepted-AOC,Lowest bidder in Lottery,29-May-2026 05:51 PM,AOC
