Committee Chairperson/Co-ordinator Name :,Committee Chairperson/Co-ordinator Type :,Committee Members :,Updated By :,Updated On :,Financial Bid Opening Date:,Document :,Organisation Chain :,Tender ID :,Tender Ref No :,Tender Title :,S.No,Bid Number,Bidder Name,Awarded Currency,Awarded Value,S.No.1,Bid Number.1,Bidder Name.1,Submitted Date,Status,Remarks,Status Updated On,Type :,Summary :,Updated By :.1,Updated On :.1,Document :.1,Type :.1,Summary :.1,Updated By :.2,Updated On :.2,Document :.2,BOQ Comparative Chart :,Committee Chairperson/Co-ordinator Name :.1,Committee Chairperson/Co-ordinator Type :.1,Committee Members :.1,Updated By :.3,Updated on :,Document :.3,Contract Date :,Total Contract Value :,Work Completion Period in days :,Updated By :.4,Updated on :.1,AOC document :,AOC Description :,Tender Stage,Cover No,Cover,Document Type,Description,Name,Address,Organisation Chain,Tender Reference Number,Tender ID,Withdrawal Allowed,Tender Type,Form of contract,Tender Category,No. of Covers,General Technical Evaluation Allowed,ItemWise Technical Evaluation Allowed,Payment Mode,Is Multi Currency Allowed For BOQ,Is Multi Currency Allowed For Fee,Allow Two Stage Bidding,Title,Work Description,Pre Qualification Details,Independent External Monitor/Remarks,Tender Value in ₹,Product Category,Sub category,Contract Type,Bid Validity(Days),Period Of Work(Days),Location,Pincode,Pre Bid Meeting Place,Pre Bid Meeting Address,Pre Bid Meeting Date,Bid Opening Place,Should Allow NDA Tender,Allow Preferential Bidder,S.No,Bank Name,EMD Amount in ₹,EMD Exemption Allowed,EMD Fee Type,EMD Percentage,EMD Payable To,EMD Payable At,Publish Date,Bid Opening Date,Document Download / Sale Start Date,Document Download / Sale End Date,Clarification Start Date,Clarification End Date,Bid Submission Start Date,Bid Submission End Date,Financial Bid Opening Date,Tender Fee in ₹,VAT Charges in ₹,Fee Payable To,Fee Payable At,Tender Fee Exemption Allowed,Tender Stage
"Er BN Pradhan, EIC (PH), Odisha, Bhubaneswar",Internal,"Er AK Mohapatra, CEPH, Er M Jena, ACE, PH Circle, CTC, Er SR Mohanty, ACE (P), Er P Behera, SE, PH Division, Angul, Sri AK Mohapatra, Sr. DAO, Sri DK Mohapatra, AOPH",Biranchi Narayan Pradhan,28-Oct-2025 12:06 PM,28-Oct-2025 04:00 PM,techsummary_552158.pdf (2698.15 KB),PHEO,2025_PHEO_117919_1,EICPH-04/2025-26 Dt.03.09.2025,"Construction of CWR at Panchamahala to receive 13 MLD Clear Water from Mega Project of RWS and S and Laying of Supply Main to different Zonal Reservoirs, Angul Town under State Plan BASUDHA 2024-25",1.0,3108923.0,M A CONSTRUCTION,INR,"92,258,403",1,3109080,ADITYA ENGINEERING SERVICES,04-Oct-2025 04:37 PM,Rejected-Technical,Non-Responsive,28-Oct-2025 12:06 PM,Technical,Eight (8) No. Technical Bids opened and to be evaluated,Biranchi Narayan Pradhan,04-Oct-2025 07:26 PM,technical_552158.pdf,Finance,Six (06) Nos. Financial Bid opened and to be evaluated.,Biranchi Narayan Pradhan,28-Oct-2025 04:44 PM,finance_552158.pdf,BOQ Comparative Chart,"Er BN Pradhan, EIC (PH), Odisha, Bhubaneswar",Internal,"Er M Jena, ACE PH Circle, Cuttack, Er S Mohanty, ACE (P) I/c, Er P Behera, ACE PH Division, Angul, Sri AK Mohapatra, SR. DAO, Sri DK Mohapatra, AOPH",PUNYATOYA PRIYADARSHINI,12-May-2026 12:56 PM,finsummary_552158.pdf (1029.85 KB),12-May-2026,"INR 92,258,403",365.0,PUNYATOYA PRIYADARSHINI,12-May-2026 01:40 PM,LOAAngul.pdf (1487.00 KB),"LoA issued on 28.01.2026. Work Order issued and Agreement signed on 13.02.2026. However, for website compulsion Contract Date written as 12.05.2026.",AOC,1.0,Fee/PreQual/Technical,.pdf,"Copy of PAN, GSTIN, Affidavits as per DTCN","Engineer-in-Chief (PH), Odisha, Bhubaneswar","Office of the Engineer-in-Chief (PH), Odisha, 1st Floor, Unnati Bhawan, Satyanagar, Bhubaneswar-751007, Phone (0674) 2575309.",PHEO,EICPH-04/2025-26 Dt.03.09.2025,2025_PHEO_117919_1,Yes,National Competitive Bid,Percentage,Works,2.0,No,No,Online,No,No,No,"Construction of CWR at Panchamahala to receive 13 MLD Clear Water from Mega Project of RWS and S and Laying of Supply Main to different Zonal Reservoirs, Angul Town under State Plan BASUDHA 2024-25","Laying of DI K9 and K7 CWRM, Construction of RCC MBR, Pump House, Watchman Shed, EOT Crane, Installation of Pump Sets with Pumping arrangement, Boundary Wall with Gate, Installation of 250 KVA Substation and 320 KVA DG Set, etc.",Please refer Tender documents. ,NA ,"10,85,27,000",Civil Works - Water Works,NA ,Tender,120.0,365.0,"Panchamahala, Angul",759132.0,NA ,NA ,NA ,Bhubaneswar,No ,No,1.0,ICICI BANK,"10,85,000",Yes,fixed,,Nil,Nil,12-Sep-2025 11:00 AM,04-Oct-2025 05:30 PM,12-Sep-2025 11:00 AM,04-Oct-2025 05:00 PM,12-Sep-2025 11:00 AM ,19-Sep-2025 05:00 PM ,12-Sep-2025 11:00 AM,04-Oct-2025 05:00 PM,28-Oct-2025 04:00 PM,"10,000",0.0,Nil,Nil,Yes,AOC
,,,,,,,,,,,,,,,,2,3109283,ASHISH MOHANTY,04-Oct-2025 02:46 PM,Rejected-Technical,Non-Responsive,28-Oct-2025 12:06 PM,,,,,,,,,,,,,,,,,,,,,,,,,AOC,,,.pdf,"Certificates, Formats, Schedules and other documents if any as per DTCN",,,,,,,,,,,,,,,,,,,,,,,,,,,,,,,,,,,2.0,ICICI NEFT/RTGS,,,,,,,,,,,,,,,,,,,,,AOC
,,,,,,,,,,,,,,,,3,3102510,BALAJI INDUSTRIAL AND AGRICULTURAL CASTINGS PVT LTD,30-Sep-2025 01:15 PM,Rejected-AOC,Rejected as looser of the Transparent Lottery System,12-May-2026 01:42 PM,,,,,,,,,,,,,,,,,,,,,,,,,AOC,2.0,Finance,.xls,BoQ,,,,,,,,,,,,,,,,,,,,,,,,,,,,,,,,,,,,,,,,,,,,,,,,,,,,,,,,,AOC
,,,,,,,,,,,,,,,,4,3108890,JRCC Infra LLP,04-Oct-2025 12:24 PM,Rejected-AOC,Rejected as looser of the Transparent Lottery System,12-May-2026 01:42 PM,,,,,,,,,,,,,,,,,,,,,,,,,AOC,,,,,,,,,,,,,,,,,,,,,,,,,,,,,,,,,,,,,,,,,,,,,,,,,,,,,,,,,,,,,AOC
,,,,,,,,,,,,,,,,5,3108923,M A CONSTRUCTION,04-Oct-2025 11:59 AM,Accepted-AOC,Accepted as Winner of the Transparent Lottery System,12-May-2026 01:42 PM,,,,,,,,,,,,,,,,,,,,,,,,,AOC,,,,,,,,,,,,,,,,,,,,,,,,,,,,,,,,,,,,,,,,,,,,,,,,,,,,,,,,,,,,,AOC
,,,,,,,,,,,,,,,,6,3104380,Nilamani Satpathy,01-Oct-2025 01:37 PM,Rejected-AOC,Rejected as looser of the Transparent Lottery System,12-May-2026 01:42 PM,,,,,,,,,,,,,,,,,,,,,,,,,AOC,,,,,,,,,,,,,,,,,,,,,,,,,,,,,,,,,,,,,,,,,,,,,,,,,,,,,,,,,,,,,AOC
,,,,,,,,,,,,,,,,7,3102335,SAROJ KUMAR DASH,01-Oct-2025 10:17 AM,Rejected-AOC,Rejected as looser of the Transparent Lottery System,12-May-2026 01:42 PM,,,,,,,,,,,,,,,,,,,,,,,,,AOC,,,,,,,,,,,,,,,,,,,,,,,,,,,,,,,,,,,,,,,,,,,,,,,,,,,,,,,,,,,,,AOC
,,,,,,,,,,,,,,,,8,3107722,SNKANUNGO INFRASTRUCTURE,04-Oct-2025 04:12 PM,Rejected-AOC,Rejected as looser of the Transparent Lottery System,12-May-2026 01:42 PM,,,,,,,,,,,,,,,,,,,,,,,,,AOC,,,,,,,,,,,,,,,,,,,,,,,,,,,,,,,,,,,,,,,,,,,,,,,,,,,,,,,,,,,,,AOC
