2023_OSCSC_88135_1,858 / 17.04.23 RASGOVINDPUR BLOCK,"Selection and appointment of Level-II contractor for transportation of Custom Milled Rice (CMR) from Rice Receiving Centre (RRC) OSWC, Baripada to Rasgovindpur Block Unit Retail Centres(FPS).","Selection and appointment of Level-II contractor for transportation of Custom Milled Rice (CMR) from Rice Receiving Centre (RRC) OSWC, Baripada to Rasgovindpur Block Unit Retail Centres(FPS).",Services,Open Tender,Percentage,Handling and Transportation,No,No,NA ,20-Apr-2023 10:00 AM,25-Apr-2023 11:00 AM ,45.0,No ,No,Online,20-May-2023 09:00 AM,Odisha State Civil Supplies Corp. Ltd.||CSO cum DM Mayurbhanj,RASGOVINDPUR BLOCK,757016.0,2.0,"47,47,164",BIRANCHI NARAYAN PRADHAN,47.53,Rejected-Finance,31-Aug-2023,Odisha State Civil Supplies Corp. Ltd.||CSO cum DM Mayurbhanj
2023_OSCSC_88170_1,872 / 17.04.23 BAHALDA BLOCK,"Selection and appointment of Level-II contractor for transportation of Custom Milled Rice (CMR) from Rice Receiving Centre (RRC) FSD, Badampahad to BAHALDA Block Unit Retail Centres(FPS).","Selection and appointment of Level-II contractor for transportation of Custom Milled Rice (CMR) from Rice Receiving Centre (RRC) FSD, Badampahad to BAHALDA Block Unit Retail Centres(FPS).",Services,Open Tender,Percentage,Handling and Transportation,No,No,NA ,20-Apr-2023 10:00 AM,25-Apr-2023 11:00 AM ,45.0,No ,No,Online,20-May-2023 09:00 AM,Odisha State Civil Supplies Corp. Ltd.||CSO cum DM Mayurbhanj,BAHALDA BLOCK,757046.0,2.0,"50,24,121",Dipesh Sahu,58.26,Rejected-Finance,31-Aug-2023,Odisha State Civil Supplies Corp. Ltd.||CSO cum DM Mayurbhanj
2023_CERWI_89021_2,Online Tender/06-2023-24/BPR,Improvement to road from Trinath Batachhaka to 16th mile via Kandhachandanpedi via Maa Sankulei Pitha Tourist Centre Manibandha and Talasakar road in the District of Ganjam under Improvement to Existing RD roads for the year 2022-23,Improvement to road from Trinath Batachhaka to 16th mile via Kandhachandanpedi via Maa Sankulei Pitha Tourist Centre Manibandha and Talasakar road in the District of Ganjam under Improvement to Existing RD roads for the year 2022-23,Works,National Competitive Bid,Percentage,Civil Works - Roads,No,No,NA ,17-May-2023 10:00 AM,NA ,90.0,No ,No,Online,01-Jun-2023 11:00 AM,CE RW I||RWCIRCLE-BERHAMPUR,Ganjam,760011.0,2.0,"4,13,49,000",Khadal Sethi,"35,150,190",Accepted-AOC,26-Jul-2023,CE RW I||RWCIRCLE-BERHAMPUR
2023_WATCO_90066_1,WATCO (W)-18/2023-24 Dtd.26.06.2023,"Design, Construction, Testing and Commissioning of 1 no 10.00 lakh Litre capacity RCC ESR (25 mtr staging) with all ancillary work and piping arrangement at Khandagiri Bari, Bhubaneswar.","Design, Construction, Testing and Commissioning of 1 no 10.00 lakh Litre capacity RCC ESR (25 mtr staging) with all ancillary work and piping arrangement at Khandagiri Bari, Bhubaneswar.",Works,National Competitive Bid,Lump-sum,Civil Works - Water Works,No,No,NA ,28-Jun-2023 11:00 AM,NA ,120.0,No ,No,Online,13-Jul-2023 12:30 PM,WATCO Bhubaneswar,"Khandagiri Bari, Bhubaneswar",751030.0,2.0,"3,12,80,000",ASHISH MOHANTY,"32,844,000",Rejected-AOC,02-Aug-2023,WATCO Bhubaneswar
2023_OSCSC_90063_1,1462 / 26.06.2023,Selection and Appointment of Level-II Transport Contractor for 2023-25,Selection and Appointment of Level-II Transport Contractor for 2023-25 for Baliapal block,Services,Open Tender,Percentage,Handling and Transportation,No,No,NA ,28-Jun-2023 05:00 PM,05-Jul-2023 11:00 AM ,300.0,No ,No,Online,14-Jul-2023 11:00 AM,Odisha State Civil Supplies Corp. Ltd.||CSO cum DM Balasore,Balasore,756001.0,2.0,"1,22,86,616",ATUL KUMAR PRADHAN,"10,444,681",Rejected-Finance,04-Aug-2023,Odisha State Civil Supplies Corp. Ltd.||CSO cum DM Balasore
2023_ORULB_89441_99,BPM/02/2023-24,Construction of BT road and drain from Gadampada chowk to PMGSY road in Ward No. 18,Construction of BT road and drain from Gadampada chowk to PMGSY road in Ward No. 18,Works,Open Tender,Percentage,Civil Works - Others,No,No,NA ,01-Jun-2023 10:00 AM,NA ,90.0,No ,No,Online,13-Jun-2023 10:00 AM,Municipal Bodies||Bhawanipatna Municipality,BHAWANIPATNA MUNICIPALITY,766001.0,1.0,"16,78,021",ROSHAN KUMAR NAIK (S.C),"1,672,650.23",Accepted-AOC,30-Aug-2023,Municipal Bodies||Bhawanipatna Municipality
2023_ORULB_90116_7,CHKT-NAC-01/2023-24,"Construction of Kalyan Mandap Building in Bauri Sahi, Ward No 2 under Chikiti NAC","Construction of Kalyan Mandap Building in Bauri Sahi, Ward No 2 under Chikiti NAC",Works,Open Tender,Percentage,Civil Works - Others,No,No,NA ,28-Jun-2023 12:00 PM,NA ,60.0,No ,No,Online,07-Jul-2023 04:30 PM,Municipal Bodies||Chikiti NAC,Chikiti,761020.0,1.0,"19,88,760",PRATIVA KUMARI PANDA,"1,955,082",Accepted-AOC,11-Aug-2023,Municipal Bodies||Chikiti NAC
2023_EICCL_87035_3,CCE DKL R and B/24-2022-23,Construction of H.L Bridge over Gaikata Nallah at 1st KM of Ogi Malisahi-Jarapada road (ODR) in the District of Angul under State Plan for the year 2022-23,Construction of H.L Bridge over Gaikata Nallah at 1st KM of Ogi Malisahi-Jarapada road (ODR) in the District of Angul under State Plan for the year 2022-23,Works,Open Tender,Percentage,Civil Works - Bridges,No,No,NA ,17-Mar-2023 03:00 PM,NA ,90.0,No ,No,Online,03-Apr-2023 11:30 AM,EIC-CIVIL||SERNB-CIRCLE-DHENKANAL,Angul,759122.0,2.0,"5,24,02,153",CHANDAN SINGH,"49,787,285",Rejected-Technical,10-Aug-2023,EIC-CIVIL||SERNB-CIRCLE-DHENKANAL
2023_ORULB_88991_40,EO/RGP/01 of 2023-24,"Construction of Paver Block road with Drain near Chandan Singh house towards Pancha Mukhi Hanuman Mandir road to Japan Barua house, W.No.05","Construction of Paver Block road with Drain near Chandan Singh house towards Pancha Mukhi Hanuman Mandir road to Japan Barua house, W.No.05",Works,Open Tender,Percentage,Civil Works - Others,No,No,NA ,17-May-2023 11:00 AM,NA ,90.0,No ,No,Online,29-May-2023 10:00 AM,Municipal Bodies||Rajgangpur Municipality,Rajgangpur Municipality Area,770017.0,1.0,"12,00,000",SARASWATI SAHOO,"1,200,000",Rejected-AOC,22-Aug-2023,Municipal Bodies||Rajgangpur Municipality
2023_ORULB_88991_54,EO/RGP/01 of 2023-24,"Construction of C.C. road from Amin Mistry house towards Urdu school, W.No.19","Construction of C.C. road from Amin Mistry house towards Urdu school, W.No.19",Works,Open Tender,Percentage,Civil Works - Others,No,No,NA ,17-May-2023 11:00 AM,NA ,90.0,No ,No,Online,29-May-2023 10:00 AM,Municipal Bodies||Rajgangpur Municipality,Rajgangpur Municipality Area,770017.0,1.0,"3,00,000",RAKESH BARLA,"300,000",Accepted-AOC,22-Aug-2023,Municipal Bodies||Rajgangpur Municipality
2023_CEMIB_88654_10,GMID-II/01/2023-24,Improvement to Nuabandha Ambasikharapur MIP in K.S.Nagar Block under Critical grant 2023-24,Improvement to Nuabandha Ambasikharapur MIP in K.S.Nagar Block under Critical grant 2023-24,Works,Open Tender,Percentage,Civil Works - Others,No,No,NA ,03-May-2023 10:00 AM,NA ,90.0,No ,No,Online,15-May-2023 11:30 AM,"CE,Minor Irrigation,BBSR||SESMIC-BERHAMPUR||GANJAM I","SE, M.I.DIVISION GANJAM-II, BERHAMPUR",760010.0,1.0,"8,45,000",Dibakar Behera,"718,329",Rejected-AOC,29-Aug-2023,"CE,Minor Irrigation,BBSR||SESMIC-BERHAMPUR||GANJAM I"
2023_ORULB_88734_32,BM_02_2023_24,Constn. of Paver block Road and Drain from Mehruddin res to Sk. khalil Res in W.N-26 under Balasore Municipality,Constn. of Paver block Road and Drain from Mehruddin res to Sk. khalil Res in W.N-26 under Balasore Municipality,Works,Open Tender,Percentage,Civil Works - Others,No,No,NA ,08-May-2023 05:00 PM,NA ,90.0,No ,No,Online,22-May-2023 11:00 AM,Municipal Bodies||Balasore Municipality,Balasore Municipality,756003.0,1.0,"4,46,610",ASHOK KUMAR GIRI,"446,163.78",Rejected-Finance,11-Aug-2023,Municipal Bodies||Balasore Municipality
2023_ORULB_89441_72,BPM/02/2023-24,Construction of RCC dain with culvert from Prasana Jena house to Gangadi gudi in Ward No. 14,Construction of RCC dain with culvert from Prasana Jena house to Gangadi gudi in Ward No. 14,Works,Open Tender,Percentage,Civil Works - Others,No,No,NA ,01-Jun-2023 10:00 AM,NA ,90.0,No ,No,Online,13-Jun-2023 10:00 AM,Municipal Bodies||Bhawanipatna Municipality,BHAWANIPATNA MUNICIPALITY,766001.0,1.0,"3,44,579",BIKASH KUMAR SAHANI,"292,926.22",Rejected-Finance,30-Aug-2023,Municipal Bodies||Bhawanipatna Municipality
2023_EICCL_88386_1,Bid Identification No.S.E.E.C (RandB) 02/2023-24,Shifting of 11 KV Line by laying of UG Cable with RMU of Feeder-1 and VSS Nagar from ARSS Chhowk to ODCL Chhowk due to construction of Railway over Bridge Bhubaneswar for the year 2022-2023,Shifting of 11 KV Line by laying of UG Cable with RMU of Feeder-1 and VSS Nagar from ARSS Chhowk to ODCL Chhowk due to construction of Railway over Bridge Bhubaneswar for the year 2022-2023,Works,National Competitive Bid,Percentage,Electrical Works,No,No,NA ,25-Apr-2023 05:00 PM,NA ,90.0,No ,No,Online,10-May-2023 11:30 AM,EIC-CIVIL||SE R and B Electrical,Bhubaneswar,751007.0,2.0,"1,20,82,593",AYUSH POWER INFRASTRUCTURE,"10,271,412",Rejected-AOC,24-Aug-2023,EIC-CIVIL||SE R and B Electrical
2022_ORULB_77859_39,HDL NAC-01/2022-23,Renovation of Tantichira Bridge in Ward No-14.,As per DTCN,Works,Open Tender,Percentage,Civil Works - Others,No,No,NA ,23-May-2022 01:00 PM,NA ,120.0,No ,No,Online,03-Jun-2022 11:00 AM,Municipal Bodies||Hindol NAC,HINDOL NAC,759022.0,1.0,"17,85,960",ANOJ KUMAR PATTANAIK,"1,518,240",Rejected-Technical,23-Aug-2023,Municipal Bodies||Hindol NAC
2023_CEBMT_87398_13,e Procurement Notice No EE BOD 01/23-24,Flood protection work to right bank of river Salki near high level bridge of village Olanda,Flood protection work to right bank of river Salki near high level bridge of village Olanda,Works,National Competitive Bid,Percentage,Civil Works - Water Works,No,No,NA ,11-Apr-2023 10:00 AM,NA ,90.0,No ,No,Online,25-Apr-2023 10:00 AM,"CE-BM, Tel Basin,Bhawanipatna||SE Balangir Irr Circle Balangir||EE Boudh Irr Divn Boudh","O/O Executive engineer, boudh IRR DIVISION,BDH",762014.0,1.0,"16,80,000",Artatrana Sanyasi,"1,428,638",Rejected-Finance,18-May-2023,"CE-BM, Tel Basin,Bhawanipatna||SE Balangir Irr Circle Balangir||EE Boudh Irr Divn Boudh"
2023_ORULB_87271_97,VNM/05/2022-23,Extension MRF shed in jodabara wealth centre in ward no-01 in Vyasanagar municipality.,Extension MRF shed in jodabara wealth centre in ward no-01 in Vyasanagar municipality.,Works,Open Tender,Percentage,Civil Works - Roads,No,No,NA ,28-Mar-2023 10:00 AM,NA ,90.0,No ,No,Online,13-Apr-2023 11:00 AM,Municipal Bodies||Vyasanagar Municipality,vyasanagar municipality,755019.0,1.0,"11,02,106",ASHOK KUMAR MISHRA,"1,113,065.67",Accepted-AOC,06-Aug-2023,Municipal Bodies||Vyasanagar Municipality
2023_ORULB_87484_53,BBLM-1/2023-24,"Construction of drain from Bisu house to alu Sinku house, Bagiaburu, ward No.9","Construction of drain from Bisu house to alu Sinku house, Bagiaburu, ward No.9",Works,Open Tender,Percentage,Civil Works - Others,No,No,NA ,18-Apr-2023 10:00 AM,NA ,45.0,No ,No,Online,03-May-2023 11:00 AM,Municipal Bodies||Barbil Municipality,Barbil,758035.0,2.0,"5,00,000",Ananta Charan Rout,"486,779",Rejected-Finance,22-Aug-2023,Municipal Bodies||Barbil Municipality
2023_ORULB_89229_22,BBLM-2/2023-24,"Construction of Chhot Ghat at Basti Dam (Right to South side bathing step), ward No.7","Construction of Chhot Ghat at Basti Dam (Right to South side bathing step), ward No.7",Works,Open Tender,Percentage,Civil Works - Others,No,No,NA ,26-May-2023 10:00 AM,NA ,45.0,No ,No,Online,21-Jun-2023 11:00 AM,Municipal Bodies||Barbil Municipality,Barbil,758035.0,2.0,"4,98,000",RASHMI RANJAN JENA,"451,515.92",Accepted-AOC,18-Aug-2023,Municipal Bodies||Barbil Municipality
2023_ORULB_87484_47,BBLM-1/2023-24,"Construction of road from Deba house to Dibakar house, Sub-Jail area, ward No.4","Construction of road from Deba house to Dibakar house, Sub-Jail area, ward No.4",Works,Open Tender,Percentage,Civil Works - Others,No,No,NA ,18-Apr-2023 10:00 AM,NA ,45.0,No ,No,Online,03-May-2023 11:00 AM,Municipal Bodies||Barbil Municipality,Barbil,758035.0,2.0,"5,00,000",ISWAR CHANDRA SAMAL,"486,278.17",Rejected-Finance,09-Aug-2023,Municipal Bodies||Barbil Municipality
2022_ORULB_77859_11,HDL NAC-01/2022-23,Construction of C.C Road from Pump House to Sanischara temple in Ward No-05.Krushna plot towards Harizan Sahi Community Center in Ward No-05.,As per DTCN,Works,Open Tender,Percentage,Civil Works - Others,No,No,NA ,23-May-2022 01:00 PM,NA ,120.0,No ,No,Online,03-Jun-2022 11:00 AM,Municipal Bodies||Hindol NAC,HINDOL NAC,759022.0,1.0,"7,95,100",BABHRU PRASAD PATI,"675,878",Rejected-Technical,22-Aug-2023,Municipal Bodies||Hindol NAC
2023_OMC_86319_1,OMC/E-PROC/CP/59/2023 Dtd 16.02.2023,Operating Pharmacy Outlets and supply of Medicines with Surgical items at Different Locations of OMC,Operating Pharmacy Outlets and supply of Medicines with Surgical items at Different Locations of OMC,Goods,Open Tender,Item Rate,Medicines,No,No,NA ,17-Feb-2023 05:00 PM,28-Feb-2023 03:30 PM ,180.0,No ,No,Online,22-Mar-2023 11:30 AM,Orissa Mining Corporation,"OMC House, Bhubaneswar",751001.0,2.0,,Apollo Pharmacies Limited,18.75,Accepted-AOC,17-Aug-2023,Orissa Mining Corporation
2023_CEMIB_89766_3,Bid ID No. 02 SEMID (KJR/ 2023-2024) Dt. 26.05.20,Improvement to Oriya MIP in Telkoi Block of Keonjhar District under Critical Grant for the year 2023-2024,MIP,Works,National Competitive Bid,Percentage,Civil Works - Others,No,No,NA ,09-Jun-2023 03:00 PM,NA ,90.0,No ,No,Online,23-Jun-2023 11:00 AM,"CE,Minor Irrigation,BBSR||SE,Eastern Minor Irr.Circle,Keonjhar||EE M.I. Division Keonjhar",Banspal Block of Keonjhar District,758001.0,1.0,"25,43,000",ASIS KUMAR THAMB,"2,161,236.59",Rejected-AOC,21-Aug-2023,"CE,Minor Irrigation,BBSR||SE,Eastern Minor Irr.Circle,Keonjhar||EE M.I. Division Keonjhar"
2023_CELBB_88792_12,MND-02 OF 2023-24,Protection to scoured bank on Chitrotpala left from RD 5.880km to 5.979km near Nageshpur for the year 2023-24,Protection to scoured bank on Chitrotpala left from RD 5.880km to 5.979km near Nageshpur for the year 2023-24,Works,National Competitive Bid,Percentage,Civil Works - Others,No,No,NA ,08-May-2023 04:45 PM,NA ,90.0,No ,No,Online,16-May-2023 11:30 AM,"CE-BM,LMB Basin,BBSR||SE, Eastern Circle,Cuttack||EE, Mahanadi North Division,Jagatpur",PUNDALO,754021.0,1.0,"49,90,597",ALOKASHRIBAD PANDA,"4,242,506",Rejected-Finance,22-Aug-2023,"CE-BM,LMB Basin,BBSR||SE, Eastern Circle,Cuttack||EE, Mahanadi North Division,Jagatpur"
2023_ORULB_85795_12,PIPILI-NAC-3(31)/2022-23,Construction of CC Road from Bainsi Sahoo house to Dola bedi Wno-13 .,Construction of CC Road from Bainsi Sahoo house to Dola bedi Wno-13 .,Works,Open Tender,Percentage,Civil Works - Roads,No,No,NA ,06-Feb-2023 10:00 AM,NA ,90.0,No ,No,Online,17-Feb-2023 11:00 AM,Municipal Bodies||Pipli NAC,"Pipli NAC, Ward No-13",752104.0,1.0,"3,39,000",DAULAT KHAN,"339,040.05",Accepted-AOC,22-Aug-2023,Municipal Bodies||Pipli NAC
2023_OSCSC_87906_1,1434 dtd. 15.04.2023,Selection and appointment of L-2 T.C for transportation of CMR from CWC j.K. road to vyasanagar MPL for the year 2023-25,Selection and appointment of L-2 T.C for transportation of CMR from CWC j.K. road to FPS of vyasanagar MPL for the year 2023-25 of Jajpur Dist.,Services,Open Tender,Percentage,Handling and Transportation,No,No,NA ,17-Apr-2023 11:00 AM,21-Apr-2023 11:00 AM ,45.0,No ,No,Online,03-May-2023 10:00 AM,Odisha State Civil Supplies Corp. Ltd.||CSO cum DM Jajpur,Vyasanagar MPL,755001.0,2.0,,BIJAYA KUMAR PATI,26.86,Rejected-Finance,21-Aug-2023,Odisha State Civil Supplies Corp. Ltd.||CSO cum DM Jajpur
2023_EICCL_86949_4,EE - 85/2022-23,Construction of RCC Roof cycle Stand for 200 cycles of School Building of Odisha Adarsha Vidyalaya at Bhaliasole under Suliapada Block in the District of Mayurbhanj for the year 2022-23,Construction of RCC Roof cycle Stand for 200 cycles of School Building of Odisha Adarsha Vidyalaya at Bhaliasole under Suliapada Block in the District of Mayurbhanj for the year 2022-23,Works,Open Tender,Percentage,Civil Works - Buildings,No,No,NA ,15-Mar-2023 06:00 PM,NA ,90.0,No ,No,Online,24-Mar-2023 11:00 AM,EIC-CIVIL||SERNB-CIRCLE-EASTERN||EERNB-DIVN-BARIPADA,Baripada,757001.0,1.0,"21,54,000",BISESWAR BEHERA,"1,831,084",Accepted-AOC,25-Aug-2023,EIC-CIVIL||SERNB-CIRCLE-EASTERN||EERNB-DIVN-BARIPADA
2023_CERWI_88048_14,Tender Online No-20 of 2022-23,S/R to R.I office building at Arana for the year 2022-23 in the District of Jagatsinghpur,S/R to R.I office building at Arana for the year 2022-23 in the District of Jagatsinghpur,Works,Open Tender,Percentage,Civil Works - Buildings,No,No,NA ,19-Apr-2023 02:00 PM,NA ,90.0,No ,No,Online,28-Apr-2023 11:00 AM,CE RW I||RWCIRCLE-CUTTACK||RWDIVISION-JAGATSINGHPUR,Jagatsinghpur,754103.0,1.0,"2,83,619",AMAR PRASAD RAY,"241,104",Rejected-AOC,05-Aug-2023,CE RW I||RWCIRCLE-CUTTACK||RWDIVISION-JAGATSINGHPUR
2023_EICCL_89630_3,Bid Identification No-SE-RandB-SNG-06 OF 2023-24,Construction of Civil Infrastructure for installation of Biomedical Waste Management Equipment at Bargaon CHC under Bargaon Block in the District of Sundargarh for the year 2023-24,Construction of Civil Infrastructure for installation of Biomedical Waste Management Equipment at Bargaon CHC under Bargaon Block in the District of Sundargarh for the year 2023-24,Works,Open Tender,Percentage,Civil Works - Buildings,No,No,NA ,05-Jun-2023 11:00 AM,NA ,90.0,No ,No,Online,19-Jun-2023 11:00 AM,EIC-CIVIL||SERNB-CIRCLE-KEONJHAR||EERNB-DIVN-SUNDERGARH,Sundargarh,770001.0,1.0,"13,25,182",CHINTAMANI SAHU,"1,126,537",Rejected-AOC,01-Aug-2023,EIC-CIVIL||SERNB-CIRCLE-KEONJHAR||EERNB-DIVN-SUNDERGARH
2023_RWSS_88370_1,BID No 01 OF 2023 - 24,Construction of 4.50 MTR outside Dia RCC Intake well and laying of 250 mm Dia plain and slotted gallery pipe line for RPWS to village Nunhad Checherbandh under Belpada Blockin District of Balangir.,Construction of 4.50 MTR outside Dia RCC Intake well and laying of 250 mm Dia plain and slotted gallery pipe line for RPWS to village Nunhad Checherbandh under Belpada Blockin District of Balangir.,Works,National Competitive Bid,Percentage,Civil Works - Water Works,No,No,NA ,25-Apr-2023 03:00 PM,NA ,180.0,No ,No,Online,03-May-2023 11:00 AM,Rural Water Supply and Sanitation||RWSS Circle Bolangir||RWSS Division Bolangir,VILLAGE NUNHAD CHECHERBANDH UNDER BELPADA BLOCK,767026.0,1.0,"33,41,006",DEBENDRA KUMAR SAHU,"2,840,189",Accepted-AOC,21-Aug-2023,Rural Water Supply and Sanitation||RWSS Circle Bolangir||RWSS Division Bolangir
2023_OSCSC_88108_1,854 / 17.04.23 Saraskana Block,"Selection and appointment of Level-II contractor for transportation of Custom Milled Rice (CMR) from Rice Receiving Centre (RRC) FSD, Baripada FCI to Saraskana Block Unit Retail Centres(FPS).","Selection and appointment of Level-II contractor for transportation of Custom Milled Rice (CMR) from Rice Receiving Centre (RRC) FSD, Baripada FCI to Saraskana Block Unit Retail Centres(FPS).",Services,Open Tender,Percentage,Handling and Transportation,No,No,NA ,20-Apr-2023 10:00 AM,25-Apr-2023 11:00 AM ,45.0,No ,No,Online,20-May-2023 09:00 AM,Odisha State Civil Supplies Corp. Ltd.||CSO cum DM Mayurbhanj,SARASKANA BLOCK,757051.0,2.0,"61,05,354",KARTIK CHANDRA GHOSH,47.73,Rejected-Finance,31-Aug-2023,Odisha State Civil Supplies Corp. Ltd.||CSO cum DM Mayurbhanj
2023_CELBB_89440_10,MND-05 OF 2023-24,"A/R to Disty No.8G from RD 1700m to 8526m, 8GB,8GC,8GD,8GE and 8GF of K.Canal for the year 2023-24","A/R to Disty No.8G from RD 1700m to 8526m, 8GB,8GC,8GD,8GE and 8GF of K.Canal for the year 2023-24",Works,National Competitive Bid,Percentage,Civil Works - Others,No,No,NA ,30-May-2023 04:35 PM,NA ,90.0,No ,No,Online,06-Jun-2023 11:30 AM,"CE-BM,LMB Basin,BBSR||SE, Eastern Circle,Cuttack||EE, Mahanadi North Division,Jagatpur",KENDUPATANA,754021.0,1.0,"2,29,608",ABHIMANYU SETHY,"195,190",Rejected-Finance,11-Aug-2023,"CE-BM,LMB Basin,BBSR||SE, Eastern Circle,Cuttack||EE, Mahanadi North Division,Jagatpur"
2023_CEBMB_89957_5,e-procurement Notice No. e-BNID-06/2023-24,Improvement of Daha left distributary from RD 00 M to 2800 M of Daha Irrigation Project.,Improvement of Daha left distributary from RD 00 M to 2800 M of Daha Irrigation Project.,Works,Open Tender,Percentage,Civil Works - Others,No,No,NA ,23-Jun-2023 10:00 AM,NA ,90.0,No ,No,Online,01-Jul-2023 11:00 AM,"CE-BM,RVN Basin,Berhampur||S.E. Southern Irr. Circle I Berhampur||EE Bhanjanagar Irrigation Divn Bhanjanagar",Bhanjanagar,761126.0,1.0,"4,36,154",PRIYANKA BEHERA,"436,154",Rejected-AOC,02-Aug-2023,"CE-BM,RVN Basin,Berhampur||S.E. Southern Irr. Circle I Berhampur||EE Bhanjanagar Irrigation Divn Bhanjanagar"
2023_EICCL_87087_8,25 of 2022-23,Construction of ANMTC Building and 80 seated Hostel building at Puri,Construction of ANMTC Building and 80 seated Hostel building at Puri,Works,Open Tender,Percentage,Civil Works - Buildings,No,No,NA ,20-Mar-2023 03:35 PM,NA ,90.0,No ,No,Online,28-Mar-2023 11:30 AM,EIC-CIVIL||SERNB-CIRCLE-KHURDA,Puri,752001.0,2.0,"6,87,71,643",ASHISH AGARWAL,"61,777,567",Rejected-AOC,03-Aug-2023,EIC-CIVIL||SERNB-CIRCLE-KHURDA
2023_RWSS_85293_5,EE RWSandS BDK 26 Dt-09.01.2023,"Supplying all materials, labour, TandP for Power supply to RWSS Point including 3ph3W 11 KV line with 55mm2 AAAC and installation of 1 No 25 KVA 11/0.4 KV S/S transformer etc for RPWS Point to village Tillo under Bonth Block","Supplying all materials, labour, TandP for Power supply to RWSS Point including 3ph3W 11 KV line with 55mm2 AAAC and installation of 1 No 25 KVA 11/0.4 KV S/S transformer etc for RPWS Point to village Tillo under Bonth Block",Works,National Competitive Bid,Percentage,Civil Works - Water Works,No,No,NA ,16-Jan-2023 04:00 PM,NA ,90.0,No ,No,Online,31-Jan-2023 11:00 AM,"Rural Water Supply and Sanitation||RWSS Circle Cuttack||EERWSS,Bhadrak",village Tillo under Bonth Block,756100.0,1.0,"5,01,000",ICON BUILDERS,"426,211.14",Not Admitted-Fee/PreQual/Technical/Finance,25-Aug-2023,"Rural Water Supply and Sanitation||RWSS Circle Cuttack||EERWSS,Bhadrak"
2023_STSCD_88153_27,01/2023-24 of ITDA Rairangpur,Construction of ICT and Smart Learning Facility Centre at Govt. (SSD) Girls High School at Rairangpur under Rairangpur Municipality.,Construction of ICT and Smart Learning Facility Centre at Govt. (SSD) Girls High School at Rairangpur under Rairangpur Municipality.,Works,National Competitive Bid,Percentage,Civil Works - Buildings,No,No,NA ,21-Apr-2023 10:00 AM,NA ,90.0,No ,No,Online,06-May-2023 10:30 AM,ST and SC Development Deptt||ITDA Rairangpur,Rairangpur,757043.0,1.0,"12,45,024",ADARSHA MOHAPATRA,"1,058,394.82",Accepted-AOC,06-Aug-2023,ST and SC Development Deptt||ITDA Rairangpur
2023_OSCSC_88660_1,2698 dt 01.05.2023,Selection and appointment of L-II transport contractor for transportation of custom Milled Rice (CMR) from Rice Receiving Centre to Retail Centre(FPS).,Selection and appointment of L-II transport contractor for transportation of custom Milled Rice (CMR) from Rice Receiving Centre to Retail Centre(FPS).,Services,Open Tender,Percentage,Handling and Transportation,No,No,NA ,03-May-2023 10:00 AM,04-May-2023 11:00 AM ,45.0,No ,No,Online,26-May-2023 11:00 AM,Odisha State Civil Supplies Corp. Ltd.||CSO cum DM Khurda,"PEG(Suanla), Begunia to FPS points of Begunia Bloc",752056.0,2.0,"40,53,384",Prakash chandra sahoo,33.78,Rejected-Finance,12-Aug-2023,Odisha State Civil Supplies Corp. Ltd.||CSO cum DM Khurda
2023_OSPHW_89344_5,10/OPHWC/2023-24,"Constn. of Addl. Fortification of Vulnerable Police Posts at R.O Silda, Nuapada (Morcha 5 Nos., Guard Room 2 Nos. , Fencing with Chainlink Mesh 1500 Rft.)",Building Work,Works,National Competitive Bid,Percentage,Civil Works - Buildings,No,No,NA ,26-May-2023 05:00 PM,NA ,90.0,No ,No,Online,07-Jun-2023 11:00 AM,Orissa State Police Housing and Welfare Corporation Ltd,Nuapada,751022.0,1.0,"39,01,295",K N MULTIPROJECTS,"3,628,594",Accepted-AOC,21-Aug-2023,Orissa State Police Housing and Welfare Corporation Ltd
2023_WPDS_90315_1,07/ Project/WATCO/SBP/ 2023-24 Dated 28 .06.2023,Laying of 500 mm dia RCC NP3 Sewer and Construction of 1500 mm dia manhole chambers from MH-4030 to MH 4088 along Zilla School chowk -Senpark road in Catchment-3 in part commissioning area of Sambalpur Sewerage System,Laying of 500 mm dia RCC NP3 Sewer and Construction of 1500 mm dia manhole chambers from MH-4030 to MH 4088 along Zilla School chowk -Senpark road in Catchment-3 in part commissioning area of Sambalpur Sewerage System,Works,National Competitive Bid,Percentage,Civil Works - Water Works,No,No,NA ,04-Jul-2023 11:00 AM,NA ,120.0,No ,No,Online,14-Jul-2023 12:30 PM,WATCO Bhubaneswar||Director (Projects) Watco||GM WATCO PROJECT DIVISION SAMBALPUR,"Pensanpada,Sambalpur",768001.0,1.0,"30,70,350",MAMATA MAYEE SAMAL,"3,337,471",Rejected-AOC,31-Jul-2023,WATCO Bhubaneswar||Director (Projects) Watco||GM WATCO PROJECT DIVISION SAMBALPUR
2023_CEDC_87967_1,EE-DD-CTC-01/2023-24/ EE-DD-CTC-07/2023-24,Construction of FLC over Sirasundarpur Barsailo D/C at village Megha under Kantapada Block for the year 2023-24.,Construction of FLC over Sirasundarpur Barsailo D/C at village Megha under Kantapada Block for the year 2023-24.,Works,Open Tender,Percentage,Civil Works - Others,No,No,NA ,17-Apr-2023 04:00 PM,NA ,90.0,No ,No,Online,28-Apr-2023 11:30 AM,"CE,Drainage,Cuttack||SE,Drainage,Cuttack||EE, Drainage Divn, Cuttack",Kantapada Block,754002.0,1.0,"8,46,922",ARABINDA MOHANTY,"719,968",Rejected-Finance,17-May-2023,"CE,Drainage,Cuttack||SE,Drainage,Cuttack||EE, Drainage Divn, Cuttack"
2023_EICCL_86251_3,CE-DPI AND R-40/2022-23,Improvement such as widening and strengthening to Telibhuin-Giridhariprasad road (ODR) from 0/000 km to 11/255 km in the district of Dhenkanal under State Plan,Improvement such as widening and strengthening to Telibhuin-Giridhariprasad road (ODR) from 0/000 km to 11/255 km in the district of Dhenkanal under State Plan,Works,Open Tender,Percentage,Civil Works - Roads,No,No,NA ,15-Feb-2023 03:50 PM,NA ,90.0,No ,No,Online,03-Mar-2023 11:30 AM,EIC-CIVIL,In Dhenkanal Dist,751001.0,2.0,"10,79,61,425",MONALISHA CONSTRUCTION,"97,057,321",Accepted-AOC,19-Aug-2023,EIC-CIVIL
