2023_EICCL_90340_1,SE/R AND B/ SNPR / 06 / 2023-24,Construction of Revenue Quarter C Type for Sub-Collector at Birmaharajpur for the year 2023-24,Construction of Revenue Quarter C Type for Sub-Collector at Birmaharajpur for the year 2023-24,Works,National Competitive Bid,Percentage,Civil Works - Buildings,No,No,NA ,05-Jul-2023 10:00 AM,17-Jul-2023 11:00 AM ,90.0,No ,No,Online,20-Jul-2023 11:20 AM,EIC-CIVIL||SERNB-CIRCLE-BOLANGIR||EERNB-DIVISION-SONEPUR,Sonepur,767017.0,2.0,,SAMBHU PRASAD AGRAWALLA,"6,620,169.26",Rejected-AOC,31-Aug-2023,EIC-CIVIL||SERNB-CIRCLE-BOLANGIR||EERNB-DIVISION-SONEPUR
2023_OSAMB_90073_1,01/2023-24,Construction of G.C.I Covershed at Dalatola PACS of Begunia Block under RMC Balugaon,Construction of G.C.I Covershed at Dalatola PACS of Begunia Block under RMC Balugaon,Works,Open Tender,Percentage,Civil Works - Others,No,No,NA ,27-Jun-2023 10:00 AM,NA ,60.0,No ,No,Online,07-Jul-2023 11:00 AM,Odisha State Agricultural Marketing Board||RMC Balugaon,Balugaon RMC,752030.0,1.0,"19,36,348",ARATI BEHERA,"1,742,906.45",Accepted-AOC,14-Aug-2023,Odisha State Agricultural Marketing Board||RMC Balugaon
2023_EICCL_89008_3,BC KLD-04/2023-2024,Construction of Civil infra-structure for installation of Biomedical wasted management equipment at CHC Biswanathpur,Building,Works,Open Tender,Percentage,Civil Works - Buildings,No,No,NA ,16-May-2023 09:00 AM,NA ,90.0,No ,No,Online,26-May-2023 11:00 AM,EIC-CIVIL||SERNB-CIRCLE-BOLANGIR||EERNB-DIVN-KALAHANDI,Bhawanipatna Kalahandi,766001.0,1.0,"12,52,193",ALAKA PATRA,"1,064,489",Accepted-AOC,14-Aug-2023,EIC-CIVIL||SERNB-CIRCLE-BOLANGIR||EERNB-DIVN-KALAHANDI
2023_CEMIB_88856_9,MIBLGR/01 of 2023-24(Double Cover),Sl11.Construction of Sidhimunda-I Check Dam over Lehrijore Nalla near Village Sidhimunda in Patnagarh Block of Balangir District under MATY for the year 2023-24,Construction of Sidhimunda-I Check Dam over Lehrijore Nalla near Village Sidhimunda in Patnagarh Block of Balangir District under MATY for the year 2023-24,Works,Open Tender,Percentage,Civil Works - Others,No,No,NA ,12-May-2023 11:00 AM,NA ,90.0,No ,No,Online,29-May-2023 11:00 AM,"CE,Minor Irrigation,BBSR||SEKBKMIC-BHAWANIPATNA||EE K.M.I. Division Bhawanipatna",Patnagarh,767025.0,2.0,"54,82,278",SAHADEB BARIHA,"4,660,485",Rejected-Finance,11-Aug-2023,"CE,Minor Irrigation,BBSR||SEKBKMIC-BHAWANIPATNA||EE K.M.I. Division Bhawanipatna"
2023_DZPBR_87137_7,IFB-CDO-cum-EO ZP BGH No.03 of 2022-23,Construction of SC building at Palsada,building works,Works,Open Tender,Percentage,Civil Works - Buildings,No,No,NA ,28-Mar-2023 11:00 AM,NA ,90.0,No ,No,Online,12-Apr-2023 11:00 AM,Panchayati Raj and Drinking Water Department Odisha||Zilla Parisad Bargarh,Paikmal,768039.0,1.0,"31,62,976",SARAL KUMAR SINHA,"3,162,976.55",Rejected-AOC,02-Aug-2023,Panchayati Raj and Drinking Water Department Odisha||Zilla Parisad Bargarh
2023_ORULB_87128_33,BM-BDK-05-2022-23,Construction of Paver road and drain from Babuli Muduli house towards Basanta Kumar Samantaray house at Apartibindha in Ward No.13,Construction of Paver road and drain from Babuli Muduli house towards Basanta Kumar Samantaray house at Apartibindha in Ward No.13,Works,Open Tender,Percentage,Civil Works - Others,No,No,NA ,24-Mar-2023 10:00 AM,NA ,90.0,No ,No,Online,04-Apr-2023 11:00 AM,Municipal Bodies||Bhadrak Municipality,Bhadrak Municipality,756100.0,1.0,"6,33,028",Dayanidhi Mohapatra,"633,028",Rejected-AOC,03-Aug-2023,Municipal Bodies||Bhadrak Municipality
2023_ORULB_88991_49,EO/RGP/01 of 2023-24,"Construction of C.C. road and Drain with cover slab from Sadhuram Agrawal house to Dulal Mitra house, W.No.17","Construction of C.C. road and Drain with cover slab from Sadhuram Agrawal house to Dulal Mitra house, W.No.17",Works,Open Tender,Percentage,Civil Works - Others,No,No,NA ,17-May-2023 11:00 AM,NA ,90.0,No ,No,Online,29-May-2023 10:00 AM,Municipal Bodies||Rajgangpur Municipality,Rajgangpur Municipality Area,770017.0,1.0,"4,55,000",JAYDEV BEHERA,"455,000",Rejected-AOC,23-Aug-2023,Municipal Bodies||Rajgangpur Municipality
2023_ORULB_88991_61,EO/RGP/01 of 2023-24,"Construction of Paver block road and Drain from Chhinde Singh house to Sameer Barik house at Mahulipada, W.No.16","Construction of Paver block road and Drain from Chhinde Singh house to Sameer Barik house at Mahulipada, W.No.16",Works,Open Tender,Percentage,Civil Works - Others,No,No,NA ,17-May-2023 11:00 AM,NA ,90.0,No ,No,Online,29-May-2023 10:00 AM,Municipal Bodies||Rajgangpur Municipality,Rajgangpur Municipality Area,770017.0,1.0,"6,00,000",REKHA DAS,"600,000",Rejected-AOC,22-Aug-2023,Municipal Bodies||Rajgangpur Municipality
2023_CEBMB_89044_5,SE-CHWD-01/2023-24,Protection to U/s side Right Bank of Sagada Stage-II system of Chheligada Irr. Project.,Protection work,Works,Open Tender,Percentage,Civil Works - Others,No,No,NA ,18-May-2023 10:00 AM,NA ,90.0,No ,No,Online,01-Jun-2023 11:30 AM,"CE-BM,RVN Basin,Berhampur||SE Southern Irr Circle II Paralakhemundi||EE Chheligada Head Works Divn Mahendragada",Mahendragada,761017.0,1.0,"10,35,000",RAMA KRUSHNA MOHANTY,"879,750",Rejected-AOC,10-Aug-2023,"CE-BM,RVN Basin,Berhampur||SE Southern Irr Circle II Paralakhemundi||EE Chheligada Head Works Divn Mahendragada"
2023_CENH_88761_1,EE-NH-KJR-03/2023-24,Constrution of 2 nos. Flat type D-Type Qtrs. at Jagannathpur PHC for the year 2022-23 under OMBADC,BUILDING WORKS,Works,Open Tender,Percentage,Civil Works - Buildings,No,No,NA ,05-May-2023 10:00 AM,NA ,90.0,No ,No,Online,22-May-2023 11:30 AM,CE-NH||SE NH Circle Keonjhar||EENH DIVN KEONJHAR,"OFFICE OF EXECUTIVE ENGINEER,N.H DIVISION,KEONJHAR",758014.0,2.0,"62,49,854",SUDARSHAN SETHY,"6,249,853.71",Rejected-Finance,01-Aug-2023,CE-NH||SE NH Circle Keonjhar||EENH DIVN KEONJHAR
2023_CELBB_89440_7,MND-05 OF 2023-24,"A/R to Disty No.8 from RD 14.00Km to 25.300Km, Paripalai Mahara and Expressway Mahara of K.Canal for the year 2023-24","A/R to Disty No.8 from RD 14.00Km to 25.300Km, Paripalai Mahara and Expressway Mahara of K.Canal for the year 2023-24",Works,National Competitive Bid,Percentage,Civil Works - Others,No,No,NA ,30-May-2023 02:30 PM,NA ,90.0,No ,No,Online,06-Jun-2023 11:30 AM,"CE-BM,LMB Basin,BBSR||SE, Eastern Circle,Cuttack||EE, Mahanadi North Division,Jagatpur",KENDUPATANA,754021.0,1.0,"3,93,349",LIPU KUMAR MALL,"334,386",Rejected-Finance,10-Aug-2023,"CE-BM,LMB Basin,BBSR||SE, Eastern Circle,Cuttack||EE, Mahanadi North Division,Jagatpur"
2023_EICCL_89849_1,TENDER CALL NOTICE NO.07 OF 2023-24,"S.R to OUTR College such as Renovation of Class Room to Smart Class Rooms of Room No.303,304, 305 and 306 of Electrical Engineering Department for the year 2023-24.","S.R to OUTR College such as Renovation of Class Room to Smart Class Rooms of Room No.303,304, 305 and 306 of Electrical Engineering Department for the year 2023-24.",Works,Open Tender,Percentage,Civil Works - Buildings,No,No,NA ,17-Jun-2023 05:00 PM,NA ,90.0,No ,No,Online,01-Jul-2023 11:30 AM,EIC-CIVIL||SERNB-CIRCLE-CENTRAL||EERNB-DIVN-V-BBSR,Bhubaneswar,751001.0,1.0,"40,56,957",NIBAS PRADHAN,"3,448,820",Rejected-Finance,31-Aug-2023,EIC-CIVIL||SERNB-CIRCLE-CENTRAL||EERNB-DIVN-V-BBSR
2023_CERWI_86430_2,TENDER ONLINE RWC-36,Construction of proposed Bridge over Hansua Nallah at Chainage 1.500 Km on Manitri to Gobindapur PS Road in the District of Jagatsinghpur under BSY for the year 2022-23,BRIDGE WORKS,Works,National Competitive Bid,Percentage,Civil Works - Bridges,No,No,NA ,22-Feb-2023 06:55 PM,NA ,90.0,No ,No,Online,14-Mar-2023 11:30 AM,CE RW I||RWCIRCLE-CUTTACK,Jagatsinghpur,754103.0,2.0,"3,86,37,000",SAMRAT KALINGA KESHARI SWAIN,"39,919,519",Rejected-Finance,10-Aug-2023,CE RW I||RWCIRCLE-CUTTACK
2023_EICCL_88207_9,BC KLD-01/2023-2024,Construction of Meher Community Hall at Junagarh Under Kalahandi R and B Division for the year 2022-23,Building,Works,Open Tender,Percentage,Civil Works - Buildings,No,No,NA ,21-Apr-2023 02:00 PM,NA ,90.0,No ,No,Online,02-May-2023 11:00 AM,EIC-CIVIL||SERNB-CIRCLE-BOLANGIR||EERNB-DIVN-KALAHANDI,Junagarh Kalahandi,766014.0,1.0,"42,40,859",GOPAL PRASAD SAHU,"3,605,154",Rejected-Technical,10-Aug-2023,EIC-CIVIL||SERNB-CIRCLE-BOLANGIR||EERNB-DIVN-KALAHANDI
2022_ORULB_77859_18,HDL NAC-01/2022-23,Construction of Raghunatha Community center in ward No-02.,As per DTCN,Works,Open Tender,Percentage,Civil Works - Others,No,No,NA ,23-May-2022 01:00 PM,NA ,120.0,No ,No,Online,03-Jun-2022 11:00 AM,Municipal Bodies||Hindol NAC,HINDOL NAC,759022.0,1.0,"17,85,780",SOMANATH SETHI,"1,641,128",Rejected-Technical,21-Aug-2023,Municipal Bodies||Hindol NAC
2023_PRBBM_87523_1,BMB/04/2023-24,CONST OF SUB-CENTRE BUILDING AT ABHIMANPUR,CONST OF SUB-CENTRE BUILDING AT ABHIMANPUR,Works,National Competitive Bid,Percentage,Civil Works - Buildings,No,No,NA ,10-Apr-2023 10:00 AM,NA ,90.0,No ,No,Online,25-Apr-2023 11:00 AM,Panchayati Raj and Drinking Water Department Odisha||Zilla Parisad Cuttack||BARAMBA Block,ABHIMANPUR,754031.0,1.0,"28,85,833",RANJITA SAHOO,"2,453,246.45",Rejected-AOC,26-Aug-2023,Panchayati Raj and Drinking Water Department Odisha||Zilla Parisad Cuttack||BARAMBA Block
2023_GWSI_90436_1,02/GWDHPD/CHHATA/2023-24,Construction of 5 nos RRHS under CHHATA scheme in Bhubaneswar Block of Khurdha District,Construction of 5 nos RRHS under CHHATA scheme in Bhubaneswar Block of Khurdha District,Works,Open Tender,Percentage,Civil Works - Others,No,No,NA ,08-Jul-2023 11:00 AM,NA ,90.0,No ,No,Online,17-Jul-2023 12:00 PM,Ground Water Survey and Investigation,"GWD Division-I, Unit-VIII, Delta Square",751012.0,1.0,"17,17,649",RANJAN KUMAR NAYAK,"1,460,173",Rejected-AOC,26-Jul-2023,Ground Water Survey and Investigation
2022_CEBMD_81624_1,CERRIP-01/2022-23,"Excavation of Narasinghpur Branch Canal from RD 19.565 km to RD 22.900 km including construction of its structures, Lining and Service road of RRIP","Excavation of Canal, Canal lining and construction of structures and service road",Works,Open Tender,Percentage,Civil Works - Canal,No,No,NA ,21-Sep-2022 10:00 AM,NA ,90.0,No ,No,Online,12-Oct-2022 11:00 AM,"CE-BM,B Right Basin,Dhenkanal||SE,Angul Irr.Circle,Angul||EE,Rengali Right Canal Divn No. III",Tigiria,754030.0,2.0,"11,10,98,363",ANNADA SANKAR SAHOO,"94,444,718",Accepted-AOC,28-Jul-2023,"CE-BM,B Right Basin,Dhenkanal||SE,Angul Irr.Circle,Angul||EE,Rengali Right Canal Divn No. III"
2023_CEBMT_87398_26,e Procurement Notice No EE BOD 01/23-24,"MR to Dahya minor from RD 3000m to RD 3600m , Kasurbandh Minor from RD 00m to RD 60m , Bagaria SM from RD 00m to RD 120m , Tabada SM from RD 00m to RD 75m of LMC under BBP","MR to Dahya minor from RD 3000m to RD 3600m , Kasurbandh Minor from RD 00m to RD 60m , Bagaria SM from RD 00m to RD 120m , Tabada SM from RD 00m to RD 75m of LMC under BBP",Works,National Competitive Bid,Percentage,Civil Works - Canal,No,No,NA ,11-Apr-2023 10:00 AM,NA ,90.0,No ,No,Online,25-Apr-2023 10:00 AM,"CE-BM, Tel Basin,Bhawanipatna||SE Balangir Irr Circle Balangir||EE Boudh Irr Divn Boudh","O/O EE , Boudh Irr Division, Boudh",762014.0,1.0,"10,60,000",Pramod Malik,"900,615",Rejected-Finance,20-May-2023,"CE-BM, Tel Basin,Bhawanipatna||SE Balangir Irr Circle Balangir||EE Boudh Irr Divn Boudh"
2022_ORULB_77859_24,HDL NAC-01/2022-23,Construction of C.C Road from Purushottampur forest Road towards RD Road in Ward No-09,As per DTCN,Works,Open Tender,Percentage,Civil Works - Others,No,No,NA ,23-May-2022 01:00 PM,NA ,120.0,No ,No,Online,03-Jun-2022 11:00 AM,Municipal Bodies||Hindol NAC,HINDOL NAC,759022.0,1.0,"8,93,290",DEBI PRASAD PATTANAIK,"759,386",Rejected-Technical,21-Aug-2023,Municipal Bodies||Hindol NAC
2023_CERWI_88048_3,Tender Online No-20 of 2022-23,S/R to R.I office building at Garam for the year 2022-23 in the District of Jagatsinghpur,S/R to R.I office building at Garam for the year 2022-23 in the District of Jagatsinghpur,Works,Open Tender,Percentage,Civil Works - Buildings,No,No,NA ,19-Apr-2023 02:00 PM,NA ,90.0,No ,No,Online,28-Apr-2023 11:00 AM,CE RW I||RWCIRCLE-CUTTACK||RWDIVISION-JAGATSINGHPUR,Jagatsinghpur,754103.0,1.0,"5,81,544",DEBASHIS SWAIN,"494,370",Rejected-AOC,17-Aug-2023,CE RW I||RWCIRCLE-CUTTACK||RWDIVISION-JAGATSINGHPUR
2023_EICCL_88852_2,Bid Identification No PWDK- 04 / 2023-24.,Construction of Civil Infrastructure for Installation of Biomedical Waste Management Equipment at Padmapur CHC under Sadar Block in the District of Keonjhar for the year 2023-24.,Construction of Civil Infrastructure for Installation of Biomedical Waste Management Equipment at Padmapur CHC under Sadar Block in the District of Keonjhar for the year 2023-24,Works,Open Tender,Percentage,Civil Works - Buildings,No,No,NA ,12-May-2023 09:00 AM,NA ,90.0,No ,No,Online,26-May-2023 11:30 AM,EIC-CIVIL||SERNB-CIRCLE-KEONJHAR||EERNB-DIVN-KEONJHAR,Keonjhar,758001.0,1.0,"10,51,260",SAMIR KUMAR SETHY,"893,676.53",Rejected-AOC,29-Aug-2023,EIC-CIVIL||SERNB-CIRCLE-KEONJHAR||EERNB-DIVN-KEONJHAR
2023_CERWI_88270_2,Tender Online RCK-15/23,Construction of R.I. Office cum Residence Building at Atta under Sukinda Block in the Dist. of Jajpur,Construction of RI office Buildings,Works,National Competitive Bid,Percentage,Civil Works - Buildings,No,No,NA ,21-Apr-2023 05:30 PM,NA ,90.0,No ,No,Online,06-May-2023 11:30 AM,CE RW I||RWCIRCLE-KENDRAPARA,Jajpur,755001.0,2.0,"1,19,35,000",OM SAMANTARAY,"10,741,147",Rejected-Finance,17-Aug-2023,CE RW I||RWCIRCLE-KENDRAPARA
2022_ORULB_77859_30,HDL NAC-01/2022-23,Construction of CC road from PWD Road to Murali Jena House in ward No-12,As per DTCN,Works,Open Tender,Percentage,Civil Works - Others,No,No,NA ,23-May-2022 01:00 PM,NA ,120.0,No ,No,Online,03-Jun-2022 11:00 AM,Municipal Bodies||Hindol NAC,HINDOL NAC,759022.0,1.0,"5,35,890",ANOJ KUMAR PATTANAIK,"455,560",Accepted-AOC,22-Aug-2023,Municipal Bodies||Hindol NAC
2023_CELBB_88792_27,MND-02 OF 2023-24,Protection to scoured left bank of river Mahanadi from RD3040 Mtr to RD 3137Mtr and Construction of Spur at RD 3100Mtr for the year 2023-24,Protection to scoured left bank of river Mahanadi from RD3040 Mtr to RD 3137Mtr and Construction of Spur at RD 3100Mtr for the year 2023-24,Works,National Competitive Bid,Percentage,Civil Works - Others,No,No,NA ,09-May-2023 09:00 AM,NA ,90.0,No ,No,Online,16-May-2023 11:30 AM,"CE-BM,LMB Basin,BBSR||SE, Eastern Circle,Cuttack||EE, Mahanadi North Division,Jagatpur",kendupatana,754021.0,1.0,"49,65,455",PRADEEPTA KUMAR MALLICK,"4,221,133",Rejected-Finance,10-Aug-2023,"CE-BM,LMB Basin,BBSR||SE, Eastern Circle,Cuttack||EE, Mahanadi North Division,Jagatpur"
2023_EICCL_90344_5,SE/R AND B/ SNPR / 06 / 2023-24,"Construction of New Gents and Ladies Toilet Block at Tahasil Office, Birmaharajpur for 2023-24","Construction of New Gents and Ladies Toilet Block at Tahasil Office, Birmaharajpur for 2023-24",Works,National Competitive Bid,Percentage,Civil Works - Buildings,No,No,NA ,05-Jul-2023 10:00 AM,17-Jul-2023 11:00 AM ,90.0,No ,No,Online,20-Jul-2023 11:30 AM,EIC-CIVIL||SERNB-CIRCLE-BOLANGIR||EERNB-DIVISION-SONEPUR,Sonepur,767017.0,1.0,,ASHOK KUMAR PANIGRAHI,"492,284.84",Accepted-AOC,10-Aug-2023,EIC-CIVIL||SERNB-CIRCLE-BOLANGIR||EERNB-DIVISION-SONEPUR
2023_CELBB_88792_33,MND-02 OF 2023-24,Improvement to Disty No-1 of Kendrapara Main Canal at different places between RD4.58Km to RD7.239Km for the year 2023-24,Improvement to Disty No-1 of Kendrapara Main Canal at different places between RD4.58Km to RD7.239Km for the year 2023-24,Works,National Competitive Bid,Percentage,Civil Works - Others,No,No,NA ,09-May-2023 09:00 AM,NA ,90.0,No ,No,Online,16-May-2023 11:30 AM,"CE-BM,LMB Basin,BBSR||SE, Eastern Circle,Cuttack||EE, Mahanadi North Division,Jagatpur",NURTANGA,754021.0,1.0,"45,91,500",BISWAJIT PANDA,"3,903,234",Rejected-Finance,09-Aug-2023,"CE-BM,LMB Basin,BBSR||SE, Eastern Circle,Cuttack||EE, Mahanadi North Division,Jagatpur"
2023_CERWI_91044_1,Road Online NCB No. 372,Periodical Maintenance of 5 Years completed PMGSY Roads for the Package No. PM-KJR-14 in the District of Keonjhar.,Periodical Maintenance of 5 Years completed PMGSY Roads for the Package No. PM-KJR-14 in the District of Keonjhar.,Works,National Competitive Bid,Percentage,Civil Works - Roads,No,No,NA ,22-Jul-2023 05:20 PM,NA ,90.0,No ,No,Online,03-Aug-2023 11:00 AM,CE RW I||RWCIRCLE-KEONJHAR,Keonjhar,758001.0,2.0,"2,67,17,683",ALINA SAMAL,"29,306,625.51",Accepted-AOC,28-Aug-2023,CE RW I||RWCIRCLE-KEONJHAR
2023_CERWI_88048_21,Tender Online No-20 of 2022-23,Construction of R.I Office cum Residence at Balitutha under Erasama Tahasil for the Year 2022-23 in the District of Jagatsinghpur,Construction of R.I Office cum Residence at Balitutha under Erasama Tahasil for the Year 2022-23 in the District of Jagatsinghpur,Works,Open Tender,Percentage,Civil Works - Buildings,No,No,NA ,19-Apr-2023 02:00 PM,NA ,90.0,No ,No,Online,28-Apr-2023 11:00 AM,CE RW I||RWCIRCLE-CUTTACK||RWDIVISION-JAGATSINGHPUR,Jagatsinghpur,754103.0,1.0,"30,44,123",PRADEEP KUMAR DAS,"2,587,809",Rejected-AOC,03-Aug-2023,CE RW I||RWCIRCLE-CUTTACK||RWDIVISION-JAGATSINGHPUR
2023_CERWI_87304_3,EERWRGD-Online-13/2022-23,Construction of RI Office cum residence at Sunger under Kashipur Tahasil for the year 2022 23,Bulding Works,Works,Open Tender,Percentage,Civil Works - Buildings,No,No,NA ,28-Mar-2023 09:00 AM,NA ,90.0,No ,No,Online,11-Apr-2023 11:00 AM,CE RW I||RWCIRCLE-SUNABEDA||RWDIVISION-RAYAGADA,Rayagada,765001.0,1.0,"43,80,000",BRAHMANANDA MALIK,"4,129,145",Accepted-AOC,04-Aug-2023,CE RW I||RWCIRCLE-SUNABEDA||RWDIVISION-RAYAGADA
2023_CELBB_89783_5,e PROCUREMENT NOTICE NO- 04/2023-24,"Replacement of Gear Oil and newly greasing to the movable parts of Gate like drive shaft bearing, coupling, pinions etc. of Mahanadi Barrage for the year 2023-24. (MBD22/2023-24)","Replacement of Gear Oil and newly greasing to the movable parts of Gate like drive shaft bearing, coupling, pinions etc. of Mahanadi Barrage for the year 2023-24. (MBD22/2023-24)",Works,Open Tender,Percentage,Mechanical Works,No,No,NA ,12-Jun-2023 10:00 AM,NA ,90.0,No ,No,Online,23-Jun-2023 11:30 AM,"CE-BM,LMB Basin,BBSR||SE, Eastern Circle,Cuttack||EE Mahanadi Barrage Division Cuttack",Cuttack,753003.0,1.0,"8,30,315",M/S. SANJEEB ENTERPRISERS,"705,850",Rejected-AOC,24-Jul-2023,"CE-BM,LMB Basin,BBSR||SE, Eastern Circle,Cuttack||EE Mahanadi Barrage Division Cuttack"
2020_ORULB_60268_11,E.O/N.A.C/PLS-05/2019-20,Construction of Toilet at ahara kendra of N.A.C Polasara,Construction of Toilet at ahara kendra of N.A.C Polasara,Works,Open Tender,Percentage,Civil Works - Others,No,No,NA ,28-Feb-2020 11:00 AM,NA ,120.0,No ,No,Online,17-Mar-2020 11:00 AM,Municipal Bodies||Polasara NAC,N.A.C POLASARA,761105.0,1.0,"4,27,079",A ROJARANI,"478,328",Accepted-AOC,08-Apr-2020,Municipal Bodies||Polasara NAC
2023_EICCL_87395_10,CE-DPI AND R-44/2022-23,Improvement such as widening and strengthening of Nuagaon (Rairangpur College) to Dundu via Jamda road (ODR) SL to DL from 8/000 km to 33/526 km in the district of Mayurbhanj under State Plan,Improvement such as widening and strengthening of Nuagaon (Rairangpur College) to Dundu via Jamda road (ODR) SL to DL from 8/000 km to 33/526 km in the district of Mayurbhanj under State Plan,Works,Open Tender,Percentage,Civil Works - Roads,No,No,NA ,01-Apr-2023 02:10 PM,NA ,90.0,No ,No,Online,20-Apr-2023 11:30 AM,EIC-CIVIL,In Mayurbhanj Dist,751001.0,2.0,"31,66,47,862",Bhagabati build and constructions Pvt Ltd,"322,949,154",Accepted-AOC,08-Aug-2023,EIC-CIVIL
2023_CELBB_89440_19,MND-05 OF 2023-24,A/R to P.B Canal from RD 00Km to 9.80Km with all system for the year 2023-24,A/R to P.B Canal from RD 00Km to 9.80Km with all system for the year 2023-24,Works,National Competitive Bid,Percentage,Civil Works - Others,No,No,NA ,30-May-2023 05:55 PM,NA ,90.0,No ,No,Online,06-Jun-2023 11:30 AM,"CE-BM,LMB Basin,BBSR||SE, Eastern Circle,Cuttack||EE, Mahanadi North Division,Jagatpur",NAGESHPUR,754021.0,1.0,"4,93,755",RAJAT KUMAR BEHERA,"419,741",Accepted-AOC,10-Aug-2023,"CE-BM,LMB Basin,BBSR||SE, Eastern Circle,Cuttack||EE, Mahanadi North Division,Jagatpur"
2023_EICCL_88952_7,IFB SE 04 OF 2023-24,Construction of Bio Medical Waste Management Unit at Tato CHC under Karanjia Block for 2023-24,BUILDING WORK,Works,Open Tender,Percentage,Civil Works - Buildings,No,No,NA ,18-May-2023 10:00 AM,NA ,90.0,No ,No,Online,29-May-2023 11:00 AM,EIC-CIVIL||SERNB-CIRCLE-EASTERN||EERNB-DIVN-RAIRANGPUR,RAIRANGPUR,757043.0,1.0,"8,02,600",M/S DEEPAK KUMAR SAHU,"682,260",Rejected-AOC,19-Aug-2023,EIC-CIVIL||SERNB-CIRCLE-EASTERN||EERNB-DIVN-RAIRANGPUR
2023_OSCSC_88178_1,880 / 17.04.23 THAKURMUNDA BLOCK,"Selection and appointment of Level-II contractor for transportation of Custom Milled Rice (CMR) from Rice Receiving Centre (RRC) OSWC, Karanjia to THAKURMUNDA Block Unit Retail Centres(FPS).","Selection and appointment of Level-II contractor for transportation of Custom Milled Rice (CMR) from Rice Receiving Centre (RRC) OSWC, Karanjia to THAKURMUNDA Block Unit Retail Centres(FPS).",Services,Open Tender,Percentage,Handling and Transportation,No,No,NA ,20-Apr-2023 10:00 AM,25-Apr-2023 11:00 AM ,45.0,No ,No,Online,20-May-2023 09:00 AM,Odisha State Civil Supplies Corp. Ltd.||CSO cum DM Mayurbhanj,THAKURMUNDA BLOCK,757038.0,2.0,"59,89,069",AJIT KUMAR MALLICK,45.9,Accepted-AOC,31-Aug-2023,Odisha State Civil Supplies Corp. Ltd.||CSO cum DM Mayurbhanj
2023_ORULB_89441_116,BPM/02/2023-24,Construction of Paver road from Druba Naik house to Jashabant Singh house in Ward No.20,Construction of Paver road from Druba Naik house to Jashabant Singh house in Ward No.20,Works,Open Tender,Percentage,Civil Works - Others,No,No,NA ,01-Jun-2023 10:00 AM,NA ,90.0,No ,No,Online,13-Jun-2023 10:00 AM,Municipal Bodies||Bhawanipatna Municipality,BHAWANIPATNA MUNICIPALITY,766001.0,1.0,"4,28,026",RANJAN KUMAR SINGH,"363,864.22",Rejected-AOC,25-Aug-2023,Municipal Bodies||Bhawanipatna Municipality
2023_PRDNG_89155_1,02 DANAGADI 2023-24,"RENOVATION AND BEAUTIFICATION BAHABIL POKHARI, PANKAPAL",CIVIL WORK,Works,Open Tender,Percentage,Civil Works - Others,No,No,NA ,20-May-2023 06:00 PM,NA ,30.0,No ,No,Online,01-Jun-2023 11:30 AM,Panchayati Raj and Drinking Water Department Odisha||Zilla Parisad Jajpur||DANAGADI Block,"PANKAPAL, DANAGADI",755026.0,1.0,"14,28,684",PRADEEP KUMAR SAMAL,"1,214,522.454",Rejected-AOC,19-Aug-2023,Panchayati Raj and Drinking Water Department Odisha||Zilla Parisad Jajpur||DANAGADI Block
2023_EICCL_86757_1,EE (R and B) Angul-42/ 2022-23,Construction of kitchen cum dining hall for Odisha Adarsha Vidyalaya at Subarnapali Pallahara in the district of Angul for the year 2022-23 under OMBADC,Construction of kitchen cum dining hall for Odisha Adarsha Vidyalaya at Subarnapali Pallahara in the district of Angul for the year 2022-23 under OMBADC.,Works,Open Tender,Percentage,Civil Works - Buildings,No,No,NA ,06-Mar-2023 04:45 PM,NA ,90.0,No ,No,Online,16-Mar-2023 11:00 AM,EIC-CIVIL||SERNB-CIRCLE-DHENKANAL||EERNB Angul Division,ANGUL,759122.0,1.0,"24,71,590",MADHUSMITA SAHOO,"2,101,099",Rejected-AOC,20-Aug-2023,EIC-CIVIL||SERNB-CIRCLE-DHENKANAL||EERNB Angul Division
2023_ORULB_89441_127,BPM/02/2023-24,construction of road(paver) and drain I.A Khan gally near Patayat Banglow in Ward No. 15,construction of road(paver) and drain I.A Khan gally near Patayat Banglow in Ward No. 15,Works,Open Tender,Percentage,Civil Works - Others,No,No,NA ,01-Jun-2023 10:00 AM,NA ,90.0,No ,No,Online,13-Jun-2023 10:00 AM,Municipal Bodies||Bhawanipatna Municipality,BHAWANIPATNA MUNICIPALITY,766001.0,1.0,"6,05,807",MANOJ KUMAR PATRA,"514,996.49",Accepted-AOC,31-Aug-2023,Municipal Bodies||Bhawanipatna Municipality
2023_PRKOR_89010_3,TENDER ONLINE 02 KOR OF 2023-24,Construction of Sub-Center Building at Bandalo,Works,Works,Open Tender,Percentage,Civil Works - Buildings,No,No,NA ,16-May-2023 11:00 AM,NA ,270.0,No ,No,Online,01-Jun-2023 11:30 AM,Panchayati Raj and Drinking Water Department Odisha||Zilla Parisad Jajpur||KOREI Block,"PANCHAYAT SAMITI, KOREI",755022.0,1.0,"32,26,565",AMRUTA PRIYADARSHINI DHAL,"2,742,900",Accepted-AOC,16-Aug-2023,Panchayati Raj and Drinking Water Department Odisha||Zilla Parisad Jajpur||KOREI Block
2023_EICCL_88925_10,SE(RandB)Divn-I-BAM-03/2023-24,"Repair and Renovation to Nursing School (G plus 3) such as providing inside and outside painting and site Development work at MKCG Medical College and Hospital, Berhampur",Building work,Works,Open Tender,Percentage,Civil Works - Buildings,No,No,NA ,12-May-2023 12:00 PM,NA ,90.0,No ,No,Online,18-May-2023 11:30 AM,EIC-CIVIL||SERNB-CIRCLE-BERHAMPUR||EERNB-DIVN-GANJAM I,"Berhampur, Ganjam",760004.0,1.0,"16,41,287",ADIKANDA SABAT,"1,395,258",Rejected-AOC,10-Aug-2023,EIC-CIVIL||SERNB-CIRCLE-BERHAMPUR||EERNB-DIVN-GANJAM I
2023_CENH_88750_1,EE-NH-KJR-03/2023-24,Constrution of 2 nos. Flat type E-Type Qtrs. at Kendeiposi PHC for the year 2022-23 under OMBADC.,BUILDING WORKS.,Works,Open Tender,Percentage,Civil Works - Buildings,No,No,NA ,05-May-2023 10:00 AM,NA ,90.0,No ,No,Online,22-May-2023 11:30 AM,CE-NH||SE NH Circle Keonjhar||EENH DIVN KEONJHAR,"OFFICE OF EXECUTIVE ENGINEER,N.H DIVISION,KEONJHAR",758014.0,2.0,"51,28,363",ASHOK KUMAR SETHY,"4,616,039.27",Rejected-Finance,01-Aug-2023,CE-NH||SE NH Circle Keonjhar||EENH DIVN KEONJHAR
2023_CEBMB_89957_1,e-procurement Notice No. e-BNID-06/2023-24,Renovation of Daha right distributary from RD 8800 M to 13500 M of Daha Irrigation Project.,Renovation of Daha right distributary from RD 8800 M to 13500 M of Daha Irrigation Project.,Works,Open Tender,Percentage,Civil Works - Others,No,No,NA ,23-Jun-2023 10:00 AM,NA ,90.0,No ,No,Online,01-Jul-2023 11:00 AM,"CE-BM,RVN Basin,Berhampur||S.E. Southern Irr. Circle I Berhampur||EE Bhanjanagar Irrigation Divn Bhanjanagar",Bhanjanagar,761126.0,1.0,"4,85,012",PRIYANKA BEHERA,"485,012",Rejected-AOC,02-Aug-2023,"CE-BM,RVN Basin,Berhampur||S.E. Southern Irr. Circle I Berhampur||EE Bhanjanagar Irrigation Divn Bhanjanagar"
