2023_ORULB_88734_70,BM_02_2023_24,"Const. of CC Road and Drain from Shiv Mandir to Mirza Pokhari Culvert, Mishra Sahi in Ward No_27 under Balasore Municipality","Const. of CC Road and Drain from Shiv Mandir to Mirza Pokhari Culvert, Mishra Sahi in Ward No_27 under Balasore Municipality",Works,Open Tender,Percentage,Civil Works - Others,No,No,NA ,08-May-2023 05:00 PM,NA ,90.0,No ,No,Online,22-May-2023 11:00 AM,Municipal Bodies||Balasore Municipality,Balasore Municipality,756003.0,1.0,"15,15,892",SRIPATI MAJHI,"1,508,161.3",Rejected-Finance,14-Aug-2023,Municipal Bodies||Balasore Municipality
2023_ORULB_87128_87,BM-BDK-05-2022-23,"Construction of Drain and Road from Sk Afsar Ali house to Court Babu house and Sk Afsar Ali house to Sahid house at Siknupatti in ward No.28,under Devolution Funds 2021-22","Construction of Drain and Road from Sk Afsar Ali house to Court Babu house and Sk Afsar Ali house to Sahid house at Siknupatti in ward No.28,under Devolution Funds 2021-22",Works,Open Tender,Percentage,Civil Works - Others,No,No,NA ,24-Mar-2023 10:00 AM,NA ,90.0,No ,No,Online,04-Apr-2023 11:00 AM,Municipal Bodies||Bhadrak Municipality,Bhadrak Municipality,756100.0,1.0,"9,85,300",BIDYADHAR BEHERA,"985,300",Accepted-AOC,07-Aug-2023,Municipal Bodies||Bhadrak Municipality
2023_ORULB_88734_58,BM_02_2023_24,Const of Paver Block Road and Drain from Shandar Hotel to Jahir Master House School Bazar in Ward No_07 under Balasore Municipality,Const of Paver Block Road and Drain from Shandar Hotel to Jahir Master House School Bazar in Ward No_07 under Balasore Municipality,Works,Open Tender,Percentage,Civil Works - Others,No,No,NA ,08-May-2023 05:00 PM,NA ,90.0,No ,No,Online,22-May-2023 11:00 AM,Municipal Bodies||Balasore Municipality,Balasore Municipality,756003.0,1.0,"10,72,199",PRAMEER KUMAR NANDA,"1,050,862.24",Rejected-Finance,14-Aug-2023,Municipal Bodies||Balasore Municipality
2023_ORULB_87128_111,BM-BDK-05-2022-23,"Construction of Drain from Arju house towards Kabul house at Durgapur in ward No.29,under Devolution Funds 2021-22","Construction of Drain from Arju house towards Kabul house at Durgapur in ward No.29,under Devolution Funds 2021-22",Works,Open Tender,Percentage,Civil Works - Others,No,No,NA ,24-Mar-2023 10:00 AM,NA ,90.0,No ,No,Online,04-Apr-2023 11:00 AM,Municipal Bodies||Bhadrak Municipality,Bhadrak Municipality,756100.0,1.0,"5,06,000",Rajesh Kumar Nayak,"506,000",Rejected-AOC,05-Aug-2023,Municipal Bodies||Bhadrak Municipality
2023_ORULB_87128_105,BM-BDK-05-2022-23,"Const. of C.C. Road from Ramesh Nayak house to River Embakment and Bidyadhar Nayak house at Nua Sahi in ward No.28,under Devolution Funds 2021-22","Const. of C.C. Road from Ramesh Nayak house to River Embakment and Bidyadhar Nayak house at Nua Sahi in ward No.28,under Devolution Funds 2021-22",Works,Open Tender,Percentage,Civil Works - Others,No,No,NA ,24-Mar-2023 10:00 AM,NA ,90.0,No ,No,Online,04-Apr-2023 11:00 AM,Municipal Bodies||Bhadrak Municipality,Bhadrak Municipality,756100.0,1.0,"1,69,000",Rajesh Sethi,"169,000",Rejected-AOC,03-Aug-2023,Municipal Bodies||Bhadrak Municipality
2023_EICCL_89369_1,IFB-SE PWD BGH-06 OF 2023-24,Site development work for JMFC Bheden in the District of Bargarh for the year 2022-23.,ROAD WORK,Works,Open Tender,Percentage,Civil Works - Roads,No,No,NA ,29-May-2023 11:00 AM,NA ,90.0,No ,No,Online,08-Jun-2023 11:30 AM,EIC-CIVIL||SERNB-CIRCLE-NORTHERN||EERNB-DIVN-BARGARH,BHEDEN,768104.0,2.0,"49,48,821",ANIL KUMAR HOTA,"4,206,992.73",Accepted-AOC,01-Aug-2023,EIC-CIVIL||SERNB-CIRCLE-NORTHERN||EERNB-DIVN-BARGARH
2023_OSCSC_88879_1,1094 / 09.05.2023,Selection and Appointment of Level-II Transport Contractor for 2023-25,Selection and Appointment of Level-II Transport Contractor for tranportation of CMR from RRC to FPS,Services,Open Tender,Percentage,Handling and Transportation,No,No,NA ,12-May-2023 05:00 PM,17-May-2023 10:00 AM ,750.0,No ,No,Online,29-May-2023 10:00 AM,Odisha State Civil Supplies Corp. Ltd.||CSO cum DM Balasore,Balasore,756001.0,2.0,"21,45,219",PRIYABRATA SAHU,"2,145,219",Rejected-Finance,04-Aug-2023,Odisha State Civil Supplies Corp. Ltd.||CSO cum DM Balasore
2023_CERWI_85501_6,CCERWCSBD-Online-41/2022-23,Construction of Road from Ghanabeda to Andrapalli in the Districts of Malkangiri under CUVDA for the year 2022-23.,Construction of Road from Ghanabeda to Andrapalli in the Districts of Malkangiri under CUVDA for the year 2022-23.,Works,National Competitive Bid,Percentage,Civil Works - Roads,No,No,NA ,24-Jan-2023 11:00 AM,NA ,90.0,No ,No,Online,08-Feb-2023 11:00 AM,CE RW I||RWCIRCLE-SUNABEDA,MALKANGIRI,764044.0,2.0,"2,91,95,000",UMA SANKAR SAHU,"24,818,681.36",Rejected-AOC,01-Aug-2023,CE RW I||RWCIRCLE-SUNABEDA
2022_OMC_80727_1,OMC/E-PROC/CnP/49/2022 dated 23.08.2022,"Supply, Installation and Commissioning of one Vibrating Grizzly and one Wet Vibrating Screen for Chrome Ore Beneficiation Plant (COB Plant) at South Kaliapani, under Jajpur Road Region of OMC","Supply, Installation and Commissioning of one Vibrating Grizzly and one Wet Vibrating Screen for Chrome Ore Beneficiation Plant (COB Plant) at South Kaliapani, under Jajpur Road Region of OMC",Goods,Open Tender,Item Rate,Miscellaneous Goods,No,No,NA ,24-Aug-2022 05:00 PM,NA ,180.0,No ,No,Online,26-Sep-2022 05:00 PM,Orissa Mining Corporation,"South Kaliapani, under Jajpur Road Region of OMC",755028.0,2.0,,Gargs Engineers Limited,"9,617,000",Rejected-Technical,02-Aug-2023,Orissa Mining Corporation
2023_OSCSC_88884_1,1097 / 09.05.2023,Selection and Appointment of Level-II Transport Contractor for 2023-25,Selection and Appointment of Level-II Transport Contractor for Nilgiri Block and NAC for 2023-25,Services,Open Tender,Percentage,Handling and Transportation,No,No,NA ,12-May-2023 05:00 PM,17-May-2023 10:00 AM ,700.0,No ,No,Online,29-May-2023 10:00 AM,Odisha State Civil Supplies Corp. Ltd.||CSO cum DM Balasore,Balasore,756001.0,2.0,"70,01,341",BASANTA KUMAR LENKA,"7,001,341",Accepted-AOC,03-Aug-2023,Odisha State Civil Supplies Corp. Ltd.||CSO cum DM Balasore
2023_CERWI_86843_4,Tender Online RCK-07/23,Impvt to Pairakh to Brundabanpur Road in the District of Jajpur,Impvt to RD road,Works,National Competitive Bid,Percentage,Civil Works - Roads,No,No,NA ,13-Mar-2023 11:00 AM,NA ,90.0,No ,No,Online,29-Mar-2023 11:30 AM,CE RW I||RWCIRCLE-KENDRAPARA,Jajpur,755001.0,2.0,"7,57,27,000",BHARAT JENA,"64,374,947",Accepted-AOC,25-Aug-2023,CE RW I||RWCIRCLE-KENDRAPARA
2023_ORULB_87271_16,VNM/05/2022-23,Construction of CC road from Bana pokhari to Jena babu House in ward no-05,Construction of CC road from Bana pokhari to Jena babu House in ward no-05,Works,Open Tender,Percentage,Civil Works - Roads,No,No,NA ,28-Mar-2023 10:00 AM,NA ,45.0,No ,No,Online,13-Apr-2023 11:00 AM,Municipal Bodies||Vyasanagar Municipality,vyasanagar municipality,755019.0,1.0,"9,32,365",ASHOK KUMAR MISHRA,"941,688.779",Accepted-AOC,05-Aug-2023,Municipal Bodies||Vyasanagar Municipality
2023_EICCL_89848_2,TENDER CALL NOTICE NO.08 OF 2023-24,"S.R to OUTR College such as Renovation of Civil Engineering Department Class room of Room No.301, 302,307 and 308 for the year 2023-24 Composite work.","S.R to OUTR College such as Renovation of Civil Engineering Department Class room of Room No.301, 302,307 and 308 for the year 2023-24 Composite work.",Works,Open Tender,Percentage,Civil Works - Buildings,No,No,NA ,16-Jun-2023 05:00 PM,NA ,90.0,No ,No,Online,22-Jun-2023 11:30 AM,EIC-CIVIL||SERNB-CIRCLE-CENTRAL||EERNB-DIVN-V-BBSR,Bhubaneswar,751001.0,1.0,"41,26,880",BIPIN BIHARI SUTAR,"3,508,260",Accepted-AOC,31-Aug-2023,EIC-CIVIL||SERNB-CIRCLE-CENTRAL||EERNB-DIVN-V-BBSR
2023_ORULB_87420_16,MC(CMC)CTC_Div-II_No1/2023-24,Casting of precast RCC slab over drains and culverts in Ward No.53.,Casting of precast RCC slab over drains and culverts in Ward No.53.,Works,Open Tender,Percentage,Civil Works - Others,No,No,NA ,10-Apr-2023 11:00 AM,NA ,90.0,No ,No,Online,24-Apr-2023 10:00 AM,Municipal Bodies||Cuttack Municipal Corporation,CMC area,753012.0,1.0,"7,52,092",DIPTIMAYEE BHOLA,"722,008",Accepted-AOC,05-Aug-2023,Municipal Bodies||Cuttack Municipal Corporation
2023_OMC_86699_2,NIT No.09/OMC/CIVIL/2023,Construction of river training and protection work at South side of OB dump and North side of OB dump of GIOM near Upper Kainsari village in the district of Keonjhar,Construction of river training and protection work at South side of OB dump and North side of OB dump of GIOM near Upper Kainsari village in the district of Keonjhar,Works,Open Tender,Percentage,Civil Works - Others,No,No,NA ,04-Mar-2023 10:00 AM,NA ,180.0,No ,No,Online,18-Mar-2023 11:00 AM,Orissa Mining Corporation,GANDHAMARDAN,758018.0,2.0,"1,69,60,000",DEBABRATA GIRI,"14,417,482.28",Rejected-Finance,17-Jun-2023,Orissa Mining Corporation
2023_ORULB_90554_3,BMC-EE-DD-11/2023-24 dtd.10.07.2023,"Conducting Drone Survey, Hydrographic","Conducting Drone Survey, Hydrographic Survey with preparation of Detail Project Report (DPR) and estimate for rejuvenation of water bodies in South East Zone under jurisdiction of Bhubaneswar Municipal Corporation.",Services,Open Tender,Item Rate,Miscellaneous Services,No,No,NA ,11-Jul-2023 12:20 PM,NA ,120.0,No ,No,Online,18-Jul-2023 11:00 AM,Municipal Bodies||Bhubaneswar Municipal Corporation,BMC AREA LIMITED,751007.0,2.0,"45,06,000",Gram Tarang Inclusive Development Services Pvt. Ltd.,"2,403,660",Rejected-Finance,23-Aug-2023,Municipal Bodies||Bhubaneswar Municipal Corporation
2023_OSAMB_89697_1,01/RMC Rahama/2022-23,Construction of Parking,Construction of Parking place at Northern side area of Modern market yard at Rahama Krushak Bazar under RMC Rahama,Works,Open Tender,Percentage,Civil Works - Roads,No,No,NA ,08-Jun-2023 04:30 PM,NA ,30.0,No ,No,Online,23-Jun-2023 11:00 AM,Odisha State Agricultural Marketing Board||RMC Rahama,"Rahama, Jagatsinghpur",754140.0,1.0,"13,55,197",ASHOK KUMAR SAHOO,"1,152,052.9",Rejected-Finance,25-Aug-2023,Odisha State Agricultural Marketing Board||RMC Rahama
2023_OSPHW_89893_15,13/OPHWC/2023-24,"Cluster of 1.Construction of 1 No. Barrack for 10 Persons 2. Construction of 1 No. Godown and 3.Construction of 1 No. E Type Staff Qtr. at Sub-Jail, Nuapada in the District of Nuapada",Building Work,Works,National Competitive Bid,Percentage,Civil Works - Buildings,No,No,NA ,17-Jun-2023 06:30 PM,NA ,90.0,No ,No,Online,05-Jul-2023 11:00 AM,Orissa State Police Housing and Welfare Corporation Ltd,Nuapada,751022.0,2.0,"60,28,345",MANAS RANJAN MISHRA,"5,727,530",Accepted-AOC,21-Aug-2023,Orissa State Police Housing and Welfare Corporation Ltd
2023_CEMWR_89865_1,SE/MDH-16-2023-24,"Fabrication, Supply and Erection of 3Nos Scouring Sluice Gates and its accessories of Murgafield Check Dam in Bamra Block under Superintending Engineer, Minor Irrigation Division, Sambalpur for the Year 2022-23","Fabrication, Supply and Erection of 3Nos Scouring Sluice Gates and its accessories of Murgafield Check Dam in Bamra Block under Superintending Engineer, Minor Irrigation Division, Sambalpur for the Year 2022-23",Works,Open Tender,Percentage,Mechanical Works,No,No,NA ,17-Jun-2023 10:00 AM,NA ,90.0,No ,No,Online,27-Jun-2023 11:00 AM,Chief Engineer Mech - WR Bhubaneswar||SE Mechanical Circle Bhubaneswar,Bamra,768221.0,1.0,"6,95,392",LAXMIDHRA BHUYAN,"591,153",Rejected-AOC,05-Aug-2023,Chief Engineer Mech - WR Bhubaneswar||SE Mechanical Circle Bhubaneswar
2023_ORULB_90004_2,DHM/04/2023-24,CASTING OF COVER SLAB OVER THE DRAIN FROM SANJU SABAT TO PACCA WELL AND PAVER ROAD IN FRONT OF RAJ SING HOUSE WARD NO-10,CASTING OF COVER SLAB OVER THE DRAIN FROM SANJU SABAT TO PACCA WELL AND PAVER ROAD IN FRONT OF RAJ SING HOUSE WARD NO-10,Works,Open Tender,Percentage,Civil Works - Others,No,No,NA ,23-Jun-2023 04:00 PM,NA ,90.0,No ,No,Online,12-Jul-2023 10:00 AM,Municipal Bodies||Dharmagarh NAC,DHARMAGARH NAC,766015.0,1.0,"3,83,051",SANJAYA KUMAR JAIN,"325,631.655",Accepted-AOC,29-Aug-2023,Municipal Bodies||Dharmagarh NAC
2023_STSCD_88389_1,Bid Identification No PA ITDA PLB_01 of 2023-24,"Construction of ICT Education and Smart Learning Facility Centre at Govt. (SSD) High School, Gochhapada under Phiringia Block.","Construction of ICT Education and Smart Learning Facility Centre at Govt. (SSD) High School, Gochhapada under Phiringia Block.",Works,Open Tender,Percentage,Civil Works - Others,No,No,NA ,26-Apr-2023 10:00 AM,NA ,90.0,No ,No,Online,08-May-2023 11:30 AM,"ST and SC Development Deptt||ITDA, Phulbani",Phulbani,762001.0,1.0,"12,50,852",M/S AJIT KUMAR MALLICK,"1,157,037.64",Rejected-AOC,23-Aug-2023,"ST and SC Development Deptt||ITDA, Phulbani"
2023_CERWI_87061_5,BPT/Online-28/2022-23,Construction of bridge over river Sandul (Mahajal Nadi) at 2nd Km. on PWD Road to Sariguda Road in the District of Kalahandi under BSY,Construction of bridge over river Sandul (Mahajal Nadi) at 2nd Km. on PWD Road to Sariguda Road in the District of Kalahandi under BSY,Works,National Competitive Bid,Percentage,Civil Works - Bridges,No,No,NA ,18-Mar-2023 06:00 PM,NA ,90.0,No ,No,Online,04-Apr-2023 11:00 AM,CE RW I||RWCIRCLE-BHAWANIPATNA,BHAWANIPATNA/KALAHANDI,766001.0,2.0,"6,42,18,000",DEMANTI AGRAWAL,"54,592,331",Accepted-AOC,15-Aug-2023,CE RW I||RWCIRCLE-BHAWANIPATNA
2023_EICCL_88188_1,Bid Identification No.S.E.E.C (RandB) 01/2023-24,Provision of Fire Fighting system for MCH Building at Dharmagarh in the District of Kalahandi,Provision of Fire Fighting system for MCH Building at Dharmagarh in the District of Kalahandi,Works,National Competitive Bid,Percentage,Fire & Safety,No,No,NA ,20-Apr-2023 05:00 PM,NA ,90.0,No ,No,Online,08-May-2023 05:00 PM,EIC-CIVIL||SE R and B Electrical,Dharmagarh in the District of Kalahandi,766015.0,2.0,"96,77,047",TEXTEL TECHNOLOGIES PRIVATE LIMITED,"8,226,457.65",Rejected-AOC,31-Aug-2023,EIC-CIVIL||SE R and B Electrical
2023_ORULB_89189_1,EO-UKTM-04/2023-24(7),Construction of CC drain from Khalid Lathia house to Malaya Jani house in Ward No- 04,Civil Work,Works,Open Tender,Percentage,Civil Works - Others,No,No,NA ,23-May-2023 11:00 AM,NA ,270.0,No ,No,Online,09-Jun-2023 11:00 AM,Municipal Bodies||Umerkote Municipality,Umerkote Municipality,764073.0,1.0,,AJAYA KUMAR BEHERA,"504,614.138",Accepted-AOC,09-Aug-2023,Municipal Bodies||Umerkote Municipality
2023_CEMIB_88654_3,GMID-II/01/2023-24,"Improvement to Kenchuapadaghai, KenchuapadaMIP in Khallikote Block under R R and R of water bodies under PMKSY-HKKP","Improvement to Kenchuapadaghai, KenchuapadaMIP in Khallikote Block under R R and R of water bodies under PMKSY-HKKP",Works,Open Tender,Percentage,Civil Works - Others,No,No,NA ,03-May-2023 10:00 AM,NA ,90.0,No ,No,Online,15-May-2023 11:30 AM,"CE,Minor Irrigation,BBSR||SESMIC-BERHAMPUR||GANJAM I","SE, M.I.DIVISION GANJAM-II, BERHAMPUR",760010.0,1.0,"21,19,000",Godabari Swain,"1,800,973",Rejected-AOC,16-Oct-2023,"CE,Minor Irrigation,BBSR||SESMIC-BERHAMPUR||GANJAM I"
2023_OSCSC_88162_1,868 / 17.04.23 BIJATOLA BLOCK,"Selection and appointment of Level-II contractor for transportation of Custom Milled Rice (CMR) from Rice Receiving Centre (RRC) OSWC, Rairangpur to BIJATOLA Block Unit Retail Centres(FPS).","Selection and appointment of Level-II contractor for transportation of Custom Milled Rice (CMR) from Rice Receiving Centre (RRC) OSWC, Rairangpur to BIJATOLA Block Unit Retail Centres(FPS).",Services,Open Tender,Percentage,Handling and Transportation,No,No,NA ,20-Apr-2023 10:00 AM,25-Apr-2023 11:00 AM ,45.0,No ,No,Online,20-May-2023 09:00 AM,Odisha State Civil Supplies Corp. Ltd.||CSO cum DM Mayurbhanj,BIJATOLA BLOCK,757048.0,2.0,"30,91,246",RAMESH KUMAR AGARWAL,43.0,Rejected-Finance,19-Aug-2023,Odisha State Civil Supplies Corp. Ltd.||CSO cum DM Mayurbhanj
2023_CEBBU_89018_4,MDD-e-02/23-24,"Providing Leak proof treatment to Block No.G-6,7,12,16,22 and 23 at Burla for the year 2023-24","Providing Leak proof treatment to Block No.G-6,7,12,16,22 and 23 at Burla for the year 2023-24",Works,Open Tender,Percentage,Civil Works - Others,No,No,NA ,17-May-2023 10:00 AM,NA ,90.0,No ,No,Online,29-May-2023 11:00 AM,"CE-BM,UM Basin,Burla||SE,Hirakud Dam Circle,Burla||EE,Main Dam Divn,Burla",BURLA,768017.0,1.0,"8,44,477",SEEMA VEDI,"717,890",Accepted-AOC,10-Jul-2023,"CE-BM,UM Basin,Burla||SE,Hirakud Dam Circle,Burla||EE,Main Dam Divn,Burla"
2022_CEMIB_79965_10,DMID/05/2022-23,Construction of Bamanamunda Check Dam over Ghodadian Nalla near Village Singada in Parjang Block of Dhenkanal District under MATY Scheme for the year 2022-23,Construction of Bamanamunda Check Dam over Ghodadian Nalla near Village Singada in Parjang Block of Dhenkanal District under MATY Scheme for the year 2022-23,Works,Open Tender,Percentage,Civil Works - Others,No,No,NA ,21-Jul-2022 06:00 PM,NA ,90.0,No ,No,Online,01-Aug-2022 11:00 AM,"CE,Minor Irrigation,BBSR||SECMIC-BHUBANESWAR||M I Division Dhenkanal",Dhenkanal,759001.0,1.0,"33,70,004",SUSHREETA PRADHAN,"2,864,840",Rejected-Finance,14-Aug-2023,"CE,Minor Irrigation,BBSR||SECMIC-BHUBANESWAR||M I Division Dhenkanal"
2023_RWSS_85293_8,EE RWSandS BDK 26 Dt-09.01.2023,"Supplying all materials, labour, TandP for Power supply to RWSS Point including 3ph3W 11 KV line with 55mm2 AAAC and installation of 1 No 25 KVA 11/0.4 KV S/S transformer etc for RPWS Point to village Belda under Bonth Block","Supplying all materials, labour, TandP for Power supply to RWSS Point including 3ph3W 11 KV line with 55mm2 AAAC and installation of 1 No 25 KVA 11/0.4 KV S/S transformer etc for RPWS Point to village Belda under Bonth Block",Works,National Competitive Bid,Percentage,Civil Works - Water Works,No,No,NA ,16-Jan-2023 04:00 PM,NA ,90.0,No ,No,Online,31-Jan-2023 11:00 AM,"Rural Water Supply and Sanitation||RWSS Circle Cuttack||EERWSS,Bhadrak",Belda under Bonth Block,756100.0,1.0,"5,82,000",TAPAS RANJAN PATI,"521,606.08",Not Admitted-Fee/PreQual/Technical/Finance,25-Aug-2023,"Rural Water Supply and Sanitation||RWSS Circle Cuttack||EERWSS,Bhadrak"
2023_CELBB_89440_21,MND-05 OF 2023-24,Restoration to Scoured Bank on Mahanadi left near village Baliput from RD 150M to 230M for the year 2023-24,Restoration to Scoured Bank on Mahanadi left near village Baliput from RD 150M to 230M for the year 2023-24,Works,National Competitive Bid,Percentage,Civil Works - Others,No,No,NA ,30-May-2023 06:30 PM,NA ,90.0,No ,No,Online,06-Jun-2023 11:30 AM,"CE-BM,LMB Basin,BBSR||SE, Eastern Circle,Cuttack||EE, Mahanadi North Division,Jagatpur",ATHAGARH,754021.0,1.0,"33,40,741",Suroja Kumar Pradhan,"2,839,964",Rejected-Finance,10-Aug-2023,"CE-BM,LMB Basin,BBSR||SE, Eastern Circle,Cuttack||EE, Mahanadi North Division,Jagatpur"
2023_ORULB_88877_7,BMC(BAM)/275/2023-24,Const. of main Drain at gandhi nagar spectrum colony ( west ) and near ray building in w. no. 20,Const. of main Drain at gandhi nagar spectrum colony ( west ) and near ray building in w. no. 20,Works,Open Tender,Percentage,Civil Works - Others,No,No,NA ,12-May-2023 03:00 PM,NA ,120.0,No ,No,Online,29-May-2023 11:30 AM,Municipal Bodies||Brahmapur Municipal Corporation,BERHAMPUR,760002.0,1.0,"27,87,358",DEEPAK KUMAR BEHERA,"2,870,979.04",Rejected-Finance,22-Aug-2023,Municipal Bodies||Brahmapur Municipal Corporation
2023_OSPHW_89344_8,10/OPHWC/2023-24,Const. of Toilet-cum-Bath Room at Tumudibandha P.S. Kandhamal,Building Work,Works,National Competitive Bid,Percentage,Civil Works - Buildings,No,No,NA ,26-May-2023 05:00 PM,NA ,90.0,No ,No,Online,07-Jun-2023 11:00 AM,Orissa State Police Housing and Welfare Corporation Ltd,Kandhamal,751022.0,1.0,"25,26,948",BISHWANATH NAYAK,"2,148,158",Accepted-AOC,16-Aug-2023,Orissa State Police Housing and Welfare Corporation Ltd
2023_ORULB_89940_9,EO/AGLM-06/2023-24,Const. of Retaining wall near canal bridge entrance opposite to Truck Owner Association in ward No.15,Const. of Retaining wall near canal bridge entrance opposite to Truck Owner Association in ward No.15,Works,Open Tender,Percentage,Civil Works - Others,No,No,NA ,23-Jun-2023 10:00 AM,NA ,90.0,No ,No,Online,04-Jul-2023 11:00 AM,Municipal Bodies||Angul Municipality,Angul,759122.0,1.0,"7,82,493",JITENDRA KUMAR PRAHARAJ,"665,197",Rejected-AOC,17-Aug-2023,Municipal Bodies||Angul Municipality
2023_OSCSC_87621_1,1036.0,selection and appointment of Handling Contractor (Labour works) for Angul District,"selection and appointment of Handling Contractor (Labour works) for handling of food grain (Rice, Wheat) at all the Rice Receiving Centres (RRCs) (except PEG Talcher) of Angul district",Services,Open Tender,Percentage,Handling and Transportation,No,No,NA ,10-Apr-2023 11:00 AM,10-Apr-2023 11:00 AM ,45.0,No ,No,Online,25-Apr-2023 11:00 AM,Odisha State Civil Supplies Corp. Ltd.||CSO cum DM Angul,Angul,759122.0,2.0,"1,84,02,002",SASHIKALA ENTERPRISES,34.5,Rejected-Finance,21-Aug-2023,Odisha State Civil Supplies Corp. Ltd.||CSO cum DM Angul
2023_EICCL_88952_3,IFB SE 04 OF 2023-24,Construction of Bio Medical Waste Management Unit at Kuliana CHC under Kuliana Block for 2023-24,BUILDING WORK,Works,Open Tender,Percentage,Civil Works - Buildings,No,No,NA ,18-May-2023 10:00 AM,NA ,90.0,No ,No,Online,29-May-2023 11:00 AM,EIC-CIVIL||SERNB-CIRCLE-EASTERN||EERNB-DIVN-RAIRANGPUR,RAIRANGPUR,757043.0,1.0,"7,94,900",PUSPITARANI KALIA,"675,755",Rejected-AOC,19-Aug-2023,EIC-CIVIL||SERNB-CIRCLE-EASTERN||EERNB-DIVN-RAIRANGPUR
2023_CELBB_89783_1,e PROCUREMENT NOTICE NO- 04/2023-24,MBD18 2023-24,"Periodic maintenance to Birupa Barrage Gates including replacement of Gear oil and greasing to the movable parts of Gate like drive shaft bearing, couplings, pinions with replacement of oil seal etc. and application of cadium compound to the wire rop",Works,Open Tender,Percentage,Mechanical Works,No,No,NA ,12-Jun-2023 10:00 AM,NA ,90.0,No ,No,Online,23-Jun-2023 11:30 AM,"CE-BM,LMB Basin,BBSR||SE, Eastern Circle,Cuttack||EE Mahanadi Barrage Division Cuttack",Cuttack,753003.0,1.0,"4,09,547",BANASHREE BHUYAN,"348,156",Rejected-AOC,24-Jul-2023,"CE-BM,LMB Basin,BBSR||SE, Eastern Circle,Cuttack||EE Mahanadi Barrage Division Cuttack"
2023_CELBB_88792_37,MND-02 OF 2023-24,Protection to scoured bank on Birupa left embankment near village Kani between RD00 to RD 104Mtr for the year 2023-24,Protection to scoured bank on Birupa left embankment near village Kani between RD00 to RD 104Mtr for the year 2023-24,Works,National Competitive Bid,Percentage,Civil Works - Others,No,No,NA ,09-May-2023 09:00 AM,NA ,90.0,No ,No,Online,16-May-2023 11:30 AM,"CE-BM,LMB Basin,BBSR||SE, Eastern Circle,Cuttack||EE, Mahanadi North Division,Jagatpur",NURTANGA,754021.0,1.0,"37,09,287",ANIL KUMAR THATOI,"3,153,265",Rejected-Technical,09-Aug-2023,"CE-BM,LMB Basin,BBSR||SE, Eastern Circle,Cuttack||EE, Mahanadi North Division,Jagatpur"
2023_CELBB_87840_4,MND-01 OF 2023-24,Protection to scoured bank on CE 34(B) Birupa right embankment near village Athamania at RD 5.430 Km for the year 2023-24,Protection to scoured bank on CE 34(B) Birupa right embankment near village Athamania at RD 5.430 Km for the year 2023-24,Works,National Competitive Bid,Percentage,Civil Works - Others,No,No,NA ,13-Apr-2023 04:30 PM,NA ,90.0,No ,No,Online,28-Apr-2023 11:30 AM,"CE-BM,LMB Basin,BBSR||SE, Eastern Circle,Cuttack||EE, Mahanadi North Division,Jagatpur",NURTANG,754021.0,2.0,"51,26,960",Md.Abdul Mamoor,"4,358,429",Rejected-Finance,10-Aug-2023,"CE-BM,LMB Basin,BBSR||SE, Eastern Circle,Cuttack||EE, Mahanadi North Division,Jagatpur"
2023_CERWI_88048_19,Tender Online No-20 of 2022-23,S/R to R.I office building at Bilaspur for the year 2022-23 in the District of Jagatsinghpur,S/R to R.I office building at Bilaspur for the year 2022-23 in the District of Jagatsinghpur,Works,Open Tender,Percentage,Civil Works - Buildings,No,No,NA ,19-Apr-2023 02:00 PM,NA ,90.0,No ,No,Online,28-Apr-2023 11:00 AM,CE RW I||RWCIRCLE-CUTTACK||RWDIVISION-JAGATSINGHPUR,Jagatsinghpur,754103.0,1.0,"3,04,844",BIKRAM KISHOR ROUT,"259,148",Rejected-AOC,01-Aug-2023,CE RW I||RWCIRCLE-CUTTACK||RWDIVISION-JAGATSINGHPUR
2023_OSCSC_87485_1,617_3,L-II Transport Contractor for Rayagada Municipality of Rayagada District,Transportation of Custom Milled Rice (CMR) from Rice Receiving Centre (RRC) to Retail Centre (FPS),Services,Open Tender,Percentage,Handling and Transportation,No,No,NA ,04-Apr-2023 02:00 PM,11-Apr-2023 11:00 AM ,45.0,No ,No,Online,20-Apr-2023 11:00 AM,Odisha State Civil Supplies Corp. Ltd.||CSO cum DM Raygada,Rayagada Municipality of Rayagada District,765001.0,2.0,"14,71,342",G TIRUPATI RAO,27.86,Accepted-AOC,21-Aug-2023,Odisha State Civil Supplies Corp. Ltd.||CSO cum DM Raygada
2023_EICCL_90344_1,SE/R AND B/ SNPR / 06 / 2023-24,"Construction of Storage-cum-Bio Medical Waste Management Rooms in CHC, Dunguripali in the District of Subarnapur for the year 2022-23","Construction of Storage-cum-Bio Medical Waste Management Rooms in CHC, Dunguripali in the District of Subarnapur for the year 2022-23",Works,National Competitive Bid,Percentage,Civil Works - Buildings,No,No,NA ,05-Jul-2023 10:00 AM,17-Jul-2023 09:00 AM ,90.0,No ,No,Online,20-Jul-2023 11:30 AM,EIC-CIVIL||SERNB-CIRCLE-BOLANGIR||EERNB-DIVISION-SONEPUR,Sonepur,767017.0,1.0,,BALARAM BARIHA,"1,139,098.14",Accepted-AOC,10-Aug-2023,EIC-CIVIL||SERNB-CIRCLE-BOLANGIR||EERNB-DIVISION-SONEPUR
2023_CELBB_88792_23,MND-02 OF 2023-24,Construction of retaining wall and CC road at RD 2650 to 2800m in Jhadeswarpur Minor of K.B.Canal for the year 2023-24,Construction of retaining wall and CC road at RD 2650 to 2800m in Jhadeswarpur Minor of K.B.Canal for the year 2023-24,Works,National Competitive Bid,Percentage,Civil Works - Others,No,No,NA ,09-May-2023 09:00 AM,NA ,90.0,No ,No,Online,16-May-2023 11:30 AM,"CE-BM,LMB Basin,BBSR||SE, Eastern Circle,Cuttack||EE, Mahanadi North Division,Jagatpur",NAGESHPUR,754021.0,1.0,"26,81,367",PUSHPALATA SWAIN,"2,279,430",Rejected-Technical,11-Aug-2023,"CE-BM,LMB Basin,BBSR||SE, Eastern Circle,Cuttack||EE, Mahanadi North Division,Jagatpur"
