2025_ORULB_123015_17,24/SMC_SBP/2025-26,Development and Maintenance of Potholes-free roads and Covering of slab in open drain in different area of Ward No.16 under Sambalpur Municipal Corporation,Development and Maintenance of Potholes-free roads and Covering of slab in open drain in different area of Ward No.16 under Sambalpur Municipal Corporation,Works,Open Tender,Percentage,Civil Works - Others,No,No,NA ,17-Dec-2025 11:00 AM,NA ,120.0,No ,No,Online,29-Dec-2025 11:00 AM,Municipal Bodies||Sambalpur Municipal Corporation,SAMBALPUR MUNICIPAL CORPORATION,768006.0,1.0,"42,20,534",GROWING TREE INFRA PRIVATE LIMITED,"4,220,534",Accepted-AOC,23-Apr-2026,Municipal Bodies||Sambalpur Municipal Corporation
2026_CERWI_124719_6,Online -EERKL-26 of 2025-26,SR to PWD Road to Andali road for the year 2025-26,SR to PWD Road to Andali road for the year 2025-26,Works,Open Tender,Percentage,Civil Works - Roads,No,No,NA ,17-Jan-2026 06:00 PM,NA ,90.0,No ,No,Online,22-Jan-2026 06:30 PM,CE RW I||RW-CIRCLE-SUNDARGARH||RW-Division-Sundargarh II,Rourkela,769004.0,1.0,"26,29,232",AMIT KUMAR KESHARI,"2,063,947",Rejected-AOC,15-Apr-2026,CE RW I||RW-CIRCLE-SUNDARGARH||RW-Division-Sundargarh II
2026_CERWI_125323_32,Tender Online - 11 of 2025-26,S/R to Itapada to Abhidanandapur Road for the year 2025-26,S/R to Itapada to Abhidanandapur Road for the year 2025-26,Works,Open Tender,Percentage,Civil Works - Buildings,No,No,NA ,02-Feb-2026 12:45 PM,NA ,60.0,No ,No,Online,11-Feb-2026 11:00 AM,CE RW I||RWCIRCLE-CUTTACK||RWDIVISION-JAGATSINGHPUR,Jagatsinghpur,754103.0,1.0,"36,89,000",ABHIJIT DAS,"3,188,455",Rejected-Technical,10-Apr-2026,CE RW I||RWCIRCLE-CUTTACK||RWDIVISION-JAGATSINGHPUR
2025_ORULB_122487_7,BMC-EE-Tender Cell-50/2025-26 Dt. 02.12.2025,Construction of Drain with Road at Mahamaya Nagar and Sarala Nagar Near Rashmita Dixit House in Ward No.16,Construction of Drain with Road at Mahamaya Nagar and Sarala Nagar Near Rashmita Dixit House in Ward No.16,Works,Open Tender,Percentage,Civil Works - Others,No,No,NA ,04-Dec-2025 11:00 AM,09-Dec-2025 04:00 PM ,120.0,No ,No,Online,15-Dec-2025 03:30 PM,Municipal Bodies||Bhubaneswar Municipal Corporation,BMC Area,751022.0,1.0,"21,12,898",BIJAYA KETAN PRADHAN,"2,119,486",Rejected-Finance,04-Apr-2026,Municipal Bodies||Bhubaneswar Municipal Corporation
2025_OSPHW_114167_7,04/OPHWC/2025-26,"Construction of 100 Seated Girls Hostel at Kantabanji Vocational College, Kantabanji, Bolangir",Building Work,Works,National Competitive Bid,Percentage,Civil Works - Buildings,No,No,NA ,04-Jun-2025 04:00 PM,NA ,90.0,No ,No,Online,20-Jun-2025 10:30 AM,Orissa State Police Housing and Welfare Corporation Ltd,Bolangir,751022.0,2.0,"3,38,60,050",BIJAY KUMAR AGRAWAL,"33,826,190",Rejected-Finance,30-Apr-2026,Orissa State Police Housing and Welfare Corporation Ltd
2025_ORULB_122591_20,22/SMC_SBP/2025-26,"Construction of road from Mahandi vihar to Haragouri vihar backside of Lath Bagicha, Ainthapalli ward no-20","Construction of road from Mahandi vihar to Haragouri vihar backside of Lath Bagicha, Ainthapalli ward no-20",Works,Open Tender,Percentage,Civil Works - Others,No,No,NA ,09-Dec-2025 11:00 AM,NA ,120.0,No ,No,Online,19-Dec-2025 11:00 AM,Municipal Bodies||Sambalpur Municipal Corporation,SAMBALPUR MUNICIPAL CORPORATION,768006.0,1.0,"12,70,079",ABDUL AZIZ ANSARY,"1,270,079.23",Rejected-Technical,16-Apr-2026,Municipal Bodies||Sambalpur Municipal Corporation
2025_STSCD_120385_14,ITDAKCD-01/2025-26,Construction of Office Building at Mundhenpali LAMPCS,Construction of Office Building at Mundhenpali LAMPCS,Works,Open Tender,Percentage,Civil Works - Buildings,No,No,NA ,31-Oct-2025 09:00 AM,NA ,90.0,No ,No,Online,10-Nov-2025 10:00 AM,ST and SC Development Deptt||ITDA Kuchinda,JAMANKIRA,768107.0,1.0,"11,62,815",AMIT PRATAP SINGH,"1,086,419",Rejected-Finance,20-Mar-2026,ST and SC Development Deptt||ITDA Kuchinda
2026_OPEPA_125298_1,IFB-DPC SS KPT ACR 91/97 OF 2024-25,CONSTRUCTION OF 1 NO ADDITIONAL CLASS ROOM BUILDING AT STATION KONGA PS OF JEYPORE BLOCK,CONSTRUCTION OF 1 NO ADDITIONAL CLASS ROOM BUILDING AT STATION KONGA PS OF JEYPORE BLOCK,Works,Open Tender,Percentage,Civil Works - Buildings,No,No,NA ,02-Feb-2026 11:00 AM,NA ,90.0,No ,No,Online,21-Feb-2026 11:30 AM,OPEPA Bhubaneswar||Samagra Shiksha Koraput,STATION KONGA PS OF JEYPORE BLOCK,764055.0,1.0,"14,46,697",RAMADHAR BHATARA,"1,446,697",Accepted-AOC,10-Apr-2026,OPEPA Bhubaneswar||Samagra Shiksha Koraput
2025_WATCO_121730_1,WATCO (W)-25(04)/2025-26 Dtd.18.11.2025,Improvement of extension of water supply network to uncovered area of Joda ULB,Improvement of extension of water supply network to uncovered area of Joda ULB,Works,National Competitive Bid,Percentage,Civil Works - Water Works,No,No,NA ,25-Nov-2025 05:00 PM,NA ,120.0,No ,No,Online,11-Dec-2025 12:30 PM,WATCO Bhubaneswar,"Joda, Kendujhar",758034.0,2.0,"2,27,70,000",ARACHIS ZEPPELIN SERVICES PRIVATE LIMITED,"19,357,187",Rejected-Technical,29-Apr-2026,WATCO Bhubaneswar
2026_EICCL_124203_1,SERandBPLB10/25-26,construction of 1 No D type Quarter for staff of ANM Training centre at phulbani as per Lr No.1279 dt06.03.2025 of Directorate of Nursing Odisha Buildings.,Construction of 1 No D type Quarter for staff of ANM Training Centre at Phulbani as per Lr. No. 1279 dt 06.03.2025 of Directorate of Nursing Odisha Buildings.,Works,Open Tender,Percentage,Civil Works - Buildings,No,No,NA ,06-Jan-2026 10:00 AM,NA ,90.0,No ,No,Online,28-Jan-2026 11:00 AM,EIC-CIVIL||SERNB-CIRCLE-PHULBANI||EERNB DIVN PHULBANI,Kandhamal,762001.0,1.0,"47,22,481",FIDELSYS DEVELOPERS PRIVATE LIMITED,"4,014,109",Accepted-AOC,26-Apr-2026,EIC-CIVIL||SERNB-CIRCLE-PHULBANI||EERNB DIVN PHULBANI
2026_ORULB_125930_2,EOCHAMPUANAC-NO-63/2025-26,Construction of Boundary wall and shed of Gosala at Godhuli in ward no-01 of Champua NAC (MSBY),Construction of Boundary wall and shed of Gosala at Godhuli in ward no-01 of Champua NAC (MSBY),Works,Open Tender,Percentage,Civil Works - Others,No,No,NA ,12-Feb-2026 01:00 PM,NA ,120.0,No ,No,Online,25-Feb-2026 09:30 AM,Municipal Bodies||Champua NAC,CHAMPUA,758041.0,1.0,"13,81,728",AMIT KUMAR PANDA,"1,298,875",Accepted-AOC,08-Apr-2026,Municipal Bodies||Champua NAC
2026_CERWI_125768_11,RWDRRP-26/25-26,Special repair to bridge over river Khadkhai on Kumudasole Jaonti road for the year 2025-26,Special repair to bridge over river Khadkhai on Kumudasole Jaonti road for the year 2025-26,Works,Open Tender,Percentage,Civil Works - Roads,No,No,NA ,09-Feb-2026 06:00 PM,NA ,90.0,No ,No,Online,17-Feb-2026 11:30 AM,CE RW I||RWCIRCLE-BARIPADA||RW Division Rairangpur,Rairangpur,757043.0,1.0,"21,18,000",AMIT KUMAR MOHAKUD,"2,107,954",Rejected-AOC,13-Apr-2026,CE RW I||RWCIRCLE-BARIPADA||RW Division Rairangpur
2026_ORULB_126682_8,NAC-KBJ-004/2025-26,Construction and Elivate Boundary Wall of Childrens Park in Ward No. 14,Construction and Elivate Boundary Wall of Childrens Park in Ward No. 14,Works,Open Tender,Percentage,Civil Works - Others,No,No,NA ,02-Mar-2026 11:00 AM,NA ,90.0,No ,No,Online,13-Mar-2026 11:00 AM,Municipal Bodies||Kantabanji NAC,Kantabanji NAC,767039.0,1.0,"16,94,918",ARYA INFRASTRCTURE,"1,998,003",Rejected-AOC,06-Apr-2026,Municipal Bodies||Kantabanji NAC
2026_CEMIB_126650_5,08 (BGR)/2025-26,Improvement to Bandhanghor Check Dam in Balangir Block of Balangir District under the scheme Imrovement To CD for the year 2025-26,Improvement to Bandhanghor Check Dam in Balangir Block of Balangir District under the scheme Imrovement To CD for the year 2025-26,Works,Open Tender,Percentage,Civil Works - Water Works,No,No,NA ,26-Feb-2026 10:00 AM,NA ,90.0,No ,No,Online,09-Mar-2026 10:00 AM,"CE,Minor Irrigation,BBSR||Balangir Minor Irrigation Circle Balangir||MI Division Balangir",Balangir,767001.0,1.0,"6,47,389",ASITA BEHERA,"763,154",Rejected-Finance,08-Apr-2026,"CE,Minor Irrigation,BBSR||Balangir Minor Irrigation Circle Balangir||MI Division Balangir"
2026_OPEPA_125265_1,IFB-DPC SS KPT ACR 66/97 OF 2024-25,CONSTRUCTION OF 1 NO ADDITIONAL CLASS ROOM BUILDING AT PALIGUMANDI PROJ UPS OF KORAPUT BLOCK,CONSTRUCTION OF 1 NO ADDITIONAL CLASS ROOM BUILDING AT PALIGUMANDI PROJ UPS OF KORAPUT BLOCK,Works,Open Tender,Percentage,Civil Works - Buildings,No,No,NA ,02-Feb-2026 11:00 AM,NA ,90.0,No ,No,Online,21-Feb-2026 11:30 AM,OPEPA Bhubaneswar||Samagra Shiksha Koraput,PALIGUMANDI PROJ UPS OF KORAPUT BLOCK,764036.0,1.0,"14,46,156",BILLIAM BAGH,"1,446,156",Accepted-AOC,06-Apr-2026,OPEPA Bhubaneswar||Samagra Shiksha Koraput
2026_CERWI_127073_13,Tender Online Divn. BBSR - 39/2025-26,S/R to Madhubana Darada to Sahanisahi road for the year 2025-26,S/R to Madhubana Darada to Sahanisahi road for the year 2025-26,Works,Open Tender,Percentage,Civil Works - Roads,No,No,NA ,09-Mar-2026 04:30 PM,NA ,90.0,No ,No,Online,16-Mar-2026 11:00 AM,CE RW I||RWCIRCLE-BHUBANESWAR||RWDIVISION-BHUBANESWAR,S.E. R.W. Divn. BBSR,751013.0,1.0,"16,95,000",CHITTA RANJAN DASH,"1,694,609",Rejected-Finance,09-Apr-2026,CE RW I||RWCIRCLE-BHUBANESWAR||RWDIVISION-BHUBANESWAR
2025_PRDJB_113670_1,PS-JPT-T-1/2025-26,Construction of Children park at Mukhiguda under Jaipatna Block,Park work,Works,Open Tender,Percentage,Civil Works - Others,No,No,NA ,22-May-2025 11:00 AM,NA ,90.0,No ,No,Online,06-Jun-2025 11:00 AM,Panchayati Raj and Drinking Water Department Odisha||Zilla Parisad Kalahandi||JAYAPATNA Block,Jaipatna,766018.0,1.0,"18,04,540",ANMOL AGRAWAL,"1,534,039",Rejected-Finance,06-Apr-2026,Panchayati Raj and Drinking Water Department Odisha||Zilla Parisad Kalahandi||JAYAPATNA Block
2026_EICCL_125102_1,S.E. (R and B) - 24/2025-26/NGP,"Construction of Additional Room for Installation of Plotters Machine on First Floor of Record Room at Collectorate Building, Nabarangpur for the year 2025-26",Civil Works,Works,Open Tender,Percentage,Civil Works - Buildings,No,No,NA ,28-Jan-2026 11:00 AM,NA ,90.0,No ,No,Online,07-Feb-2026 11:00 AM,EIC-CIVIL||SERNB-CIRCLE-JEYPORE||EERNB Division Nabarangpur,Nabarangapur,764059.0,1.0,"46,87,685",AMLAN KUMAR JENA,"4,687,685.254",Accepted-AOC,20-Apr-2026,EIC-CIVIL||SERNB-CIRCLE-JEYPORE||EERNB Division Nabarangpur
2026_CERWI_127141_1,SERWSBD Online 12 2025 26,S.H 50 to Kumoganda,Road,Works,Open Tender,Percentage,Civil Works - Roads,No,No,NA ,11-Mar-2026 11:00 AM,NA ,90.0,No ,No,Online,18-Mar-2026 03:00 PM,CE RW I||RWCIRCLE-SUNABEDA||RWDIVISION-SUNABEDA,Sunabeda,763001.0,1.0,"46,95,000",BISWANATH TRIPATHY,"3,046,896",Rejected-AOC,13-Apr-2026,CE RW I||RWCIRCLE-SUNABEDA||RWDIVISION-SUNABEDA
2026_PHEO_124544_1,67/03/SPH(C)/ 2025 -26 dt. 07.01.2026,"Supply of ISI marked Centrifugally Cast (Spun) Ductile Iron socket and spigot (DI K-7 and K-9) pipes of 100mm to 450mm dia for Laying of balance RWRM from new intake well site at Hiradharabati, Kodala W/S scheme under State Plan 2025-26 SUJAL","Supply of ISI marked Centrifugally Cast (Spun) Ductile Iron socket and spigot (DI K-7 and K-9) pipes of 100mm to 450mm dia for Laying of balance RWRM from new intake well site at Hiradharabati, Kodala W/S scheme under State Plan 2025-26 SUJAL",Works,National Competitive Bid,Item Rate,Civil Works - Water Works,No,No,NA ,14-Jan-2026 11:00 AM,NA ,120.0,No ,No,Online,31-Jan-2026 01:00 PM,PHEO||SEPH-CIRCLE-BERHAMPUR||EEPH-DIVN-CHHATRAPUR,Kodola,761032.0,2.0,"8,13,09,000",Electrosteel Castings Limited,"56,096,826",Rejected-AOC,02-Apr-2026,PHEO||SEPH-CIRCLE-BERHAMPUR||EEPH-DIVN-CHHATRAPUR
2025_ORULB_121300_2,MC(CMC)CTC_Div-IIINo.24/25-26,Construction of paver block road with raising of drain and fixing of RCC slab at Govinda Majumdar lane in Ward No.43.,Construction of paver block road with raising of drain and fixing of RCC slab at Govinda Majumdar lane in Ward No.43.,Works,Open Tender,Percentage,Civil Works - Others,No,No,NA ,26-Nov-2025 04:00 PM,NA ,45.0,No ,No,Online,10-Dec-2025 10:00 AM,Municipal Bodies||Cuttack Municipal Corporation,CMC,753012.0,1.0,"2,86,091",CHANDRA SEKHAR SAHOO,"243,206.35",Accepted-AOC,08-Apr-2026,Municipal Bodies||Cuttack Municipal Corporation
2026_CEMIB_124357_1,GMID-II/14/2025-26,Improvement to Kanchanadevihaja MIP in Polosara Block under Improvement to Tanks MIPs,Improvement to Kanchanadevihaja MIP in Polosara Block under Improvement to Tanks MIPs,Works,Open Tender,Percentage,Civil Works - Others,No,No,NA ,08-Jan-2026 04:00 PM,NA ,90.0,No ,No,Online,19-Jan-2026 11:30 AM,"CE,Minor Irrigation,BBSR||SESMIC-BERHAMPUR||GAJAPATI",Polosara,761105.0,1.0,"43,93,294",CHINMAYA KUMAR DASH,"4,147,787",Rejected-AOC,09-Apr-2026,"CE,Minor Irrigation,BBSR||SESMIC-BERHAMPUR||GAJAPATI"
2026_CEMIB_125745_11,"SE,MID,SBP/17/2025-26",Improvement to Bhangamunda Check Dam near village Pandripadhar in Kuchinda Block of Sambalpur District under Improvement to Check Dams 2025-26.,Improvement to Bhangamunda Check Dam near village Pandripadhar in Kuchinda Block of Sambalpur District under Improvement to Check Dams 2025-26.,Works,Open Tender,Percentage,Civil Works - Water Works,No,No,NA ,10-Feb-2026 11:00 AM,NA ,90.0,No ,No,Online,21-Feb-2026 10:00 AM,"CE,Minor Irrigation,BBSR||SENMIC-SAMBALPUR||SAMBALPUR",Sambalpur,768001.0,1.0,"6,08,462",GOVIND MEHER,"607,852.72",Rejected-AOC,30-Mar-2026,"CE,Minor Irrigation,BBSR||SENMIC-SAMBALPUR||SAMBALPUR"
2026_CERWI_126327_3,SERWSBD Online 11 2025 26,Challanput Road to Puraguda,Road,Works,Open Tender,Percentage,Civil Works - Roads,No,No,NA ,20-Feb-2026 02:00 PM,NA ,90.0,No ,No,Online,27-Feb-2026 04:00 PM,CE RW I||RWCIRCLE-SUNABEDA||RWDIVISION-SUNABEDA,Sunabeda,763001.0,1.0,"38,14,000",Balabhadra Khillo,"2,288,106",Rejected-AOC,13-Apr-2026,CE RW I||RWCIRCLE-SUNABEDA||RWDIVISION-SUNABEDA
2026_EICCL_124939_1,eTCN-41/25-26,Construction of Temporary shed of Control Room/Official/Help Desk/Camp Officers/Media/Volunters for Celebration of Maha Shiva Ratri Festival -2026 of Lord Lingaraj at Lingaraj Temple to be held on 15/02/2026 for the Year 2025-26,Construction of Temporary shed of Control Room/Official/Help Desk/Camp Officers/Media/Volunters for Celebration of Maha Shiva Ratri Festival -2026 of Lord Lingaraj at Lingaraj Temple to be held on 15/02/2026 for the Year 2025-26,Works,Open Tender,Percentage,Civil Works - Others,No,No,NA ,22-Jan-2026 06:00 PM,NA ,90.0,No ,No,Online,02-Feb-2026 11:00 AM,EIC-CIVIL||SERNB-CIRCLE-CENTRAL||EERNB-DIVN-II-BBSR,Bhubaneswar,751003.0,1.0,"25,48,446",ALOK KUMAR DAS,"1,529,068",Rejected-Technical,09-Apr-2026,EIC-CIVIL||SERNB-CIRCLE-CENTRAL||EERNB-DIVN-II-BBSR
2025_PRKHO_120459_1,006/ PSKGDN/2025-26,Construction of Office Building and 50MT Godown at Kanpur under Khordha Block in the District of Khordha,As per BOQ,Works,Open Tender,Percentage,Civil Works - Buildings,No,No,NA ,01-Dec-2025 11:00 AM,NA ,120.0,No ,No,Online,16-Dec-2025 11:00 AM,Panchayati Raj and Drinking Water Department Odisha||Zilla Parisad Khordha||KHORDHA Block,"KANPUR,KHORDHA",750255.0,1.0,"23,19,409",AJAYA KUMAR SAHOO,"2,316,409.48",Rejected-AOC,02-Apr-2026,Panchayati Raj and Drinking Water Department Odisha||Zilla Parisad Khordha||KHORDHA Block
2026_ORULB_126260_7,EO/BRMP/04/2025-26,Improvement of Community Center at kapilash w.no-08 of Biramitrapur Municipality,Improvement of Community Center at kapilash w.no-08 of Biramitrapur Municipality,Works,Open Tender,Percentage,Civil Works - Others,No,No,NA ,20-Feb-2026 10:00 AM,NA ,180.0,No ,No,Online,05-Mar-2026 11:30 AM,Municipal Bodies||Birmitrapur Municipality,BIRMITRAPUR MUNICIPALITY,770033.0,1.0,"3,04,041",ARUN BEHERA,"304,041.17",Rejected-AOC,24-Apr-2026,Municipal Bodies||Birmitrapur Municipality
2026_CERWI_127238_1,EEPTNG-online-24/2025-26,S/R to PS Building at Belpada for the year 2025-26,S/R to PS Building at Belpada for the year 2025-26,Works,Open Tender,Percentage,Civil Works - Buildings,No,No,NA ,13-Mar-2026 11:00 AM,NA ,90.0,No ,No,Online,19-Mar-2026 11:00 AM,CE RW I||RWCIRCLE-BALANGIR||RW Division Patnagarh,Patnagarh,767025.0,1.0,"6,64,000",AKASH KUMAR JAIN,"663,431",Rejected-Finance,21-Apr-2026,CE RW I||RWCIRCLE-BALANGIR||RW Division Patnagarh
2026_ORULB_124460_5,EO/SNGM/06/2025-26,Providing and fixing of drain Cover Slab in ward No. 18 and 19,Providing and fixing of drain Cover Slab in ward No. 18 and 19,Works,Open Tender,Percentage,Civil Works - Others,No,No,NA ,13-Jan-2026 11:00 AM,NA ,120.0,No ,No,Online,02-Feb-2026 11:00 AM,Municipal Bodies||Sundargarh Municipality,Sundargarh Municipality,770001.0,1.0,"13,45,566",BIENDRA TOPPO,"1,346,704",Rejected-Finance,09-Apr-2026,Municipal Bodies||Sundargarh Municipality
2026_ORULB_124703_64,EO_KM_03_2025-26,"Repair and Renovation of CC road from Sajid Khan house to Sk. Chand house in Ward No. 18, Kendrapara Municipality.","Repair and Renovation of CC road from Sajid Khan house to Sk. Chand house in Ward No. 18, Kendrapara Municipality.",Works,Open Tender,Percentage,Civil Works - Roads,No,No,NA ,20-Jan-2026 10:00 AM,NA ,90.0,No ,No,Online,04-Feb-2026 11:00 AM,Municipal Bodies||Kendrapara Municipality,KENDRAPARA,754211.0,1.0,"7,92,345",RIYASAT KHAN,"934,874",Rejected-Finance,02-Apr-2026,Municipal Bodies||Kendrapara Municipality
2026_ORULB_125329_21,EOMKG/02/2025-26,"RCC Drain Cover Plate from Veterinary Sahi AWC to Durga Patnaik House, W-12, Malkangiri Municipality","RCC Drain Cover Plate from Veterinary Sahi AWC to Durga Patnaik House, W-12, Malkangiri Municipality",Works,Open Tender,Percentage,Civil Works - Others,No,No,NA ,06-Feb-2026 10:00 AM,NA ,180.0,No ,No,Online,16-Feb-2026 11:00 AM,Municipal Bodies||Malkangiri Municipal Council,Malkangiri Municipality,764045.0,1.0,"4,61,773",BHIMA MADAKAMI,"355,565",Rejected-AOC,27-Apr-2026,Municipal Bodies||Malkangiri Municipal Council
2026_CERWI_125444_7,RWNPD-10(Online) 2025-26,Periodical Maintenance to PWD Road - Karchul from 5/000 to 5/800 for the year 2025-26,Periodical Maintenance to PWD Road - Karchul from 5/000 to 5/800 for the year 2025-26,Works,National Competitive Bid,Percentage,Civil Works - Roads,No,No,NA ,03-Feb-2026 02:00 PM,NA ,90.0,No ,No,Online,11-Feb-2026 11:00 AM,CE RW I||RWCIRCLE-BHAWANIPATNA||RWDIVISION-NUAPADA,NUAPADA,766105.0,1.0,"16,80,602",ALIA KHAN,"1,678,921",Rejected-AOC,15-Apr-2026,CE RW I||RWCIRCLE-BHAWANIPATNA||RWDIVISION-NUAPADA
2026_CERWI_125023_8,EEPTNG-online-18/2025-26,"Special Repair of R.W.Division, Patnagarh for the year 2025-26","Special Repair of R.W.Division, Patnagarh for the year 2025-26",Works,Open Tender,Percentage,Civil Works - Buildings,No,No,NA ,23-Jan-2026 05:00 PM,NA ,90.0,No ,No,Online,06-Feb-2026 11:00 AM,CE RW I||RWCIRCLE-BALANGIR||RW Division Patnagarh,Patnagarh,767025.0,1.0,"25,42,000",AGRAWAL STORES,"2,539,424.18",Rejected-Finance,10-Apr-2026,CE RW I||RWCIRCLE-BALANGIR||RW Division Patnagarh
2025_ORULB_122921_20,P.M. 05/2025-26,Renovation of Kumbharpada Main Road in ward No-22,CIVIL,Works,Open Tender,Percentage,Civil Works - Others,No,No,NA ,16-Dec-2025 03:00 PM,NA ,120.0,No ,No,Online,30-Dec-2025 11:00 AM,Municipal Bodies||Puri Municipality,PURI MUNICIPALITY,752001.0,1.0,"25,32,781",ASHOK KUMAR MOHANTY,"2,153,117.15",Rejected-Finance,22-Apr-2026,Municipal Bodies||Puri Municipality
2026_CERWI_124941_12,14Online)/RWD/BPD/2025-26,S/R to Betnasia to Baunsatofa Road,S/R to Betnasia to Baunsatofa Road,Works,Open Tender,Percentage,Civil Works - Roads,No,No,NA ,22-Jan-2026 03:00 PM,NA ,90.0,No ,No,Online,03-Feb-2026 05:30 PM,CE RW I||RWCIRCLE-BARIPADA||RW Division Baripada,"Baripada, Mayurbhanj",757002.0,1.0,"12,44,000",ANIRUDHA SAHU,"1,242,453",Rejected-AOC,28-Apr-2026,CE RW I||RWCIRCLE-BARIPADA||RW Division Baripada
2026_CERWI_125016_1,OnlineTender/23/SERWDG-I/25-26,SR to Phasipada to Karanjara,SR to Phasipada to Karanjara,Works,National Competitive Bid,Percentage,Civil Works - Roads,No,No,NA ,23-Jan-2026 11:00 AM,NA ,90.0,No ,No,Online,02-Feb-2026 11:00 AM,CE RW I||RWCIRCLE-BERHAMPUR||RWDIVISION-GANJAM - I,Berhampur,760010.0,1.0,"6,72,000",AMARNATH DASH,"537,102",Rejected-Technical,15-Apr-2026,CE RW I||RWCIRCLE-BERHAMPUR||RWDIVISION-GANJAM - I
2026_SEHDP_127106_1,SE-HID(NSPR)-06/2025-26,Construction of Toilet for displaced families of village Borus and Mahulamada at R and R Colony of HIP,Construction of Toilet for displaced families of village Borus and Mahulamada at R and R Colony of HIP,Works,Open Tender,Percentage,Civil Works - Buildings,No,No,NA ,10-Mar-2026 11:00 AM,NA ,90.0,No ,No,Online,26-Mar-2026 11:00 AM,CCE Brutang and Hadua Irrigation Project Dasapalla||SE Hadua Division Narasinghapur,"Kanseilo, Narasinghpur",754032.0,2.0,"63,35,251",ABHAYA BHUSAN SAHOO,"6,335,251.38",Rejected-AOC,13-Apr-2026,CCE Brutang and Hadua Irrigation Project Dasapalla||SE Hadua Division Narasinghapur
2026_CERWI_125151_6,E PROCUREMENT NOTICE NO.RWD-II/KPD-17/25-26,S/R to PWD Road to Bangarakuan road for the year 2025-26,S/R to PWD Road to Bangarakuan road for the year 2025-26,Works,Open Tender,Percentage,Civil Works - Roads,No,No,NA ,29-Jan-2026 11:00 AM,NA ,90.0,No ,No,Online,11-Feb-2026 11:00 AM,CE RW I||RWCIRCLE-KENDRAPARA||RWDIVISION II-KENDRAPARA,Kendrapda,754211.0,1.0,"16,81,000",ABHAYA KUMAR DAS,"1,680,672",Rejected-Finance,06-Apr-2026,CE RW I||RWCIRCLE-KENDRAPARA||RWDIVISION II-KENDRAPARA
2026_EICCL_124305_2,RC(RANDB) RGD NO. II/ 16 /2025-26,S/R to T-D-C road from 0/0 to 40/0 Km such as SDBC (In stretches) during the year 2025-26,Road Work,Works,Open Tender,Percentage,Civil Works - Roads,No,No,NA ,09-Jan-2026 11:00 AM,NA ,90.0,No ,No,Online,17-Jan-2026 11:00 AM,EIC-CIVIL||SERNB-CIRCLE-RAYAGADA||EERNB-DIVN-RAYAGADA NEW,Rayagada,765017.0,2.0,"51,57,312",ABHISHEK SAHU,"4,384,231",Rejected-AOC,24-Apr-2026,EIC-CIVIL||SERNB-CIRCLE-RAYAGADA||EERNB-DIVN-RAYAGADA NEW
2026_ORULB_125654_9,KNR-NAC-05/2025-26,Construction of C.C. cover slab for Drain from Chandan Kumar Behera house towards Chitan Kumar Behera house in Ward No-06 at Kamakhyanagar NAC,Construction of C.C. cover slab for Drain from Chandan Kumar Behera house towards Chitan Kumar Behera house in Ward No-06 at Kamakhyanagar NAC,Works,Open Tender,Percentage,Civil Works - Others,No,No,NA ,07-Feb-2026 01:00 PM,NA ,30.0,No ,No,Online,17-Feb-2026 11:00 AM,Municipal Bodies||Kamakhyanagar NAC,Kamakhyanagar NAC,759018.0,1.0,"2,64,885",ANTARYAMI SAHU,"264,885",Rejected-Finance,16-Apr-2026,Municipal Bodies||Kamakhyanagar NAC
2026_OPEPA_125300_1,IFB-DPC SS KPT ACR 93/97 OF 2024-25,CONSTRUCTION OF 1 NO ADDITIONAL CLASS ROOM BUILDING AT KERAPUT PS OF JEYPORE BLOCK,CONSTRUCTION OF 1 NO ADDITIONAL CLASS ROOM BUILDING AT KERAPUT PS OF JEYPORE BLOCK,Works,Open Tender,Percentage,Civil Works - Buildings,No,No,NA ,02-Feb-2026 11:00 AM,NA ,90.0,No ,No,Online,21-Feb-2026 11:30 AM,OPEPA Bhubaneswar||Samagra Shiksha Koraput,KERAPUT PS OF JEYPORE BLOCK,764002.0,1.0,"14,46,697",SURAMA ENTERPRISES,"1,446,697",Accepted-AOC,08-Apr-2026,OPEPA Bhubaneswar||Samagra Shiksha Koraput
2025_ORULB_122362_46,SOROM_06_2025-26,Restoration of Road from Julu House to Dadhia Pola in Ward No.- 12,Restoration work,Works,Open Tender,Percentage,Civil Works - Others,No,No,NA ,05-Dec-2025 10:00 AM,NA ,120.0,No ,No,Online,16-Dec-2025 10:00 AM,Municipal Bodies||Soro Municipality,"Soro Municipality, Soro",756045.0,1.0,"6,77,966",JAJATIKESHARI PRADHAN,"576,339.29",Rejected-Finance,06-Apr-2026,Municipal Bodies||Soro Municipality
2026_PHEO_126002_1,SEPHBBSR-81(03)/2025-26 DTD.12.02.2026,"Improvement of Water Supply and Sanitary Installation works of CHC Building, Gania under AMA Hospital","Improvement of Water Supply and Sanitary Installation works of CHC Building, Gania under AMA Hospital",Works,National Competitive Bid,Percentage,Civil Works - Roads,No,No,NA ,16-Feb-2026 06:00 PM,NA ,120.0,No ,No,Online,05-Mar-2026 11:00 AM,PHEO||SEPH-CIRCLE-BBSR||EE P.H. Division Bhubaneswar,"Gania, Nayagarh",752085.0,2.0,"63,03,000",CHINTAMANI KUNDA,"4,348,641",Rejected-AOC,28-Apr-2026,PHEO||SEPH-CIRCLE-BBSR||EE P.H. Division Bhubaneswar
2026_EICCL_124120_6,SE RANDB 10/2025-26,"Construction of compound wall at DIC Office, Jey pore for the year 2025-26 (For a length of 52.00 Mtr)",CIVIL,Works,Open Tender,Percentage,Civil Works - Buildings,No,No,NA ,03-Jan-2026 11:00 AM,NA ,90.0,No ,No,Online,13-Jan-2026 11:00 AM,EIC-CIVIL||SERNB-CIRCLE-JEYPORE||EERNB-DIVN-JEYPORE,Jeypore,764001.0,1.0,"6,39,000",DEBADATTA NAYAK,"485,013.06",Rejected-AOC,15-Apr-2026,EIC-CIVIL||SERNB-CIRCLE-JEYPORE||EERNB-DIVN-JEYPORE
2026_OPEPA_125281_1,IFB-DPC SS KPT ACR 79/97 OF 2024-25,CONSTRUCTION OF 1 NO ADDITIONAL CLASS ROOM BUILDING AT JHADIGUDA PROJ UPS OF BORIGUMMA BLOCK,CONSTRUCTION OF 1 NO ADDITIONAL CLASS ROOM BUILDING AT JHADIGUDA PROJ UPS OF BORIGUMMA BLOCK,Works,Open Tender,Percentage,Civil Works - Buildings,No,No,NA ,02-Feb-2026 11:00 AM,NA ,90.0,No ,No,Online,21-Feb-2026 11:30 AM,OPEPA Bhubaneswar||Samagra Shiksha Koraput,JHADIGUDA PROJ UPS OF BORIGUMMA BLOCK,764056.0,1.0,"14,45,282",NIRMALYA BARIK,"1,445,282",Accepted-AOC,10-Apr-2026,OPEPA Bhubaneswar||Samagra Shiksha Koraput
2025_PHEO_123857_1,NIT No.12 of 2025-26,"Automation of 8 MLD WTP, Zonal reservoir and other ancillary works of Nabarangpur Municipality under State Plan, D.No.13-4215 SUJALA for the Year 2025-26","Automation of 8 MLD WTP, Zonal reservoir and other ancillary works of Nabarangpur Municipality",Works,National Competitive Bid,Percentage,Civil Works - Water Works,No,No,NA ,26-Dec-2025 01:00 PM,NA ,120.0,No ,No,Online,08-Jan-2026 11:00 AM,PHEO||PH Circle Bhawanipatna||PH Division Koraput,Nabarangpur,764059.0,2.0,"5,02,08,404",ASHISH MOHANTY,"42,677,645",Accepted-AOC,24-Apr-2026,PHEO||PH Circle Bhawanipatna||PH Division Koraput
2026_EICCL_124120_7,SE RANDB 10/2025-26,S/R such as Construction of RCC Drain from 176/320Km to 176/500Km (LHS) on Vizag Jeypore Road during the year 2025-26,CIVIL,Works,Open Tender,Percentage,Civil Works - Buildings,No,No,NA ,03-Jan-2026 11:00 AM,NA ,90.0,No ,No,Online,13-Jan-2026 11:00 AM,EIC-CIVIL||SERNB-CIRCLE-JEYPORE||EERNB-DIVN-JEYPORE,LAMTAPUT,764081.0,1.0,"8,30,000",BIJAY KUMAR PANDA,"579,708.85",Rejected-AOC,09-Apr-2026,EIC-CIVIL||SERNB-CIRCLE-JEYPORE||EERNB-DIVN-JEYPORE
