2026_ORULB_125654_45,KNR-NAC-05/2025-26,Construction of Community Center in Ward No-06 at Kamakhyanagar NAC,Construction of Community Center in Ward No-06 at Kamakhyanagar NAC,Works,Open Tender,Percentage,Civil Works - Others,No,No,NA ,07-Feb-2026 01:00 PM,NA ,30.0,No ,No,Online,17-Feb-2026 11:00 AM,Municipal Bodies||Kamakhyanagar NAC,Kamakhyanagar NAC,759018.0,1.0,"3,38,972",RASHMITA ROUT,"338,972",Rejected-Finance,22-Apr-2026,Municipal Bodies||Kamakhyanagar NAC
2026_CERWI_125000_1,EEPTNG-online-17/2025-26,Periodical Maintenance to NH201 to Siletpada road for the year 2025-26,Periodical Maintenance to NH201 to Siletpada road for the year 2025-26,Works,Open Tender,Percentage,Civil Works - Roads,No,No,NA ,22-Jan-2026 06:55 PM,NA ,90.0,No ,No,Online,06-Feb-2026 11:00 AM,CE RW I||RWCIRCLE-BALANGIR||RW Division Patnagarh,Patnagarh,767025.0,1.0,"38,14,000",SATYABRATA BHOI,"3,809,404",Rejected-Finance,16-Apr-2026,CE RW I||RWCIRCLE-BALANGIR||RW Division Patnagarh
2026_CERWI_125248_9,Online Tender-15 RWD Kuchinda 2025-26,S/R to Road from Kumkapali to Turkuchuan in the District of Sambalpur for the year 2025-26.,S/R to Road from Kumkapali to Turkuchuan in the District of Sambalpur for the year 2025-26.,Works,National Competitive Bid,Percentage,Civil Works - Roads,No,No,NA ,31-Jan-2026 09:00 AM,NA ,90.0,No ,No,Online,06-Feb-2026 11:00 AM,CE RW I||RWCIRCLE-SAMBALPUR||RW Division Kuchinda,Kuchinda,768222.0,1.0,"30,89,999",GURSIMRAN SALUJA,"2,331,096",Accepted-AOC,25-Feb-2026,CE RW I||RWCIRCLE-SAMBALPUR||RW Division Kuchinda
2026_CERWI_124941_6,14Online)/RWD/BPD/2025-26,S/R to PWD Road to Dhansole,S/R to PWD Road to Dhansole,Works,Open Tender,Percentage,Civil Works - Roads,No,No,NA ,22-Jan-2026 03:00 PM,NA ,90.0,No ,No,Online,03-Feb-2026 05:30 PM,CE RW I||RWCIRCLE-BARIPADA||RW Division Baripada,"Baripada, Mayurbhanj",757002.0,1.0,"25,21,000",TAPAS KUMAR NAYAK,"2,528,314",Rejected-AOC,28-Apr-2026,CE RW I||RWCIRCLE-BARIPADA||RW Division Baripada
2025_ORULB_122550_14,HIN-MUN-04/2025-26,"Development and Maintenance of covered drain with putting cover slab at Srikhetra Marga, Manika Nagar AND Baikuntha Nagar in Ward No.- 16, Tarini Marga Main lane, Bila Sahi, Ward No.-17, Kanhei Marga, Ward No.-19 under Hinjilicut Municipality","Development and Maintenance of covered drain with putting cover slab at Srikhetra Marga, Manika Nagar AND Baikuntha Nagar in Ward No.- 16, Tarini Marga Main lane, Bila Sahi, Ward No.-17, Kanhei Marga, Ward No.-19 under Hinjilicut Municipality",Works,Open Tender,Percentage,Civil Works - Others,No,No,NA ,07-Dec-2025 11:00 AM,NA ,60.0,No ,No,Online,19-Dec-2025 11:00 AM,Municipal Bodies||Hinjilicut Municipal Council,HINJILICUT MUNICIPALITY,761102.0,1.0,"8,39,067",AKASH NAYAK,"713,290.5",Accepted-AOC,21-Apr-2026,Municipal Bodies||Hinjilicut Municipal Council
2026_CERWI_125307_7,Online Tender/24/SERWD-II/2025-26,S/R PWD road to Palanga for the year 2025-26,S/R PWD road to Palanga for the year 2025-26,Works,National Competitive Bid,Percentage,Civil Works - Roads,No,No,NA ,31-Jan-2026 03:30 PM,NA ,90.0,No ,No,Online,06-Feb-2026 11:00 AM,CE RW I||RWCIRCLE-BERHAMPUR||RWDIVISION-GANJAM - II,Berhampur,760011.0,1.0,"6,32,313",DEBAJANI NAYAK,"442,619",Accepted-AOC,29-Apr-2026,CE RW I||RWCIRCLE-BERHAMPUR||RWDIVISION-GANJAM - II
2025_PHEO_122041_6,NIT No.8 of 2025-26,"Improvement of WS,SI and SD system of DHH Malkangiri under SP, D.No.13-4215 SUJALA for the year 2025-26","Improvement of WS,SI and SD system of DHH Malkangiri",Works,National Competitive Bid,Percentage,Civil Works - Water Works,No,No,NA ,28-Nov-2025 11:00 AM,NA ,120.0,No ,No,Online,11-Dec-2025 11:00 AM,PHEO||PH Circle Bhawanipatna||PH Division Koraput,Malkangiri,764045.0,1.0,"16,81,967",BIJAYA KUMAR MADALA,"1,429,840",Accepted-AOC,04-Apr-2026,PHEO||PH Circle Bhawanipatna||PH Division Koraput
2026_OLIC_124840_3,DKL(OLIC)-04/2025-26,installation and Energisation of Lauloi-VIII L.I.P under Gondia Block in Dhenkanal District.,installation and Energisation of Lauloi-VIII L.I.P under Gondia Block in Dhenkanal District.,Works,Open Tender,Percentage,Civil Works - Lift Irrigation Schemes,No,No,NA ,20-Jan-2026 09:00 AM,NA ,90.0,No ,No,Online,30-Jan-2026 11:00 AM,Orissa Lift Irrigation Corporation||LI ANGUL||LI Division Dhenkanal,Dhenkanal,759001.0,2.0,"25,02,645",RANAJIT PANY,"2,502,394.74",Rejected-Finance,20-Apr-2026,Orissa Lift Irrigation Corporation||LI ANGUL||LI Division Dhenkanal
2026_ORULB_124187_5,ASKANAC/MSBY-08/2025-26,"CONSTRUCTION OF VENDING ZONE NEAR SMART PARK,ASKA","CONSTRUCTION OF VENDING ZONE NEAR SMART PARK,ASKA",Works,Open Tender,Percentage,Civil Works - Others,No,No,NA ,06-Jan-2026 11:00 AM,NA ,60.0,No ,No,Online,20-Jan-2026 11:00 AM,Municipal Bodies||Aska NAC,"NAC,ASKA",761110.0,2.0,"15,94,209",SUDESHNA PANDA,"1,562,325.25",Rejected-Finance,28-Apr-2026,Municipal Bodies||Aska NAC
2026_PRBRU_124317_1,03/2025-26,"CONSTRUCTION OF CLASS ROOM WITH AT GOPALPUR COLLEGE ,GOPALPUR",BUILDING WORK,Works,Open Tender,Percentage,Civil Works - Buildings,No,No,NA ,08-Jan-2026 11:00 AM,NA ,90.0,No ,No,Online,30-Jan-2026 11:00 AM,Panchayati Raj and Drinking Water Department Odisha||Zilla Parisad Ganjam||RANGEILUNDA Block,RANGEILUNDA BLOCK,761008.0,1.0,"39,06,993",V. NARASIMHA MURTY,"3,321,336",Rejected-Finance,02-Apr-2026,Panchayati Raj and Drinking Water Department Odisha||Zilla Parisad Ganjam||RANGEILUNDA Block
2026_ORULB_124354_10,BRJNRM -04/2025-26,Development of Gupchup Pada Pond at Ward No.4.,Development,Works,Open Tender,Percentage,Civil Works - Others,No,No,NA ,09-Jan-2026 05:00 PM,NA ,90.0,No ,No,Online,21-Jan-2026 11:00 AM,Municipal Bodies||Brajrajnagar Municipality,Brajrajnagar Municipality,768216.0,2.0,"19,99,900",lalu kishan,"1,694,842.36",Accepted-AOC,20-Apr-2026,Municipal Bodies||Brajrajnagar Municipality
2026_CEMIB_126911_1,SNPMI_04_2025_26,Improvement to Kusadadar M.I.P in Birmaharajpur Block of Subarnapur District under I.D.F Scheme for the year 2025-26,Improvement to Kusadadar M.I.P in Birmaharajpur Block of Subarnapur District under I.D.F Scheme for the year 2025-26,Works,Open Tender,Percentage,Civil Works - Others,No,No,NA ,06-Mar-2026 11:00 AM,NA ,90.0,No ,No,Online,17-Mar-2026 11:00 AM,"CE,Minor Irrigation,BBSR||Balangir Minor Irrigation Circle Balangir||MI Division Padampur",Birmaharajpur Block,767018.0,2.0,"61,07,048",BISWA PRASANNA MISHRA,"6,100,941",Rejected-AOC,07-Apr-2026,"CE,Minor Irrigation,BBSR||Balangir Minor Irrigation Circle Balangir||MI Division Padampur"
2026_CERWI_124581_14,NCB 16 OF 2025-26,Periodical Maintenance to NH-6 to Dabarchuan from ch 0/000 to 2/200 for the year 2025- 26.,Periodical Maintenance to NH-6 to Dabarchuan from ch 0/000 to 2/200 for the year 2025- 26.,Works,National Competitive Bid,Percentage,Civil Works - Roads,No,No,NA ,15-Jan-2026 05:00 PM,NA ,90.0,No ,No,Online,21-Jan-2026 11:00 AM,CE RW I||RWCIRCLE-KEONJHAR||RWDIVISION-KEONJHAR,KEONJHAR,758001.0,1.0,"34,89,000",JHUNALATA BISWAL,"2,581,803",Accepted-AOC,09-Apr-2026,CE RW I||RWCIRCLE-KEONJHAR||RWDIVISION-KEONJHAR
2026_STSCD_125024_3,ITDABPD-05/2025-26,Construction of 50 seated New Hostel Building at Khukundia under Kuliana Block.,Construction of 50 seated New Hostel Building at Khukundia under Kuliana Block.,Works,National Competitive Bid,Percentage,Civil Works - Buildings,No,No,NA ,27-Jan-2026 10:00 AM,NA ,90.0,No ,No,Online,17-Feb-2026 11:00 AM,ST and SC Development Deptt||ITDA Baripada,BARIPADA,757002.0,2.0,"1,18,32,993",ABHIJIT MOHAPATRA,"11,821,160.503",Accepted-AOC,20-Apr-2026,ST and SC Development Deptt||ITDA Baripada
2026_EICCL_124151_1,SE-PKD-RandB-DIVN-17/2025-26,Repair and Renovation of Sub-Collector qtrs. at Revenue Colony Paralakhemundi (Such as providing Plastic Felt and fibre ceiling etc.) in the District of Gajapati.,Repair and Renovation of Sub-Collector qtrs. at Revenue Colony Paralakhemundi (Such as providing Plastic Felt and fibre ceiling etc.) in the District of Gajapati.,Works,National Competitive Bid,Percentage,Civil Works - Buildings,No,No,NA ,03-Jan-2026 06:00 PM,NA ,90.0,No ,No,Online,16-Jan-2026 12:00 PM,EIC-CIVIL||SERNB-CIRCLE-RAYAGADA||EERNB DIVN PARALAKHEMUNDI,Paralakhemundi,761200.0,1.0,"2,28,375",SUMANATH SAHU,"179,274",Rejected-AOC,06-Apr-2026,EIC-CIVIL||SERNB-CIRCLE-RAYAGADA||EERNB DIVN PARALAKHEMUNDI
2026_STSCD_125024_13,ITDABPD-05/2025-26,"Construction 40 seated new Hostel Building at Gudiabandha PSH, under Badasahi Block.","Construction 40 seated new Hostel Building at Gudiabandha PSH, under Badasahi Block.",Works,National Competitive Bid,Percentage,Civil Works - Buildings,No,No,NA ,27-Jan-2026 10:00 AM,NA ,90.0,No ,No,Online,17-Feb-2026 11:00 AM,ST and SC Development Deptt||ITDA Baripada,BARIPADA,757002.0,2.0,"79,98,696",RISHAV KUMAR BEHERA,"7,990,697.326",Rejected-AOC,20-Apr-2026,ST and SC Development Deptt||ITDA Baripada
2025_PZPKL_124037_6,PSKOLno.04/2025-26,DTCN towards construction of GPLF Building at Therubali of KOLNARA BLOCK,DTCN towards construction of GPLF Building at Therubali of KOLNARA BLOCK,Works,Open Tender,Percentage,Civil Works - Buildings,No,No,NA ,01-Jan-2026 11:00 AM,NA ,90.0,No ,No,Online,16-Jan-2026 11:30 AM,Panchayati Raj and Drinking Water Department Odisha||Zilla Parisad Rayagada||KOLNARA Block,Therubali,765017.0,1.0,"24,81,538",GUNTAMUKALA GOWRI SANKAR RAO,"2,109,555.632",Rejected-AOC,04-Apr-2026,Panchayati Raj and Drinking Water Department Odisha||Zilla Parisad Rayagada||KOLNARA Block
2025_ORULB_120037_7,PM_02/2025-26,Improvement of Road from Bhagabat Sahoo house to Madhu Behera house in Ward No-03,Improvement of Road from Bhagabat Sahoo house to Madhu Behera house in Ward No-03,Works,Open Limited,Percentage,Civil Works - Others,No,No,NA ,25-Oct-2025 06:00 PM,NA ,90.0,No ,No,Online,15-Nov-2025 11:00 AM,Municipal Bodies||Pattamundai Municipality,Pattamundai,754215.0,1.0,"4,79,071",DILLIP KUMAR BEHURA,"480,565",Rejected-Finance,20-Apr-2026,Municipal Bodies||Pattamundai Municipality
2025_WATCO_121726_1,WATCO (W)-25(02)/2025-26 Dtd.18.11.2025,Laying of 100mm and 150mm dia. DI distribution pipe line under Sundargarh Municipality area,Laying of 100mm and 150mm dia. DI distribution pipe line under Sundargarh Municipality area,Works,National Competitive Bid,Percentage,Civil Works - Water Works,No,No,NA ,25-Nov-2025 05:00 PM,NA ,120.0,No ,No,Online,11-Dec-2025 12:30 PM,WATCO Bhubaneswar,Sundargarh,770001.0,2.0,"1,22,24,000",JRCC Infra LLP,"10,391,309",Rejected-AOC,15-Apr-2026,WATCO Bhubaneswar
2026_EICCL_126126_1,SE R and B Divn NoI Bam 61/2025-26,S/R to Sub collector office building such as providing inside and out side painting and water proofing and other repair works building at BAM,S/R to Sub collector office building such as providing inside and out side painting and water proofing and other repair works building at BAM,Works,Open Tender,Percentage,Civil Works - Buildings,No,No,NA ,17-Feb-2026 01:00 PM,NA ,90.0,No ,No,Online,25-Feb-2026 11:30 AM,EIC-CIVIL||SERNB-CIRCLE-BERHAMPUR||EERNB-DIVN-GANJAM I,Ganjam,760005.0,1.0,"23,86,412",Bharati Kumari Sahu,"1,384,119",Rejected-AOC,15-Apr-2026,EIC-CIVIL||SERNB-CIRCLE-BERHAMPUR||EERNB-DIVN-GANJAM I
2026_DFOKJ_125883_3,FEnCC-DFO (T)- KJR-05/2025-26,"Construction of EGB near Kuanr, Kuanr DPF of BJP Range under OMBADC (DPR 2023-24)","Construction of EGB near Kuanr, Kuanr DPF of BJP Range under OMBADC (DPR 2023-24)",Works,Open Tender,Percentage,Civil Works - Water Works,No,No,NA ,12-Feb-2026 10:00 AM,NA ,90.0,No ,No,Online,21-Feb-2026 10:00 AM,Forest Environment and Climate Change Department||RCCF Rourkela||DFO Keonjhar,Kuanr DPF BJP range,758018.0,1.0,"29,49,228",PRATAP RUDRA SAHOO,"2,157,655",Rejected-Finance,29-Apr-2026,Forest Environment and Climate Change Department||RCCF Rourkela||DFO Keonjhar
2026_CERWI_125490_5,BI No.Tender Online SNPR-13 of 2025-26,S/R TO TARVA BRAHMANAI RD ROAD TO NADHARA,Civil Road Works S/R,Works,Open Tender,Percentage,Civil Works - Roads,No,No,NA ,04-Feb-2026 09:00 AM,NA ,90.0,No ,No,Online,11-Feb-2026 11:00 AM,CE RW I||RWCIRCLE-BALANGIR||RWDIVISION-SONEPUR,Sonepur,757017.0,1.0,"12,61,000",UPENDRA SETHI,"1,259,430",Rejected-AOC,18-Apr-2026,CE RW I||RWCIRCLE-BALANGIR||RWDIVISION-SONEPUR
2026_ORULB_125752_24,ASKANAC/WORKSMISC-09/2025-26,"IMPROVEMENT OF ROAD BACK SIDE OF WEST STREET (LACHHAMANPALLI) WARD NO-16, NAC,ASKA","IMPROVEMENT OF ROAD BACK SIDE OF WEST STREET (LACHHAMANPALLI) WARD NO-16, NAC,ASKA",Works,Open Tender,Percentage,Civil Works - Others,No,No,NA ,11-Feb-2026 11:00 AM,NA ,120.0,No ,No,Online,24-Feb-2026 11:00 AM,Municipal Bodies||Aska NAC,"NAC,ASKA",761110.0,2.0,"15,74,730",Nilanchala Tripathy,"1,543,235",Accepted-AOC,22-Apr-2026,Municipal Bodies||Aska NAC
2026_EICCL_125215_1,SE R and B Divn NoI Bam 57/2025-26,S/R to Sub collector office building at BAM such as repair to confrence hall,S/R to Sub collector office building at BAM such as repair to confrence hall,Works,Open Tender,Percentage,Civil Works - Buildings,No,No,NA ,30-Jan-2026 04:00 PM,NA ,90.0,No ,No,Online,07-Feb-2026 11:30 AM,EIC-CIVIL||SERNB-CIRCLE-BERHAMPUR||EERNB-DIVN-GANJAM I,Ganjam,760005.0,1.0,"2,81,672",PANCHANAN SAHU,"197,199",Rejected-AOC,20-Apr-2026,EIC-CIVIL||SERNB-CIRCLE-BERHAMPUR||EERNB-DIVN-GANJAM I
2026_ORULB_125752_18,ASKANAC/WORKSMISC-09/2025-26,REPAIR AND RENOVATION OF SWEEPER QUARTER AT KALIMKHI SAHIIN WARD NO-13,REPAIR AND RENOVATION OF SWEEPER QUARTER AT KALIMKHI SAHIIN WARD NO-13,Works,Open Tender,Percentage,Civil Works - Others,No,No,NA ,11-Feb-2026 11:00 AM,NA ,120.0,No ,No,Online,24-Feb-2026 11:00 AM,Municipal Bodies||Aska NAC,"NAC,ASKA",761110.0,2.0,"2,55,016",Bhagaban Behera,"237,190",Accepted-AOC,23-Apr-2026,Municipal Bodies||Aska NAC
2026_CERWI_125375_18,Online Tender- 17/EERWDBLG/2025-26,SR to L043-SH to Adipadar Road for the year 2025-26 (Boxcell Culvert),SR to L043-SH to Adipadar Road for the year 2025-26 (Boxcell Culvert),Works,National Competitive Bid,Percentage,Civil Works - Roads,No,No,NA ,02-Feb-2026 01:30 PM,NA ,90.0,No ,No,Online,10-Feb-2026 11:30 AM,CE RW I||RWCIRCLE-BERHAMPUR||EE RW Divn. Baliguda,"Executive Engineer RWD Balliguda, Kandhamal",762103.0,1.0,"38,13,362",BILARSEN PARASETH,"2,642,660",Rejected-Technical,23-Apr-2026,CE RW I||RWCIRCLE-BERHAMPUR||EE RW Divn. Baliguda
2026_ORULB_125192_28,GUN-MUN-78/2025-26,Repair and Restoration of pothole and laying of drain cover slab in ward No.07,Repair and Restoration of pothole and laying of drain cover slab in ward No.07,Works,Open Tender,Percentage,Civil Works - Others,No,No,NA ,01-Feb-2026 11:00 AM,NA ,90.0,No ,No,Online,11-Feb-2026 11:00 AM,Municipal Bodies||Gunupur Municipal Council,Gunupur Muncipality area,765022.0,1.0,"12,12,624",GUNTAMUKALA GOWRI SANKAR RAO,"1,430,897",Rejected-Finance,28-Apr-2026,Municipal Bodies||Gunupur Municipal Council
2025_PRBAI_120039_1,03/PSB/2025-26,CONSTRUCTION OF GPLF OFFICE BUILDING WITH MARKET COMPLEX AT SATYABHAMAPUR GP OF BALIANTA BLOCK IN KHORDHA DISTRICT,AS PER BOQ,Works,Open Tender,Percentage,Civil Works - Buildings,No,No,NA ,25-Oct-2025 11:00 AM,NA ,120.0,No ,No,Online,10-Nov-2025 11:00 AM,Panchayati Raj and Drinking Water Department Odisha||Zilla Parisad Khordha||BALIANTA Block,SATYABHAMAPUR GP,752100.0,1.0,"22,04,079",PADMALOCHAN PRADHAN,"2,204,078.37",Rejected-AOC,09-Jan-2026,Panchayati Raj and Drinking Water Department Odisha||Zilla Parisad Khordha||BALIANTA Block
2025_PHEO_122247_2,ACEPHBGR 13/2025-26,"Water supply to Titilagarh Section I, 11nos and Titilagarh Section II, 16nos of School and Anganwadis.","Water supply to Titilagarh Section I, 11nos and Titilagarh Section II, 16nos of School and Anganwadis.",Works,National Competitive Bid,Percentage,Civil Works - Water Works,No,No,NA ,01-Dec-2025 11:00 AM,NA ,120.0,No ,No,Online,17-Dec-2025 11:00 AM,PHEO||PH Circle Bhawanipatna||PH Division Balangir,Titilagarh Town,767033.0,1.0,"41,72,266",MOHAMMAD TAHIR KHAN,"3,546,843.72",Rejected-Finance,30-Apr-2026,PHEO||PH Circle Bhawanipatna||PH Division Balangir
2026_CERWI_127069_1,Tender Online Divn. BBSR - 39/2025-26,S/R to Veteswar to Banloi Road,S/R to Veteswar to Banloi Road,Works,Open Tender,Percentage,Civil Works - Roads,No,No,NA ,09-Mar-2026 02:00 PM,NA ,90.0,No ,No,Online,16-Mar-2026 11:00 AM,CE RW I||RWCIRCLE-BHUBANESWAR||RWDIVISION-BHUBANESWAR,Khordha,751013.0,1.0,"8,47,000",SARTHAK INFRA AND ASSOCIATES,"571,781.98",Rejected-Finance,02-Apr-2026,CE RW I||RWCIRCLE-BHUBANESWAR||RWDIVISION-BHUBANESWAR
2026_STSCD_125094_12,ITDATHR-04/2025-26,Construction of two nos of Staff Quarter at Gopabandhu High School Biswanathpur,Construction of two nos of Staff Quarter at Gopabandhu High School Biswanathpur,Works,National Competitive Bid,Percentage,Civil Works - Buildings,No,No,NA ,29-Jan-2026 11:00 AM,NA ,120.0,No ,No,Online,12-Feb-2026 11:00 AM,ST and SC Development Deptt||ITDA Th. Rampur,KALAHANDI/BHAWANIPATNA,766001.0,2.0,"19,34,467",ABHIMANYU CHHATRIA,"1,870,049.3",Rejected-Finance,25-Apr-2026,ST and SC Development Deptt||ITDA Th. Rampur
2026_ORULB_125192_14,GUN-MUN-78/2025-26,Construction of Cultural Mandap Near Ganesh Mandir Sephali Pahado in Ward No.19,Construction of Cultural Mandap Near Ganesh Mandir Sephali Pahado in Ward No.19,Works,Open Tender,Percentage,Civil Works - Buildings,No,No,NA ,01-Feb-2026 11:00 AM,NA ,90.0,No ,No,Online,11-Feb-2026 11:00 AM,Municipal Bodies||Gunupur Municipal Council,Gunupur Municipality area,765022.0,1.0,"8,47,453",JANI VENKATA RAO BAURI,"847,453.89",Accepted-AOC,27-Apr-2026,Municipal Bodies||Gunupur Municipal Council
2025_ORULB_123906_1,UKTM-MUN- 05/2025-26(4),Const. of Community Centre at Ektaguda in Ward No-13,Civil Work,Works,Open Tender,Percentage,Civil Works - Buildings,No,No,NA ,29-Dec-2025 10:00 AM,NA ,60.0,No ,No,Online,16-Jan-2026 11:00 AM,Municipal Bodies||Umerkote Municipality,Umerkote Municipality,764073.0,1.0,,RAJESH KUMAR BISOYI,"724,699",Rejected-Finance,15-Apr-2026,Municipal Bodies||Umerkote Municipality
2025_ORULB_123920_2,OR/ULB/BUD/8/2025-26,Construction of Cold Drinking water Project near Sankhachuda Bandha Bapujinagar in ward No 10,construction of cold drinking water project,Works,Open Tender,Percentage,Civil Works - Buildings,No,No,NA ,31-Dec-2025 10:00 AM,NA ,90.0,No ,No,Online,19-Jan-2026 11:00 AM,Municipal Bodies||Boudhgarh NAC,NAC Boudhgarh,762014.0,1.0,"7,52,809",Kalyani Sahu,"752,057",Rejected-AOC,11-Apr-2026,Municipal Bodies||Boudhgarh NAC
2026_CERWI_125444_12,RWNPD-10(Online) 2025-26,S/R to Barandapat to Kunjalpada via Chhata road for the year 2025-26,S/R to Barandapat to Kunjalpada via Chhata road for the year 2025-26,Works,National Competitive Bid,Percentage,Civil Works - Roads,No,No,NA ,03-Feb-2026 02:00 PM,NA ,90.0,No ,No,Online,11-Feb-2026 11:00 AM,CE RW I||RWCIRCLE-BHAWANIPATNA||RWDIVISION-NUAPADA,NUAPADA,766105.0,1.0,"5,66,406",ALIA KHAN,"565,839",Rejected-AOC,17-Apr-2026,CE RW I||RWCIRCLE-BHAWANIPATNA||RWDIVISION-NUAPADA
2025_ORULB_122577_23,05/PKDM-2025-26,"Construction of Community Hall at Kandra Street-1, Ward No.12",Construction of Community Hall,Works,Open Tender,Percentage,Civil Works - Others,No,No,NA ,06-Dec-2025 10:00 AM,NA ,90.0,No ,No,Online,19-Dec-2025 11:00 AM,Municipal Bodies||Parlakhemundi Municipal Council,Paralakhemundi Municipality,761200.0,1.0,"4,23,247",CHITTARANJAN DASH,"359,802",Rejected-AOC,06-Apr-2026,Municipal Bodies||Parlakhemundi Municipal Council
2026_DFBRG_124419_1,FOR DFO BGH No.03 OF 2025-26,"Construction of Staff Barrack at Range Office Campus, Bargarh","Construction of Staff Barrack at Range Office Campus, Bargarh",Works,Open Tender,Percentage,Civil Works - Buildings,No,No,NA ,10-Jan-2026 10:00 AM,NA ,90.0,No ,No,Online,20-Jan-2026 11:00 AM,Forest Environment and Climate Change Department||RCCF Sambalpur||DFO Baragarh,Bargarh,768028.0,1.0,"29,34,058",PRATIMA PANDA,"2,494,242",Rejected-AOC,30-Jan-2026,Forest Environment and Climate Change Department||RCCF Sambalpur||DFO Baragarh
2025_ORULB_123015_22,24/SMC_SBP/2025-26,"Repair and maintenance of pot hole with covering of slab in open drain in Kainsir, Densargi and Singhpali of Ward No - 20, Under SMC","Repair and maintenance of pot hole with covering of slab in open drain in Kainsir, Densargi and Singhpali of Ward No - 20, Under SMC",Works,Open Tender,Percentage,Civil Works - Others,No,No,NA ,17-Dec-2025 11:00 AM,NA ,120.0,No ,No,Online,29-Dec-2025 11:00 AM,Municipal Bodies||Sambalpur Municipal Corporation,SAMBALPUR MUNICIPAL CORPORATION,768006.0,1.0,"34,20,995",AJIT PADHIARY,"3,420,995",Rejected-Technical,28-Apr-2026,Municipal Bodies||Sambalpur Municipal Corporation
2025_ORULB_121600_6,EO/ JSPURM/W-02/2025-26,Repair and Renovation of Hatbazar Park in Ward No.14,Repair and Renovation of Hatbazar Park in Ward No.14,Works,Open Tender,Percentage,Civil Works - Others,No,No,NA ,21-Nov-2025 11:00 AM,NA ,60.0,No ,No,Online,15-Dec-2025 11:00 AM,Municipal Bodies||Jagatsinghpur Municipality,Repair and Renovation of Hatbazar Park in Ward No.,754103.0,1.0,"3,12,585",MANOJ SINGH,"315,706",Rejected-Finance,08-Apr-2026,Municipal Bodies||Jagatsinghpur Municipality
2026_CEBML_124499_3,e-Procurement Notice No.ACEBIC/BLS-03/2025-26,11/25-26 of ACE/BIC Improvement to road on OCC Range-IV (B) right bank from Chaulpura School to Adivasi Sahi.,Improvement to road,Works,National Competitive Bid,Percentage,Civil Works - Roads,No,No,NA ,13-Jan-2026 10:00 AM,NA ,90.0,No ,No,Online,29-Jan-2026 11:00 AM,"CE-BM,BSB Basin,Laxmiposi||SE,Baripada Irr.Circle,Takatpur",Balasore,756001.0,2.0,"2,34,99,002",VISHAL DAS,"19,976,501.42",Rejected-Finance,17-Apr-2026,"CE-BM,BSB Basin,Laxmiposi||SE,Baripada Irr.Circle,Takatpur"
2025_ORULB_122591_29,22/SMC_SBP/2025-26,"Construction of road from Bhaskara Nayak house to Rubi rani Sharma house Haragouri Vihar colony,Ainthapali ward no-28, under SMC Sambalpur","Construction of road from Bhaskara Nayak house to Rubi rani Sharma house Haragouri Vihar colony,Ainthapali ward no-28, under SMC Sambalpur",Works,Open Tender,Percentage,Civil Works - Others,No,No,NA ,09-Dec-2025 11:00 AM,NA ,120.0,No ,No,Online,19-Dec-2025 11:00 AM,Municipal Bodies||Sambalpur Municipal Corporation,SAMBALPUR MUNICIPAL CORPORATION,768006.0,1.0,"33,88,087",AJIT PADHIARY,"3,388,087.09",Rejected-Technical,23-Apr-2026,Municipal Bodies||Sambalpur Municipal Corporation
2026_CERWI_126189_1,16/EE/RWD/AND/2025-26,"Periodical Maintenance of Kumuda to Kadabahali Road (SDBC and Potholes Repair) from 0/200Km to 2/000Km, 2/250Km to 6/500Km for the year 2025-26","Periodical Maintenance of Kumuda to Kadabahali Road (SDBC and Potholes Repair) from 0/200Km to 2/000Km, 2/250Km to 6/500Km for the year 2025-26",Works,Open Tender,Percentage,Civil Works - Roads,No,No,NA ,17-Feb-2026 03:00 PM,NA ,90.0,No ,No,Online,24-Feb-2026 11:30 AM,CE RW I||RWCIRCLE-KEONJHAR||RWDIVISION-ANANDAPUR,Salapada,758020.0,1.0,"61,01,630",ABHIRAM SAHU,"4,546,325",Accepted-AOC,06-Apr-2026,CE RW I||RWCIRCLE-KEONJHAR||RWDIVISION-ANANDAPUR
2025_STSCD_120385_21,ITDAKCD-01/2025-26,Construction of Additional Classroom at Katangpani Ashram School,Construction of Additional Classroom at Katangpani Ashram School,Works,Open Tender,Percentage,Civil Works - Buildings,No,No,NA ,31-Oct-2025 09:00 AM,NA ,90.0,No ,No,Online,10-Nov-2025 10:00 AM,ST and SC Development Deptt||ITDA Kuchinda,JAMANKIRA,768107.0,1.0,"28,97,934",BHESAJA KUMAR PATTA,"2,703,772",Rejected-Technical,21-Feb-2026,ST and SC Development Deptt||ITDA Kuchinda
2026_ORULB_124261_1,CMC)CTC_Div-IIINo.34/25-26,Construction of road at Bramhakumari Ashram lane in Ward No.43.,Construction of road at Bramhakumari Ashram lane in Ward No.43.,Works,Open Tender,Percentage,Civil Works - Others,No,No,NA ,22-Jan-2026 11:00 AM,NA ,105.0,No ,No,Online,09-Feb-2026 10:00 AM,Municipal Bodies||Cuttack Municipal Corporation,CMC,753012.0,1.0,"11,21,675",SRI AJAYA KUMAR BEHERA,"1,166,542",Rejected-AOC,16-Apr-2026,Municipal Bodies||Cuttack Municipal Corporation
2026_IKBBJ_127057_2,SETCD-06/25-26 (III),Development of Right Bank from RD 0.00 m to 60 m. and left side bank from RD 60.00 m to 400 m. of Tokiguda Sub-Minor-II including structures to use as service Road,Canal Structural Works,Works,Open Tender,Percentage,Civil Works - Canal,No,No,NA ,17-Mar-2026 10:00 AM,NA ,90.0,No ,No,Online,23-Mar-2026 04:00 PM,CE AND BM IK BASIN BARINIPUT JEYPORE,Ambaguda,764055.0,1.0,"5,24,689",SRIKANTA ACHARYA,"524,689",Rejected-Finance,24-Apr-2026,CE AND BM IK BASIN BARINIPUT JEYPORE
2025_STSCD_121639_12,ITDANBG-02/25-26,Improvement of road from Koilupara to Bonipadar in Tohara GP under Umerkote Block,Improvement of road from Koilupara to Bonipadar in Tohara GP under Umerkote Block,Works,Open Tender,Percentage,Civil Works - Roads,No,No,NA ,20-Nov-2025 05:00 PM,NA ,90.0,No ,No,Online,09-Dec-2025 03:00 PM,ST and SC Development Deptt||ITDA Nabarangpur,Nabarangpur,764059.0,1.0,"8,83,964",ABHIMANYU SWAIN,"751,458",Rejected-Finance,20-Mar-2026,ST and SC Development Deptt||ITDA Nabarangpur
2026_CERWI_124918_4,Tenderonline SBPR-18 of 25-26,AMP OF PWD road to Sankhala road for t he year 25-26,AMP OF PWD road to Sankhala road for t he year 25-26,Works,Open Tender,Percentage,Civil Works - Roads,No,No,NA ,21-Jan-2026 12:00 PM,NA ,90.0,No ,No,Online,31-Jan-2026 10:00 AM,CE RW I||RWCIRCLE-SAMBALPUR||RWDIVISION-SAMBALPUR,Sambalpur,768001.0,1.0,"37,82,000",TAPESWAR NAIK,"3,018,830",Rejected-Technical,17-Apr-2026,CE RW I||RWCIRCLE-SAMBALPUR||RWDIVISION-SAMBALPUR
2026_CERWI_124615_7,NCB 17 OF 2025-26,"Periodical Maintenance to Dhanabeni to Mirgikhoji from ch 0/000 to 2/120, 2/290 to 4/574 ,5/112 to 5/300 , 5/440 to 6/544 for the year 2025- 26.","Periodical Maintenance to Dhanabeni to Mirgikhoji from ch 0/000 to 2/120, 2/290 to 4/574 ,5/112 to 5/300 , 5/440 to 6/544 for the year 2025- 26.",Works,National Competitive Bid,Percentage,Civil Works - Roads,No,No,NA ,15-Jan-2026 05:30 PM,NA ,90.0,No ,No,Online,21-Jan-2026 11:00 AM,CE RW I||RWCIRCLE-KEONJHAR||RWDIVISION-KEONJHAR,KEONJHAR,758001.0,2.0,"90,63,000",SWAGAT RANJAN BISWAL,"9,063,008",Rejected-AOC,06-Apr-2026,CE RW I||RWCIRCLE-KEONJHAR||RWDIVISION-KEONJHAR
