2026_PHEO_126690_1,ACEPHBGR 19/2025-26,Construction of 1st Floor of F - type staff quarter in the premises of 2.25 MLD water treatment plant at Binika,Construction of 1st Floor of F - type staff quarter in the premises of 2.25 MLD water treatment plant at Binika,Works,National Competitive Bid,Percentage,Civil Works - Water Works,No,No,NA ,26-Feb-2026 06:55 PM,NA ,120.0,No ,No,Online,12-Mar-2026 04:00 PM,PHEO||PH Circle Bhawanipatna||PH Division Balangir,Binika NAC,767019.0,1.0,"20,62,149",ANANDA KUMAR PANDA,"2,060,087",Rejected-Finance,30-Apr-2026,PHEO||PH Circle Bhawanipatna||PH Division Balangir
2026_CERWI_125248_4,Online Tender-15 RWD Kuchinda 2025-26,S/R to Road from Kaliadihi to Kandhakulei such as laying of SDBC from Ch 0/000 to 2/000 to 3/027 Km in the district of Sambalpur for the year 2025-26.,S/R to Road from Kaliadihi to Kandhakulei such as laying of SDBC from Ch 0/000 to 2/000 to 3/027 Km in the district of Sambalpur for the year 2025-26.,Works,National Competitive Bid,Percentage,Civil Works - Roads,No,No,NA ,31-Jan-2026 09:00 AM,NA ,90.0,No ,No,Online,06-Feb-2026 11:00 AM,CE RW I||RWCIRCLE-SAMBALPUR||RW Division Kuchinda,Kuchinda,768222.0,1.0,"13,89,477",SOMARENDRA PATTA (S.T),"1,094,769",Accepted-AOC,25-Mar-2026,CE RW I||RWCIRCLE-SAMBALPUR||RW Division Kuchinda
2026_CERWI_124723_3,Online Tender 12/GJP/2025-26,Repair and Renovation of 06 no of Old quarter at Garabandha Police Station and 02 no. of F type quarter at Gurandi Police Station in the district of Gajapati for the year 2025-26.,Repair and Renovation of 06 no of Old quarter at Garabandha Police Station and 02 no. of F type quarter at Gurandi Police Station in the district of Gajapati for the year 2025-26.,Works,Open Tender,Percentage,Civil Works - Buildings,No,No,NA ,17-Jan-2026 04:00 PM,NA ,90.0,No ,No,Online,28-Jan-2026 11:00 AM,CE RW I||RWCIRCLE-RAYAGADA||RWDIVISION-GAJAPATI,"EXECUTIVE ENGINEER, RURAL WORKS DIVISION GAJAPATI",761200.0,1.0,"2,52,000",GOTTIPILLI NABIN,"180,626",Rejected-AOC,13-Apr-2026,CE RW I||RWCIRCLE-RAYAGADA||RWDIVISION-GAJAPATI
2026_STSCD_124447_5,ITDA (T)-05 / 2025-26,Construction Of Staff Quarter At Parposhi Ashram School In Tileibani block,Construction Of Staff Quarter At Parposhi Ashram School In Tileibani block,Works,Open Tender,Percentage,Civil Works - Buildings,No,No,NA ,12-Jan-2026 10:00 AM,NA ,90.0,No ,No,Online,28-Jan-2026 10:00 AM,ST and SC Development Deptt||ITDA Tileibani,Parposhi Ashram School,768119.0,1.0,"15,98,597",BINAPANI PATEL,"1,259,535",Rejected-AOC,21-Apr-2026,ST and SC Development Deptt||ITDA Tileibani
2025_ORULB_120460_12,EOMKG/01/2025-26,"Construction of Paver Road from Sudhir Suna house to 119 Colony Road, Ward No-10, Malkangiri Municipality","Construction of Paver Road from Sudhir Suna house to 119 Colony Road, Ward No-10, Malkangiri Municipality",Works,Open Tender,Percentage,Civil Works - Roads,No,No,NA ,04-Nov-2025 10:00 AM,NA ,180.0,No ,No,Online,17-Nov-2025 11:00 AM,Municipal Bodies||Malkangiri Municipal Council,Malkangiri Municipality,764045.0,2.0,"3,06,226",BHIMA MADAKAMI,"303,163",Accepted-AOC,16-Jan-2026,Municipal Bodies||Malkangiri Municipal Council
2025_ORULB_121427_64,PIPILI-NAC-5(71)/2025-26,Construction of CC road from Main Road to Papana House in Ward no 14,Construction of CC road from Main Road to Papana House in Ward no 14,Works,Open Tender,Percentage,Civil Works - Others,No,No,NA ,27-Nov-2025 12:00 PM,NA ,90.0,No ,No,Online,09-Dec-2025 11:00 AM,Municipal Bodies||Pipli NAC,Pipli NAC,752104.0,1.0,"4,23,767",MRUTYUNJAYA SAMANTARAY,"423,833.49",Accepted-AOC,14-Apr-2026,Municipal Bodies||Pipli NAC
2025_STSCD_121904_6,ITDASNG-05/2025-26,Construction of 50 seated PSH building at Gundiadihi in Lephripara Block,Construction of 50 seated PSH building at Gundiadihi in Lephripara Block,Works,National Competitive Bid,Percentage,Civil Works - Buildings,No,No,NA ,28-Nov-2025 11:00 AM,NA ,90.0,No ,No,Online,17-Dec-2025 11:00 AM,ST and SC Development Deptt||ITDA Sundergarh,Sundargarh,770001.0,2.0,"1,64,14,840",BHABANI SHANKAR PATEL,"13,954,264",Rejected-AOC,07-Apr-2026,ST and SC Development Deptt||ITDA Sundergarh
2026_PHEO_124255_2,NIT No.14 Dtd.24.12.2025 (2),"Laying of raising main and const. of MBR in Meghamalatota pump house and Automation of zonal pump house in Jeypore Municipality under State Plan, D.No.13-4215 SUJALA for the Year 2025-26",Laying of raising main and const. of MBR in Meghamalatota pump house and Automation of zonal pump house in Jeypore Municipality,Works,National Competitive Bid,Percentage,Civil Works - Water Works,No,No,NA ,06-Jan-2026 01:00 PM,NA ,120.0,No ,No,Online,19-Jan-2026 11:00 AM,PHEO||PH Circle Bhawanipatna||PH Division Koraput,Jeypore,764001.0,2.0,"4,18,92,169",ADITYA ENGINEERING SERVICES,"33,006,841",Rejected-Finance,28-Apr-2026,PHEO||PH Circle Bhawanipatna||PH Division Koraput
2026_ORULB_125192_4,GUN-MUN-78/2025-26,Construction of Cultural Mandap at Vedanta Ashram in Ward No. 16,Construction of Cultural Mandap at Vedanta Ashram in Ward No. 16,Works,Open Tender,Percentage,Civil Works - Buildings,No,No,NA ,01-Feb-2026 11:00 AM,NA ,90.0,No ,No,Online,11-Feb-2026 11:00 AM,Municipal Bodies||Gunupur Municipal Council,Gunupur Municipality area,765022.0,1.0,"8,47,459",CHAPILI WASU,"847,459.94",Rejected-Finance,27-Apr-2026,Municipal Bodies||Gunupur Municipal Council
2026_ORULB_126678_25,37/SMC_SBP/2025-26,Rejuvenation of Kabaristan pond in ward no-32.,Rejuvenation of Kabaristan pond in ward no-32.,Works,Open Tender,Percentage,Civil Works - Others,No,No,NA ,06-Mar-2026 11:00 AM,NA ,120.0,No ,No,Online,17-Mar-2026 11:00 AM,Municipal Bodies||Sambalpur Municipal Corporation,Sambalpur Municipal Corporation,768006.0,1.0,"18,37,967",ABDUL AZIZ ANSARY,"1,837,966.97",Rejected-Technical,16-Apr-2026,Municipal Bodies||Sambalpur Municipal Corporation
2026_CEBML_124906_1,05MBJ/2025-26(2),Restoration to bank protection work on the left and right bank of Chipat Nallah near Shamshan ghat under Baripada block,bank protection work,Works,National Competitive Bid,Percentage,Civil Works - Others,No,No,NA ,22-Jan-2026 10:00 AM,NA ,90.0,No ,No,Online,07-Feb-2026 11:00 AM,"CE-BM,BSB Basin,Laxmiposi||SE,Baripada Irr.Circle,Takatpur||EE, Mayurbhanj Irr.Divn,Baripada",Baripada,757002.0,2.0,"75,25,714",AKASH BARIK,"8,871,463",Accepted-AOC,13-Apr-2026,"CE-BM,BSB Basin,Laxmiposi||SE,Baripada Irr.Circle,Takatpur||EE, Mayurbhanj Irr.Divn,Baripada"
2026_CEMIB_124116_3,14/BMID/2025-2026,Improvement to Pathuriaghat Check Dam near village Hatipali of Ghikundi GP in Kantamal Block of Boudh District,Improvement to Pathuriaghat Check Dam near village Hatipali of Ghikundi GP in Kantamal Block of Boudh District,Works,Open Tender,Percentage,Civil Works - Others,No,No,NA ,03-Jan-2026 10:00 AM,NA ,90.0,No ,No,Online,13-Jan-2026 11:00 AM,"CE,Minor Irrigation,BBSR||Phulbani Minor Irrigation Circle Phulbani||MI Division Kandhamal",Kantamal,762017.0,1.0,"8,49,756",AJIT RAJAHANSA,"848,906.09",Rejected-Finance,15-Apr-2026,"CE,Minor Irrigation,BBSR||Phulbani Minor Irrigation Circle Phulbani||MI Division Kandhamal"
2026_CERWI_125255_1,"On line K,Nagar 25(2025-26)",Repair to Bridge approach over Ramial Nallah at 3rd KM on Mathakargola to Arakhapal Jiral Road,Repair to Bridge approach over Ramial Nallah at 3rd KM on Mathakargola to Arakhapal Jiral Road,Works,Open Tender,Percentage,Civil Works - Roads,No,No,NA ,31-Jan-2026 09:00 AM,NA ,30.0,No ,No,Online,05-Feb-2026 05:30 PM,CE RW I||RWCIRCLE-ANGUL||RWDIVISION-KAMAKSHYANAGAR,Kamakhyanagar,759018.0,1.0,"42,37,000",Bishnu Prasad Sahoo,"4,032,411",Rejected-Technical,30-Apr-2026,CE RW I||RWCIRCLE-ANGUL||RWDIVISION-KAMAKSHYANAGAR
2025_ORULB_122921_8,P.M. 05/2025-26,Construction of Road at Raghunath Nagar in ward No-05,CIVIL,Works,Open Tender,Percentage,Civil Works - Others,No,No,NA ,16-Dec-2025 03:00 PM,NA ,120.0,No ,No,Online,30-Dec-2025 11:00 AM,Municipal Bodies||Puri Municipality,PURI MUNICIPALITY,752001.0,1.0,"12,37,083",ASIT KUMAR MEKAP,"1,051,644.48",Rejected-Finance,22-Apr-2026,Municipal Bodies||Puri Municipality
2025_ORULB_123875_5,MC(CMC)CTC_Div-I_No.18/2025-26,Repair of drain with cover slab from Shovaniya Sikshya Ashram Chhaka to near Maheswar Hotel at Bidanasi in Ward No. 2.,Repair of drain with cover slab from Shovaniya Sikshya Ashram Chhaka to near Maheswar Hotel at Bidanasi in Ward No. 2.,Works,Open Tender,Percentage,Civil Works - Others,No,No,NA ,02-Jan-2026 01:00 PM,NA ,90.0,No ,No,Online,17-Jan-2026 11:00 AM,Municipal Bodies||Cuttack Municipal Corporation,CMC,753012.0,1.0,"10,90,500",GOPABANDHU ROUTRAY,"926,929",Rejected-AOC,22-Apr-2026,Municipal Bodies||Cuttack Municipal Corporation
2026_CERWI_126735_2,17/EE/RWD/AND/2025-26,Periodical Maintenance of RD road to Khasapada Road Pot hole repair with PMC and Sealcoat from 0/00km to 5/810km for the year 2025-26,Periodical Maintenance of RD road to Khasapada Road Pot hole repair with PMC and Sealcoat from 0/00km to 5/810km for the year 2025-26,Works,Open Tender,Percentage,Civil Works - Roads,No,No,NA ,27-Feb-2026 05:00 PM,NA ,90.0,No ,No,Online,06-Mar-2026 11:30 AM,CE RW I||RWCIRCLE-KEONJHAR||RWDIVISION-ANANDAPUR,Salapada,758020.0,1.0,"38,13,526",ADARSHA PATTANAYAK,"3,813,526",Rejected-AOC,06-Apr-2026,CE RW I||RWCIRCLE-KEONJHAR||RWDIVISION-ANANDAPUR
2026_OLIC_125168_1,BID ID NO. 654 (OLIC/2025-26) DATED 21.01.2026,Installation and Energisation of Mahupura II TW LIP under Badasahi Block in Mayurbhanj District,Installation and Energisation of Mahupura II TW LIP under Badasahi Block in Mayurbhanj District,Works,Open Tender,Percentage,Civil Works - Lift Irrigation Schemes,No,No,NA ,31-Jan-2026 11:00 AM,NA ,180.0,No ,No,Online,11-Feb-2026 11:00 AM,Orissa Lift Irrigation Corporation||LI BALASORE||LI Division Baripada,Baripada,757002.0,2.0,"19,28,172",KARTIK CHANDRA BISWAL,"2,272,968",Rejected-AOC,17-Apr-2026,Orissa Lift Irrigation Corporation||LI BALASORE||LI Division Baripada
2026_CEMIB_125276_2,07 (BGR)/ 2025-26,Construction of Harbhanga-I Check Dam in Agalpur Block Of Balangir District Under The scheme MATY 3.0 for the year 2025-26,Construction of Harbhanga-I Check Dam in Agalpur Block Of Balangir District Under The scheme MATY 3.0 for the year 2025-26,Works,Open Tender,Percentage,Civil Works - Water Works,No,No,NA ,02-Feb-2026 10:00 AM,NA ,90.0,No ,No,Online,12-Feb-2026 10:00 AM,"CE,Minor Irrigation,BBSR||Balangir Minor Irrigation Circle Balangir||MI Division Balangir",Agalpur,767022.0,2.0,"72,23,903",ABHIJIT PANIGRAHI,"8,183,237",Rejected-Finance,02-Apr-2026,"CE,Minor Irrigation,BBSR||Balangir Minor Irrigation Circle Balangir||MI Division Balangir"
2025_PHEO_123236_1,NIT No.11 of 2025-26 ACE,"Automation of 5 and 2.27 MLD Zonal reservoir and other ancillary work at Malkangiri under State Plan, D.No.13-4215 SUJALA for the Year 2025-26",Automation of 5 and 2.27 MLD Zonal reservoir and other ancillary work at Malkangiri,Works,National Competitive Bid,Percentage,Civil Works - Water Works,No,No,NA ,18-Dec-2025 04:30 PM,NA ,120.0,No ,No,Online,31-Dec-2025 11:00 AM,PHEO||PH Circle Bhawanipatna||PH Division Koraput,Malkangiri,764045.0,2.0,"4,80,86,733",ADITYA ENGINEERING SERVICES,"43,282,868",Accepted-AOC,15-Apr-2026,PHEO||PH Circle Bhawanipatna||PH Division Koraput
2025_ORULB_122362_31,SOROM_06_2025-26,Construction of CC Drain with Paver Road from Pwd Rod to Uma sir House in Ward No.- 08,Construction work,Works,Open Tender,Percentage,Civil Works - Others,No,No,NA ,05-Dec-2025 10:00 AM,NA ,120.0,No ,No,Online,16-Dec-2025 10:00 AM,Municipal Bodies||Soro Municipality,"Soro Municipality, Soro",756045.0,1.0,"4,23,729",NIKHAT JAHAN,"360,212.03",Rejected-Finance,06-Apr-2026,Municipal Bodies||Soro Municipality
2025_ORULB_122362_25,SOROM_06_2025-26,Construction of Drain from Lingapada PWD road to Basanta Mohanty house in W.No-07,Construction work,Works,Open Tender,Percentage,Civil Works - Others,No,No,NA ,05-Dec-2025 10:00 AM,NA ,120.0,No ,No,Online,16-Dec-2025 10:00 AM,Municipal Bodies||Soro Municipality,"Soro Municipality, Soro",756045.0,1.0,"1,86,441",MANOJ KUMAR MANDAL,"158,493.58",Rejected-Finance,04-Apr-2026,Municipal Bodies||Soro Municipality
2026_ORULB_125170_3,CHM-06/2025-26,Repair and Renovation of Bijupattanaik Stadium in ward no 02 Choudwar Municipality,Repair and Renovation of Bijupattanaik Stadium in ward no 02 Choudwar Municipality,Works,Open Tender,Percentage,Civil Works - Others,No,No,NA ,30-Jan-2026 11:00 AM,NA ,90.0,No ,No,Online,18-Feb-2026 11:00 AM,Municipal Bodies||Choudwar Municipality,Choudwar,754071.0,1.0,"33,76,864",BABULI BIRUA,"3,376,864",Rejected-Finance,27-Apr-2026,Municipal Bodies||Choudwar Municipality
2026_CERWI_126121_3,TCN18 of 2025-26,Periodical Maintenance to Sanandapur Haripur Via Sahada Road for the Year 2025-26,Repairs of Roads,Works,Open Tender,Percentage,Civil Works - Roads,No,No,NA ,16-Feb-2026 04:45 PM,NA ,90.0,No ,No,Online,21-Feb-2026 05:30 PM,CE RW I||RWCIRCLE-BALASORE||RWDIVISION-BHADRAK,Bhadrak,756100.0,1.0,"19,49,445",Ajit Kumar Lenka,"1,657,223",Accepted-AOC,23-Apr-2026,CE RW I||RWCIRCLE-BALASORE||RWDIVISION-BHADRAK
2025_ORULB_122362_19,SOROM_06_2025-26,Construction of Road and Drain From Sanu Khan House To Kabarstan Main Road in Ward No.- 05,Construction work,Works,Open Tender,Percentage,Civil Works - Others,No,No,NA ,05-Dec-2025 10:00 AM,NA ,120.0,No ,No,Online,16-Dec-2025 10:00 AM,Municipal Bodies||Soro Municipality,"Soro Municipality, Soro",756045.0,1.0,"2,71,186",NIKHAT JAHAN,"230,534.82",Rejected-Finance,04-Apr-2026,Municipal Bodies||Soro Municipality
2026_CEMIB_124114_1,14/BMID/2025-2026,Construction of Dhakadhaki Nala Check Dam near village Dhundigora of Bilashpur GP in Kantamal Block of Boudh District under MATY Scheme for the year 2025-26,Construction of Dhakadhaki Nala Check Dam near village Dhundigora of Bilashpur GP in Kantamal Block of Boudh District under MATY Scheme for the year 2025-26,Works,Open Tender,Percentage,Civil Works - Others,No,No,NA ,03-Jan-2026 10:00 AM,NA ,90.0,No ,No,Online,13-Jan-2026 11:00 AM,"CE,Minor Irrigation,BBSR||Phulbani Minor Irrigation Circle Phulbani||MI Division Kandhamal",Kantamal,762017.0,2.0,"98,32,805",AJIT KARNA,"8,358,867.82",Rejected-AOC,13-Apr-2026,"CE,Minor Irrigation,BBSR||Phulbani Minor Irrigation Circle Phulbani||MI Division Kandhamal"
2026_CEMIB_125971_2,BMIC-BLGR/04/2025-26,Construction of Dameipali Check Dam over Katangi Nalla near village Dameipali in Khaprakhol Block of Balangir District under MATY-3.0 for the year 2025-26.,Construction of Dameipali Check Dam over Katangi Nalla near village Dameipali in Khaprakhol Block of Balangir District under MATY-3.0 for the year 2025-26.,Works,Open Tender,Percentage,Civil Works - Water Works,No,No,NA ,13-Feb-2026 10:00 AM,NA ,90.0,No ,No,Online,24-Feb-2026 11:00 AM,"CE,Minor Irrigation,BBSR||Balangir Minor Irrigation Circle Balangir",Khaprakhol,767028.0,2.0,"1,04,12,978",AJAY KUMAR AGRAWAL,"12,275,027",Rejected-Finance,22-Apr-2026,"CE,Minor Irrigation,BBSR||Balangir Minor Irrigation Circle Balangir"
2026_CEBBU_124274_1,SESID-06(01)/2025-26,Flood Works,Flood Protection to Porpotta Nallah near village Mandiapura of Bamra Block under Sambalpur District for the year 2025-26.,Works,Open Tender,Percentage,Civil Works - Others,No,No,NA ,07-Jan-2026 11:00 AM,NA ,90.0,No ,No,Online,17-Jan-2026 11:00 AM,"CE-BM,UM Basin,Burla||SE,Hirakud Dam Circle,Burla||EE,Sambalpur Irr.Divn,Burla","Bamra, Sambalpur",768221.0,1.0,"41,49,921",GAGAN BIHARI DASH,"3,402,936",Rejected-AOC,24-Apr-2026,"CE-BM,UM Basin,Burla||SE,Hirakud Dam Circle,Burla||EE,Sambalpur Irr.Divn,Burla"
2026_EICCL_125101_1,S.E. (R and B) - 24/2025-26/NGP,S/R to Road from MANGALAM TIMBER to GANDHI NAGAR from Ch. 0/000 Km to 1/000 Km) in the Dist of Nabarangpur for the year 2025-26.,Civil Works,Works,Open Tender,Percentage,Civil Works - Roads,No,No,NA ,28-Jan-2026 11:00 AM,NA ,90.0,No ,No,Online,07-Feb-2026 11:00 AM,EIC-CIVIL||SERNB-CIRCLE-JEYPORE||EERNB Division Nabarangpur,Nabarangapur,764059.0,1.0,"39,16,430",AKASH BISSOI,"3,916,430",Rejected-Finance,20-Apr-2026,EIC-CIVIL||SERNB-CIRCLE-JEYPORE||EERNB Division Nabarangpur
2025_STSCD_122322_8,ITDAGNP-03/2025-26,Construction of dormitory at Hakuspanga Ashram School under Chandrapur Block,Construction of dormitory at Hakuspanga Ashram School under Chandrapur Block,Works,Open Tender,Percentage,Civil Works - Buildings,No,No,NA ,01-Dec-2025 10:00 AM,NA ,90.0,No ,No,Online,16-Dec-2025 11:00 AM,ST and SC Development Deptt||ITDA Gunupur,Gunupur,765022.0,2.0,"23,49,577",CHINMAY NAYAK,"1,997,329.85",Rejected-Finance,24-Apr-2026,ST and SC Development Deptt||ITDA Gunupur
2026_CEMIB_125971_3,BMIC-BLGR/04/2025-26,Construction of Jiratmal-II Check Dam over Sagjore Nalla near village Jiratmal in Balangir Block of Balangir District under MATY-3.0 for the year 2025-26.,Construction of Jiratmal-II Check Dam over Sagjore Nalla near village Jiratmal in Balangir Block of Balangir District under MATY-3.0 for the year 2025-26.,Works,Open Tender,Percentage,Civil Works - Water Works,No,No,NA ,13-Feb-2026 10:00 AM,NA ,90.0,No ,No,Online,24-Feb-2026 11:00 AM,"CE,Minor Irrigation,BBSR||Balangir Minor Irrigation Circle Balangir",Balangir,767001.0,2.0,"1,01,67,514",ABANI PRAKASH MISHRA,"11,985,669",Accepted-Finance,24-Apr-2026,"CE,Minor Irrigation,BBSR||Balangir Minor Irrigation Circle Balangir"
2026_CERWI_126121_2,TCN18 of 2025-26,Periodical Maintenance to Guamala Talagopa for the Year 2025-26,Repairs of Roads,Works,Open Tender,Percentage,Civil Works - Roads,No,No,NA ,16-Feb-2026 04:45 PM,NA ,90.0,No ,No,Online,21-Feb-2026 05:30 PM,CE RW I||RWCIRCLE-BALASORE||RWDIVISION-BHADRAK,Bhadrak,756100.0,1.0,"14,61,854",PRASANTA KUMAR SAHU,"1,242,722",Rejected-AOC,23-Apr-2026,CE RW I||RWCIRCLE-BALASORE||RWDIVISION-BHADRAK
2025_ORULB_122362_24,SOROM_06_2025-26,Construction Of Welcome Gate at Lingapada Main Road in W.No- 06,Construction work,Works,Open Tender,Percentage,Civil Works - Others,No,No,NA ,05-Dec-2025 10:00 AM,NA ,120.0,No ,No,Online,16-Dec-2025 10:00 AM,Municipal Bodies||Soro Municipality,"Soro Municipality, Soro",756045.0,1.0,"5,08,475",MANARANJAN PRADHAN,"432,254.67",Rejected-Finance,04-Apr-2026,Municipal Bodies||Soro Municipality
2026_OHPCL_124272_1,RHEP/ TCN No.-53/2025-26,"Sinking of 03 nos. 200mm x150 mm size production well at Electrical Colony, 12D Colony and 40E Colony of RHEP, Rengali for drinking water supply.","Sinking of 03 nos. 200mm x150 mm size production well at Electrical Colony, 12D Colony and 40E Colony of RHEP, Rengali for drinking water supply.",Works,Open Tender,Percentage,Civil Works - Others,No,No,NA ,07-Jan-2026 10:00 AM,NA ,120.0,No ,No,Online,17-Jan-2026 11:30 AM,Odisha Hydro Power Corporation Ltd||Rengali H.E. Project Rengali,"RHEP, Rengali",759105.0,2.0,,ABHIMANYU MOHANTY,"478,357",Rejected-AOC,18-Mar-2026,Odisha Hydro Power Corporation Ltd||Rengali H.E. Project Rengali
2026_EICCL_124669_1,QCN.S.E.KHD(RandB)03,"Temporary Power backup of DG set for celebration of Republic Day at BJB High School Ground, Khordha and illumination of PWD offices and Collectorate Offices and Res for Republic Day 2026 at Khordha.","Temporary Power backup of DG set for celebration of Republic Day at BJB High School Ground, Khordha and illumination of PWD offices and Collectorate Offices and Res for Republic Day 2026 at Khordha.",Works,Open Tender,Item Rate,Electrical Works,No,No,NA ,16-Jan-2026 04:00 PM,NA ,90.0,No ,No,Online,21-Jan-2026 04:30 PM,EIC-CIVIL||SERNB-CIRCLE-KHURDA||EERNB DIVN KHURDA,Khordha,752056.0,1.0,"2,17,804",linkan sahoo,"217,804",Accepted-AOC,13-Apr-2026,EIC-CIVIL||SERNB-CIRCLE-KHURDA||EERNB DIVN KHURDA
2026_ORULB_125170_2,CHM-06/2025-26,Beautification of Biju Pattanaik Market Complex in ward no 09 Choudwar Municipality,Beautification of Biju Pattanaik Market Complex in ward no 09 Choudwar Municipality,Works,Open Tender,Percentage,Civil Works - Others,No,No,NA ,30-Jan-2026 11:00 AM,NA ,90.0,No ,No,Online,18-Feb-2026 11:00 AM,Municipal Bodies||Choudwar Municipality,Choudwar,754071.0,1.0,"33,84,434",BHAGYADHAR SAHOO,"2,595,860",Rejected-Finance,27-Apr-2026,Municipal Bodies||Choudwar Municipality
2026_STSCD_125094_6,ITDATHR-04/2025-26,Construction of Additional Class Room at Madhupur High School,Construction of Additional Class Room at Madhupur High School,Works,National Competitive Bid,Percentage,Civil Works - Buildings,No,No,NA ,29-Jan-2026 11:00 AM,NA ,120.0,No ,No,Online,12-Feb-2026 11:00 AM,ST and SC Development Deptt||ITDA Th. Rampur,KALAHANDI/BHAWANIPATNA,766001.0,2.0,"20,76,794",AJAYA KUMAR BOHIDAR,"2,007,636.5",Rejected-Finance,28-Apr-2026,ST and SC Development Deptt||ITDA Th. Rampur
2026_STSCD_125547_1,ITDABPD-06/2025-26,"Construction of 200 Seated Boys Hostel Building At Chaitanya Prasad High School, Dhenkinenjia Under Baripada.","Construction of 200 Seated Boys Hostel Building At Chaitanya Prasad High School, Dhenkinenjia Under Baripada.",Works,National Competitive Bid,Percentage,Civil Works - Buildings,No,No,NA ,05-Feb-2026 10:00 AM,NA ,90.0,No ,No,Online,21-Feb-2026 11:00 AM,ST and SC Development Deptt||ITDA Baripada,BARIPADA,757002.0,2.0,"5,36,28,123",ADITYA PRASAD SAMANTARAY,"40,617,940.741",Rejected-AOC,21-Apr-2026,ST and SC Development Deptt||ITDA Baripada
2026_OPEPA_125266_1,IFB-DPC SS KPT ACR 67/97 OF 2024-25,CONSTRUCTION OF 2 NOS ADDITIONAL CLASS ROOM BUILDING AT GANJEIPADAR PROJ UPS OF KORAPUT BLOCK,CONSTRUCTION OF 2 NOS ADDITIONAL CLASS ROOM BUILDING AT GANJEIPADAR PROJ UPS OF KORAPUT BLOCK,Works,Open Tender,Percentage,Civil Works - Buildings,No,No,NA ,02-Feb-2026 11:00 AM,NA ,90.0,No ,No,Online,21-Feb-2026 11:30 AM,OPEPA Bhubaneswar||Samagra Shiksha Koraput,GANJEIPADAR PROJ UPS OF KORAPUT BLOCK,764011.0,1.0,"28,76,735",BILLIAM BAGH,"2,511,390",Rejected-AOC,08-Apr-2026,OPEPA Bhubaneswar||Samagra Shiksha Koraput
2026_PRBI_126505_1,02/2025-26,"Construction of 300seated Girls Hostel at Kamgaon Higher Secondary School, Kamgaon of Bhatli Block for the year 2025-26","Civil,Electrical and PH",Works,Open Tender,Percentage,Civil Works - Buildings,No,No,NA ,25-Feb-2026 11:00 AM,NA ,90.0,No ,No,Online,12-Mar-2026 11:00 AM,Panchayati Raj and Drinking Water Department Odisha||Zilla Parisad Bargarh||BHATLI Block,PANCHAYAT SAMITI OFFICE BHATLI,768030.0,1.0,"4,06,47,809",BASANT AGRAWAL,"40,647,808.774",Rejected-Finance,20-Mar-2026,Panchayati Raj and Drinking Water Department Odisha||Zilla Parisad Bargarh||BHATLI Block
2026_CERWI_124855_11,ONLINE-EEBNI-06 of 2025-26,SR to L038-ODR to T-Girjatola in the Dist of Sundargarh for the year 2025-26,SR to L038-ODR to T-Girjatola in the Dist of Sundargarh for the year 2025-26,Works,Open Tender,Percentage,Civil Works - Roads,No,No,NA ,20-Jan-2026 06:00 PM,NA ,90.0,No ,No,Online,29-Jan-2026 11:00 AM,CE RW I||RW-CIRCLE-SUNDARGARH||RW Division Bonai,Bonai,770038.0,1.0,"28,16,253",GURDIT DANG,"2,394,096",Rejected-Finance,18-Mar-2026,CE RW I||RW-CIRCLE-SUNDARGARH||RW Division Bonai
2026_OSPHW_125315_12,26/OPHWC/2025-26,"Const. of Atal Bus Stand (C Type) at Pottangi Under Pottangi Block, Koraput",Building Work,Works,National Competitive Bid,Percentage,Civil Works - Buildings,No,No,NA ,02-Feb-2026 05:00 PM,NA ,90.0,No ,No,Online,17-Feb-2026 10:30 AM,Orissa State Police Housing and Welfare Corporation Ltd,Koraput,751022.0,2.0,"5,03,58,670",KT CONSTRUCTION,"46,450,837",Rejected-Finance,09-Apr-2026,Orissa State Police Housing and Welfare Corporation Ltd
2026_CERWI_126735_3,17/EE/RWD/AND/2025-26,Periodical Maintenance of RD road to Dudugaon Road SDBC work from 0/00km to 1/270km for the year 2025-26,Periodical Maintenance of RD road to Dudugaon Road SDBC work from 0/00km to 1/270km for the year 2025-26,Works,Open Tender,Percentage,Civil Works - Roads,No,No,NA ,27-Feb-2026 05:00 PM,NA ,90.0,No ,No,Online,06-Mar-2026 11:30 AM,CE RW I||RWCIRCLE-KEONJHAR||RWDIVISION-ANANDAPUR,Salapada,758020.0,1.0,"22,88,087",ADARSHA PATTANAYAK,"2,288,087",Rejected-AOC,06-Apr-2026,CE RW I||RWCIRCLE-KEONJHAR||RWDIVISION-ANANDAPUR
2025_PRBLP_115397_1,BPS- 01/2025-26,Construction of GPLF Office Building with Market Complex at Amanakuda G.P under Balipatna Block,As per DTCN,Works,Open Tender,Percentage,Civil Works - Buildings,No,No,NA ,11-Jul-2025 11:00 AM,24-Jul-2025 11:00 AM ,180.0,No ,No,Online,28-Jul-2025 11:00 AM,Panchayati Raj and Drinking Water Department Odisha||Zilla Parisad Khordha||BALIPATNA Block,Amanakuda,752103.0,1.0,"21,99,347",Ajit Kumar Guru,"1,869,664.82",Rejected-Technical,02-Apr-2026,Panchayati Raj and Drinking Water Department Odisha||Zilla Parisad Khordha||BALIPATNA Block
2025_ORULB_122921_9,P.M. 05/2025-26,Improvement of Road at Uday Nagar lane -5 and lane-6 with by lane in ward No-05,CIVIL,Works,Open Tender,Percentage,Civil Works - Others,No,No,NA ,16-Dec-2025 03:00 PM,NA ,120.0,No ,No,Online,30-Dec-2025 11:00 AM,Municipal Bodies||Puri Municipality,PURI MUNICIPALITY,752001.0,1.0,"16,94,629",ASHISH NANDA,"1,440,604.32",Rejected-Finance,22-Apr-2026,Municipal Bodies||Puri Municipality
2026_CEMIB_124116_2,14/BMID/2025-2026,Improvement to Gudiali Check Dam near village Gudiali of Sundhipadar GP in Kantamal Block of Boudh District,Improvement to Gudiali Check Dam near village Gudiali of Sundhipadar GP in Kantamal Block of Boudh District,Works,Open Tender,Percentage,Civil Works - Others,No,No,NA ,03-Jan-2026 10:00 AM,NA ,90.0,No ,No,Online,13-Jan-2026 11:00 AM,"CE,Minor Irrigation,BBSR||Phulbani Minor Irrigation Circle Phulbani||MI Division Kandhamal",Kantamal,762017.0,1.0,"6,46,974",AJIT RAJAHANSA,"640,503.8",Rejected-Finance,13-Apr-2026,"CE,Minor Irrigation,BBSR||Phulbani Minor Irrigation Circle Phulbani||MI Division Kandhamal"
2025_STSCD_121904_7,ITDASNG-05/2025-26,Construction of 50 seated PSH building at Daldali in Tangarpali Block,Construction of 50 seated PSH building at Daldali in Tangarpali Block,Works,National Competitive Bid,Percentage,Civil Works - Buildings,No,No,NA ,28-Nov-2025 11:00 AM,NA ,90.0,No ,No,Online,17-Dec-2025 11:00 AM,ST and SC Development Deptt||ITDA Sundergarh,Sundargarh,770001.0,2.0,"1,63,93,362",BHABANI SHANKAR PATEL,"13,935,997",Rejected-AOC,07-Apr-2026,ST and SC Development Deptt||ITDA Sundergarh
